A1: Modeling Group | B1: Country | C1: IPCC Model Designation | D1: Expt. | E1: Realization | F1: first available year | G1: first available month | H1: last available year | I1: last available month | J1: control or 20C3M simulation from which this run was initiated | K1: year in control or 20C3M simulation that corre-sponds to the first available year of this run | L1: Comment | M1: years simulated | N1: months simulated
A2: 0 | B2: 0 | C2: 0 | D2: 1%to2x | E2: 0 | F2: 0 | G2: 0 | H2: 0 | I2: 0 | J2: 0 | K2: 0 | L2: 0
A3: =BCC!F$2 -> Beijing Climate Center | B3: =BCC!F$3 -> China | C3: =BCC!F$1 -> BCC-CM1 | D3: =BCC!B6 -> 1%to2x | E3: =BCC!C6 -> Run 1 | F3: =BCC!D6 -> 1980 | G3: =BCC!E6 -> 1 | H3: =BCC!F6 -> 2280 | I3: =BCC!G6 -> 12 | J3: =BCC!H6 -> PDcntrl | K3: =BCC!I6 -> 1980 | L3: =BCC!J6 -> - | M3: =H3-F3+1 -> 301 | N3: =12*(H3-F3)+I3-G3+1 -> 3612
A4: =CCSM3!F$2 -> National Center for Atmospheric Research | B4: =CCSM3!F$3 -> USA | C4: =CCSM3!F$1 -> CCSM3 | D4: =CCSM3!B6 -> 1%to2x | E4: =CCSM3!C6 -> Run 1 | F4: =CCSM3!D6 -> 410 | G4: =CCSM3!E6 -> 1 | H4: =CCSM3!F6 -> 629 | I4: =CCSM3!G6 -> 12 | J4: =CCSM3!H6 -> PDcntrl | K4: =CCSM3!I6 -> 410 | L4: =CCSM3!J6 -> - | M4: =H4-F4+1 -> 220 | N4: =12*(H4-F4)+I4-G4+1 -> 2640
A5: ='CGCM(T47)'!F$2 -> Canadian Centre for Climate Modeling & Analysis | B5: ='CGCM(T47)'!F$3 -> Canada | C5: ='CGCM(T47)'!F$1 -> CGCM3.1(T47) | D5: ='CGCM(T47)'!B6 -> 1%to2x | E5: ='CGCM(T47)'!C6 -> Run 1 | F5: ='CGCM(T47)'!D6 -> 1850 | G5: ='CGCM(T47)'!E6 -> 1 | H5: ='CGCM(T47)'!F6 -> 2069 | I5: ='CGCM(T47)'!G6 -> 12 | J5: ='CGCM(T47)'!H6 -> Picntrl Run 1 | K5: ='CGCM(T47)'!I6 -> 1850 | L5: ='CGCM(T47)'!J6 -> - | M5: =H5-F5+1 -> 220 | N5: =12*(H5-F5)+I5-G5+1 -> 2640
A6: ='CGCM(T63)'!F$2 -> Canadian Centre for Climate Modeling & Analysis | B6: ='CGCM(T63)'!F$3 -> Canada | C6: ='CGCM(T63)'!F$1 -> CGCM3.1(T63) | D6: ='CGCM(T63)'!B6 -> 1%to2x | E6: ='CGCM(T63)'!C6 -> Run 1 | F6: ='CGCM(T63)'!D6 -> 1850 | G6: ='CGCM(T63)'!E6 -> 1 | H6: ='CGCM(T63)'!F6 -> 2069 | I6: ='CGCM(T63)'!G6 -> 12 | J6: ='CGCM(T63)'!H6 -> Picntrl Run 1 | K6: ='CGCM(T63)'!I6 -> 1850 | L6: ='CGCM(T63)'!J6 -> - | M6: =H6-F6+1 -> 220 | N6: =12*(H6-F6)+I6-G6+1 -> 2640
A7: =CNRM!F$2 -> Météo-France / Centre National de Recherches Météorologiques | B7: =CNRM!F$3 -> France | C7: =CNRM!F$1 -> CNRM-CM3 | D7: =CNRM!B6 -> 1%to2x | E7: =CNRM!C6 -> Run 1 | F7: =CNRM!D6 -> 1860 | G7: =CNRM!E6 -> 1 | H7: =CNRM!F6 -> 2080 | I7: =CNRM!G6 -> 12 | J7: =CNRM!H6 -> PIcntrl Run 1 | K7: =CNRM!I6 -> 2040 | L7: =CNRM!J6 -> - | M7: =H7-F7+1 -> 221 | N7: =12*(H7-F7)+I7-G7+1 -> 2652
A8: ='CSIRO-3.0'!F$2 -> CSIRO Atmospheric Research | B8: ='CSIRO-3.0'!F$3 -> Australia | C8: ='CSIRO-3.0'!F$1 -> CSIRO-Mk3.0 | D8: ='CSIRO-3.0'!B6 -> 1%to2x | E8: ='CSIRO-3.0'!C6 -> Run 1 | F8: ='CSIRO-3.0'!D6 -> 2001 | G8: ='CSIRO-3.0'!E6 -> 1 | H8: ='CSIRO-3.0'!F6 -> 2080 | I8: ='CSIRO-3.0'!G6 -> 12 | J8: ='CSIRO-3.0'!H6 -> PIcntrl Run 1 | K8: ='CSIRO-3.0'!I6 -> 1871 | L8: ='CSIRO-3.0'!J6 -> - | M8: =H8-F8+1 -> 80 | N8: =12*(H8-F8)+I8-G8+1 -> 960
A9: ='CSIRO-3.5'!F$2 -> CSIRO Atmospheric Research | B9: ='CSIRO-3.5'!F$3 -> Australia | C9: ='CSIRO-3.5'!F$1 -> CSIRO-Mk3.5 | D9: ='CSIRO-3.5'!B6 -> 1%to2x | E9: ='CSIRO-3.5'!C6 -> Run1 | F9: ='CSIRO-3.5'!D6 -> 2001 | G9: ='CSIRO-3.5'!E6 -> 1 | H9: ='CSIRO-3.5'!F6 -> 2080 | I9: ='CSIRO-3.5'!G6 -> 12 | J9: ='CSIRO-3.5'!H6 -> PIcntrl Run 1 | K9: ='CSIRO-3.5'!I6 -> 1871 | L9: ='CSIRO-3.5'!J6 -> initialised from end of year 170 of PIcntrl Run1. | M9: =H9-F9+1 -> 80 | N9: =12*(H9-F9)+I9-G9+1 -> 960
A10: =ECHAM5!F$2 -> Max Planck Institute for Meteorology | B10: =ECHAM5!F$3 -> Germany | C10: =ECHAM5!F$1 -> ECHAM5/MPI-OM | D10: =ECHAM5!B6 -> 1%to2x | E10: =ECHAM5!C6 -> Run 1 | F10: =ECHAM5!D6 -> 1860 | G10: =ECHAM5!E6 -> 1 | H10: =ECHAM5!F6 -> 2080 | I10: =ECHAM5!G6 -> 12 | J10: =ECHAM5!H6 -> PIcntrl | K10: =ECHAM5!I6 -> 2190 | L10: =ECHAM5!J6 -> - | M10: =H10-F10+1 -> 221 | N10: =12*(H10-F10)+I10-G10+1 -> 2652
A11: =ECHAM5!F$2 -> Max Planck Institute for Meteorology | B11: =ECHAM5!F$3 -> Germany | C11: =ECHAM5!F$1 -> ECHAM5/MPI-OM | D11: =ECHAM5!B7 -> 1%to2x | E11: =ECHAM5!C7 -> Run 2 | F11: =ECHAM5!D7 -> 1860 | G11: =ECHAM5!E7 -> 1 | H11: =ECHAM5!F7 -> 2080 | I11: =ECHAM5!G7 -> 12 | J11: =ECHAM5!H7 -> PIcntrl | K11: =ECHAM5!I7 -> 2215 | L11: =ECHAM5!J7 -> - | M11: =H11-F11+1 -> 221 | N11: =12*(H11-F11)+I11-G11+1 -> 2652
A12: =ECHAM5!F$2 -> Max Planck Institute for Meteorology | B12: =ECHAM5!F$3 -> Germany | C12: =ECHAM5!F$1 -> ECHAM5/MPI-OM | D12: =ECHAM5!B8 -> 1%to2x | E12: =ECHAM5!C8 -> Run 3 | F12: =ECHAM5!D8 -> 1860 | G12: =ECHAM5!E8 -> 1 | H12: =ECHAM5!F8 -> 2080 | I12: =ECHAM5!G8 -> 12 | J12: =ECHAM5!H8 -> PIcntrl | K12: =ECHAM5!I8 -> 2240 | L12: =ECHAM5!J8 -> - | M12: =H12-F12+1 -> 221 | N12: =12*(H12-F12)+I12-G12+1 -> 2652
A13: ='ECHO-G'!F$2 -> Meteorological Institute of the University of Bonn (MIUB), Meteorological Research Institute of KMA (METRI), and Model and Data group (M&D) | B13: ='ECHO-G'!F$3 -> Germany & Korea | C13: ='ECHO-G'!F$1 -> ECHO-G | D13: ='ECHO-G'!B6 -> 1%to2x | E13: ='ECHO-G'!C6 -> Run 1 | F13: ='ECHO-G'!D6 -> 1990 | G13: ='ECHO-G'!E6 -> 1 | H13: ='ECHO-G'!F6 -> 2300 | I13: ='ECHO-G'!G6 -> 12 | J13: ='ECHO-G'!H6 -> PDcntrl | K13: ='ECHO-G'!I6 -> 6 | L13: ='ECHO-G'!J6 -> - | M13: =H13-F13+1 -> 311 | N13: =12*(H13-F13)+I13-G13+1 -> 3732
A14: =FGOALS!F$2 -> LASG / Institute of Atmospheric Physics | B14: =FGOALS!F$3 -> China | C14: =FGOALS!F$1 -> FGOALS-g1.0 | D14: =FGOALS!B6 -> 1%to2x | E14: =FGOALS!C6 -> Run 1 | F14: =FGOALS!D6 -> 1850 | G14: =FGOALS!E6 -> 1 | H14: =FGOALS!F6 -> 2069 | I14: =FGOALS!G6 -> 12 | J14: =FGOALS!H6 -> PIcntrl Run 1 | K14: =FGOALS!I6 -> 1850 | L14: =FGOALS!J6 -> - | M14: =H14-F14+1 -> 220 | N14: =12*(H14-F14)+I14-G14+1 -> 2640
C15: =FGOALS!F$1 -> FGOALS-g1.0 | D15: =FGOALS!B7 -> 1%to2x | E15: =FGOALS!C7 -> Run 2 | F15: =FGOALS!D7 -> 1850 | G15: =FGOALS!E7 -> 1 | H15: =FGOALS!F7 -> 2069 | I15: =FGOALS!G7 -> 12 | J15: =FGOALS!H7 -> PIcntrl Run 1 | K15: =FGOALS!I7 -> 1855 | L15: =FGOALS!J7 -> - | M15: =H15-F15+1 -> 220 | N15: =12*(H15-F15)+I15-G15+1 -> 2640
A16: =FGOALS!F$2 -> LASG / Institute of Atmospheric Physics | B16: =FGOALS!F$3 -> China | C16: =FGOALS!F$1 -> FGOALS-g1.0 | D16: =FGOALS!B8 -> 1%to2x | E16: =FGOALS!C8 -> Run 3 | F16: =FGOALS!D8 -> 1850 | G16: =FGOALS!E8 -> 1 | H16: =FGOALS!F8 -> 2069 | I16: =FGOALS!G8 -> 12 | J16: =FGOALS!H8 -> PIcntrl Run 1 | K16: =FGOALS!I8 -> 1860 | L16: =FGOALS!J8 -> - | M16: =H16-F16+1 -> 220 | N16: =12*(H16-F16)+I16-G16+1 -> 2640
A17: ='GFDL-2.0'!F$2 -> US Dept. of Commerce / NOAA / Geophysical Fluid Dynamics Laboratory | B17: ='GFDL-2.0'!F$3 -> USA | C17: ='GFDL-2.0'!F$1 -> GFDL-CM2.0 | D17: ='GFDL-2.0'!B6 -> 1%to2x | E17: ='GFDL-2.0'!C6 -> Run 1 | F17: ='GFDL-2.0'!D6 -> 1 | G17: ='GFDL-2.0'!E6 -> 1 | H17: ='GFDL-2.0'!F6 -> 280 | I17: ='GFDL-2.0'!G6 -> 12 | J17: ='GFDL-2.0'!H6 -> PIcntrl Run 1 | K17: ='GFDL-2.0'!I6 -> 1 | L17: ='GFDL-2.0'!J6 -> - | M17: =H17-F17+1 -> 280 | N17: =12*(H17-F17)+I17-G17+1 -> 3360
A18: ='GFDL-2.1'!F$2 -> US Dept. of Commerce / NOAA / Geophysical Fluid Dynamics Laboratory | B18: ='GFDL-2.1'!F$3 -> USA | C18: ='GFDL-2.1'!F$1 -> GFDL-CM2.1 | D18: ='GFDL-2.1'!B6 -> 1%to2x | E18: ='GFDL-2.1'!C6 -> Run 1 | F18: ='GFDL-2.1'!D6 -> 1 | G18: ='GFDL-2.1'!E6 -> 1 | H18: ='GFDL-2.1'!F6 -> 220 | I18: ='GFDL-2.1'!G6 -> 12 | J18: ='GFDL-2.1'!H6 -> PIcntrl Run 1 | K18: ='GFDL-2.1'!I6 -> 1 | L18: ='GFDL-2.1'!J6 -> - | M18: =H18-F18+1 -> 220 | N18: =12*(H18-F18)+I18-G18+1 -> 2640
A19: ='GISS-EH'!F$2 -> NASA / Goddard Institute for Space Studies | B19: ='GISS-EH'!F$3 -> USA | C19: ='GISS-EH'!F$1 -> GISS-EH | D19: ='GISS-EH'!B6 -> 1%to2x | E19: ='GISS-EH'!C6 -> Run 1 | F19: ='GISS-EH'!D6 -> 1880 | G19: ='GISS-EH'!E6 -> 1 | H19: ='GISS-EH'!F6 -> 2139 | I19: ='GISS-EH'!G6 -> 12 | J19: ='GISS-EH'!H6 -> PIcntrl | K19: ='GISS-EH'!I6 -> 1990 | L19: ='GISS-EH'!J6 -> - | M19: =H19-F19+1 -> 260 | N19: =12*(H19-F19)+I19-G19+1 -> 3120
A20: ='GISS-ER'!F$2 -> NASA / Goddard Institute for Space Studies | B20: ='GISS-ER'!F$3 -> USA | C20: ='GISS-ER'!F$1 -> GISS-ER | D20: ='GISS-ER'!B6 -> 1%to2x | E20: ='GISS-ER'!C6 -> Run 1 | F20: ='GISS-ER'!D6 -> 1901 | G20: ='GISS-ER'!E6 -> 1 | H20: ='GISS-ER'!F6 -> 2190 | I20: ='GISS-ER'!G6 -> 12 | J20: ='GISS-ER'!H6 -> PIcntrl | K20: ='GISS-ER'!I6 -> 1981 | L20: ='GISS-ER'!J6 -> - | M20: =H20-F20+1 -> 290 | N20: =12*(H20-F20)+I20-G20+1 -> 3480
A21: =INM!F$2 -> Institute for Numerical Mathematics | B21: =INM!F$3 -> Russia | C21: =INM!F$1 -> INM-CM3.0 | D21: =INM!B6 -> 1%to2x | E21: =INM!C6 -> Run 1 | F21: =INM!D6 -> 1871 | G21: =INM!E6 -> 1 | H21: =INM!F6 -> 2090 | I21: =INM!G6 -> 12 | J21: =INM!H6 -> PIcntrl | K21: =INM!I6 -> 1871 | L21: =INM!J6 -> - | M21: =H21-F21+1 -> 220 | N21: =12*(H21-F21)+I21-G21+1 -> 2640
A22: =IPSL!F$2 -> Institut Pierre Simon Laplace | B22: =IPSL!F$3 -> France | C22: =IPSL!F$1 -> IPSL-CM4 | D22: =IPSL!B6 -> 1%to2x | E22: =IPSL!C6 -> Run 1 | F22: =IPSL!D6 -> 1860 | G22: =IPSL!E6 -> 1 | H22: =IPSL!F6 -> 2080 | I22: =IPSL!G6 -> 12 | J22: =IPSL!H6 -> PIcntrl Run 1 | K22: =IPSL!I6 -> 1860 | L22: =IPSL!J6 -> - | M22: =H22-F22+1 -> 221 | N22: =12*(H22-F22)+I22-G22+1 -> 2652
A23: ='MIROC(hires)'!F$2 -> Center for Climate System Research (The University of Tokyo), National Institute for Environmental Studies, and Frontier Research Center for Global Change (JAMSTEC) | B23: ='MIROC(hires)'!F$3 -> Japan | C23: ='MIROC(hires)'!F$1 -> MIROC3.2(hires) | D23: ='MIROC(hires)'!B6 -> 1%to2x | E23: ='MIROC(hires)'!C6 -> Run 1 | F23: ='MIROC(hires)'!D6 -> 1 | G23: ='MIROC(hires)'!E6 -> 1 | H23: ='MIROC(hires)'!F6 -> 80 | I23: ='MIROC(hires)'!G6 -> 12 | J23: ='MIROC(hires)'!H6 -> PIcntrl Run 1 | K23: ='MIROC(hires)'!I6 -> 1 | L23: ='MIROC(hires)'!J6 -> - | M23: =H23-F23+1 -> 80 | N23: =12*(H23-F23)+I23-G23+1 -> 960
A24: ='MIROC(medres)'!F$2 -> Center for Climate System Research (The University of Tokyo), National Institute for Environmental Studies, and Frontier Research Center for Global Change (JAMSTEC) | B24: ='MIROC(medres)'!F$3 -> Japan | C24: ='MIROC(medres)'!F$1 -> MIROC3.2(medres) | D24: ='MIROC(medres)'!B6 -> 1%to2x | E24: ='MIROC(medres)'!C6 -> Run 1 | F24: ='MIROC(medres)'!D6 -> 1 | G24: ='MIROC(medres)'!E6 -> 1 | H24: ='MIROC(medres)'!F6 -> 220 | I24: ='MIROC(medres)'!G6 -> 12 | J24: ='MIROC(medres)'!H6 -> PIcntrl Run 1 | K24: ='MIROC(medres)'!I6 -> 2300 | L24: ='MIROC(medres)'!J6 -> - | M24: =H24-F24+1 -> 220 | N24: =12*(H24-F24)+I24-G24+1 -> 2640
A25: ='MIROC(medres)'!F$2 -> Center for Climate System Research (The University of Tokyo), National Institute for Environmental Studies, and Frontier Research Center for Global Change (JAMSTEC) | B25: ='MIROC(medres)'!F$3 -> Japan | C25: ='MIROC(medres)'!F$1 -> MIROC3.2(medres) | D25: ='MIROC(medres)'!B7 -> 1%to2x | E25: ='MIROC(medres)'!C7 -> Run 2 | F25: ='MIROC(medres)'!D7 -> 1 | G25: ='MIROC(medres)'!E7 -> 1 | H25: ='MIROC(medres)'!F7 -> 70 | I25: ='MIROC(medres)'!G7 -> 12 | J25: ='MIROC(medres)'!H7 -> PIcntrl Run 1 | K25: ='MIROC(medres)'!I7 -> 2400 | L25: ='MIROC(medres)'!J7 -> - | M25: =H25-F25+1 -> 70 | N25: =12*(H25-F25)+I25-G25+1 -> 840
A26: ='MIROC(medres)'!F$2 -> Center for Climate System Research (The University of Tokyo), National Institute for Environmental Studies, and Frontier Research Center for Global Change (JAMSTEC) | B26: ='MIROC(medres)'!F$3 -> Japan | C26: ='MIROC(medres)'!F$1 -> MIROC3.2(medres) | D26: ='MIROC(medres)'!B8 -> 1%to2x | E26: ='MIROC(medres)'!C8 -> Run 3 | F26: ='MIROC(medres)'!D8 -> 1 | G26: ='MIROC(medres)'!E8 -> 1 | H26: ='MIROC(medres)'!F8 -> 70 | I26: ='MIROC(medres)'!G8 -> 12 | J26: ='MIROC(medres)'!H8 -> PIcntrl Run 1 | K26: ='MIROC(medres)'!I8 -> 2500 | L26: ='MIROC(medres)'!J8 -> - | M26: =H26-F26+1 -> 70 | N26: =12*(H26-F26)+I26-G26+1 -> 840
A27: =MRI!F$2 -> Meteorological Research Institute | B27: =MRI!F$3 -> Japan | C27: =MRI!F$1 -> MRI-CGCM2.3.2 | D27: =MRI!B6 -> 1%to2x | E27: =MRI!C6 -> Run 1 | F27: =MRI!D6 -> 1801 | G27: =MRI!E6 -> 1 | H27: =MRI!F6 -> 2020 | I27: =MRI!G6 -> 12 | J27: =MRI!H6 -> PDcntrl Run 1 | K27: =MRI!I6 -> 1801 | L27: =MRI!J6 -> - | M27: =H27-F27+1 -> 220 | N27: =12*(H27-F27)+I27-G27+1 -> 2640
A28: =PCM!F$2 -> National Center for Atmospheric Research | B28: =PCM!F$3 -> USA | C28: =PCM!F$1 -> PCM | D28: =PCM!B6 -> 1%to2x | E28: =PCM!C6 -> Run 1 | F28: =PCM!D6 -> 71 | G28: =PCM!E6 -> 1 | H28: =PCM!F6 -> 245 | I28: =PCM!G6 -> 12 | J28: =PCM!H6 -> PDcntrl | K28: =PCM!I6 -> 71 | L28: =PCM!J6 -> - | M28: =H28-F28+1 -> 175 | N28: =12*(H28-F28)+I28-G28+1 -> 2100
A29: =PCM!F$2 -> National Center for Atmospheric Research | B29: =PCM!F$3 -> USA | C29: =PCM!F$1 -> PCM | D29: =PCM!B7 -> 1%to2x | E29: =PCM!C7 -> Run 2 | F29: =PCM!D7 -> 151 | G29: =PCM!E7 -> 1 | H29: =PCM!F7 -> 259 | I29: =PCM!G7 -> 12 | J29: =PCM!H7 -> PDcntrl | K29: =PCM!I7 -> 151 | L29: =PCM!J7 -> B04.29 | M29: =H29-F29+1 -> 109 | N29: =12*(H29-F29)+I29-G29+1 -> 1308
A30: =PCM!F$2 -> National Center for Atmospheric Research | B30: =PCM!F$3 -> USA | C30: =PCM!F$1 -> PCM | D30: =PCM!B8 -> 1%to2x | E30: =PCM!C8 -> Run 3 | F30: =PCM!D8 -> 201 | G30: =PCM!E8 -> 1 | H30: =PCM!F8 -> 279 | I30: =PCM!G8 -> 12 | J30: =PCM!H8 -> PDcntrl | K30: =PCM!I8 -> 201 | L30: =PCM!J8 -> B04.30 | M30: =H30-F30+1 -> 79 | N30: =12*(H30-F30)+I30-G30+1 -> 948
A31: =PCM!F$2 -> National Center for Atmospheric Research | B31: =PCM!F$3 -> USA | C31: =PCM!F$1 -> PCM | D31: =PCM!B9 -> 1%to2x | E31: =PCM!C9 -> Run 4 | F31: =PCM!D9 -> 251 | G31: =PCM!E9 -> 1 | H31: =PCM!F9 -> 329 | I31: =PCM!G9 -> 12 | J31: =PCM!H9 -> PDcntrl | K31: =PCM!I9 -> 251 | L31: =PCM!J9 -> B04.33 | M31: =H31-F31+1 -> 79 | N31: =12*(H31-F31)+I31-G31+1 -> 948
A32: =PCM!F$2 -> National Center for Atmospheric Research | B32: =PCM!F$3 -> USA | C32: =PCM!F$1 -> PCM | D32: =PCM!B10 -> 1%to2x | E32: =PCM!C10 -> Run 5 | F32: =PCM!D10 -> 301 | G32: =PCM!E10 -> 1 | H32: =PCM!F10 -> 379 | I32: =PCM!G10 -> 12 | J32: =PCM!H10 -> PDcntrl | K32: =PCM!I10 -> 301 | L32: =PCM!J10 -> B04.34 | M32: =H32-F32+1 -> 79 | N32: =12*(H32-F32)+I32-G32+1 -> 948
A33: =HadCM3!F$2 -> Hadley Centre for Climate Prediction and Research, Met Office | B33: =HadCM3!F$3 -> UK | C33: =HadCM3!F$1 -> UKMO-HadCM3 | D33: =HadCM3!B6 -> 1%to2x | E33: =HadCM3!C6 -> Run 1 | F33: =HadCM3!D6 -> 1859 | G33: =HadCM3!E6 -> 12 | H33: =HadCM3!F6 -> 1939 | I33: =HadCM3!G6 -> 11 | J33: =HadCM3!H6 -> PIcntrl Run 2 | K33: =HadCM3!I6 -> 1859 | L33: =HadCM3!J6 -> - | M33: =H33-F33+1 -> 81 | N33: =12*(H33-F33)+I33-G33+1 -> 960
A34: =HadCM3!F$2 -> Hadley Centre for Climate Prediction and Research, Met Office | B34: =HadCM3!F$3 -> UK | C34: =HadCM3!F$1 -> UKMO-HadCM3 | D34: =HadCM3!B7 -> 1%to2x | E34: =HadCM3!C7 -> Run 2 | F34: =HadCM3!D7 -> 2289 | G34: =HadCM3!E7 -> 12 | H34: =HadCM3!F7 -> 2508 | I34: =HadCM3!G7 -> 12 | J34: =HadCM3!H7 -> PIcntrl Run 1 | K34: =HadCM3!I7 -> 2289 | L34: =HadCM3!J7 -> - | M34: =H34-F34+1 -> 220 | N34: =12*(H34-F34)+I34-G34+1 -> 2629
A35: =HadGEM1!F$2 -> Hadley Centre for Climate Prediction and Research , Met Office | B35: =HadGEM1!F$3 -> UK | C35: =HadGEM1!F$1 -> UKMO-HadGEM1 | D35: =HadGEM1!B6 -> 1%to2x | E35: =HadGEM1!C6 -> Run 1 | F35: =HadGEM1!D6 -> 1859 | G35: =HadGEM1!E6 -> 12 | H35: =HadGEM1!F6 -> 1939 | I35: =HadGEM1!G6 -> 12 | J35: =HadGEM1!H6 -> PIcntrl Run 1 | K35: =HadGEM1!I6 -> 1859 | L35: =HadGEM1!J6 -> - | M35: =H35-F35+1 -> 81 | N35: =12*(H35-F35)+I35-G35+1 -> 961
A36: =HadGEM1!F$2 -> Hadley Centre for Climate Prediction and Research , Met Office | B36: =HadGEM1!F$3 -> UK | C36: =HadGEM1!F$1 -> UKMO-HadGEM1 | D36: =HadGEM1!B7 -> 1%to2x | E36: =HadGEM1!C7 -> Run 2 | F36: =HadGEM1!D7 -> 1859 | G36: =HadGEM1!E7 -> 12 | H36: =HadGEM1!F7 -> 2079 | I36: =HadGEM1!G7 -> 12 | J36: =HadGEM1!H7 -> PIcntrl Run 1 | K36: =HadGEM1!I7 -> 1859 | L36: =HadGEM1!J7 -> Years 1859-1929 are identical to Run 1 (and only archived in Run 1). CO2 is kept constant at 2x its pre-industrial value from 1929 on (consistent with IPCC guidelines) | M36: =H36-F36+1 -> 221 | N36: =12*(H36-F36)+I36-G36+1 -> 2641
A37: 0 | B37: 0 | C37: 0 | D37: 1%to4x | E37: 0 | F37: 0 | G37: 0 | H37: 0 | I37: 0 | J37: 0 | K37: 0 | L37: 0
A38: =BCC!F$2 -> Beijing Climate Center | B38: =BCC!F$3 -> China | C38: =BCC!F$1 -> BCC-CM1 | D38: =BCC!B7 -> 1%to4x | E38: =BCC!C7 -> Run 1 | F38: =BCC!D7 -> 1980 | G38: =BCC!E7 -> 1 | H38: =BCC!F7 -> 2148 | I38: =BCC!G7 -> 12 | J38: =BCC!H7 -> PDcntrl | K38: =BCC!I7 -> 1980 | L38: =BCC!J7 -> - | M38: =H38-F38+1 -> 169 | N38: =12*(H38-F38)+I38-G38+1 -> 2028
A39: =CCSM3!F$2 -> National Center for Atmospheric Research | B39: =CCSM3!F$3 -> USA | C39: =CCSM3!F$1 -> CCSM3 | D39: =CCSM3!B7 -> 1%to4x | E39: =CCSM3!C7 -> Run 1 | F39: =CCSM3!D7 -> 410 | G39: =CCSM3!E7 -> 1 | H39: =CCSM3!F7 -> 699 | I39: =CCSM3!G7 -> 12 | J39: =CCSM3!H7 -> PDcntrl | K39: =CCSM3!I7 -> 410 | L39: =CCSM3!J7 -> b30.026.ES01 ( yrs 410-549), b30.026b(yrs(550-699); Note: this 1%to4x run branched from the PDcntrl run at year 400, but CO2 was held fixed until year 410, when it began to increase. | M39: =H39-F39+1 -> 290 | N39: =12*(H39-F39)+I39-G39+1 -> 3480
A40: ='CGCM(T47)'!F$2 -> Canadian Centre for Climate Modeling & Analysis | B40: ='CGCM(T47)'!F$3 -> Canada | C40: ='CGCM(T47)'!F$1 -> CGCM3.1(T47) | D40: ='CGCM(T47)'!B7 -> 1%to4x | E40: ='CGCM(T47)'!C7 -> Run 1 | F40: ='CGCM(T47)'!D7 -> 1850 | G40: ='CGCM(T47)'!E7 -> 1 | H40: ='CGCM(T47)'!F7 -> 2139 | I40: ='CGCM(T47)'!G7 -> 12 | J40: ='CGCM(T47)'!H7 -> Picntrl Run 1 | K40: ='CGCM(T47)'!I7 -> 1850 | L40: ='CGCM(T47)'!J7 -> Same initial condition as PIcntrl | M40: =H40-F40+1 -> 290 | N40: =12*(H40-F40)+I40-G40+1 -> 3480
A41: ='CGCM(T63)'!F$2 -> Canadian Centre for Climate Modeling & Analysis | B41: ='CGCM(T63)'!F$3 -> Canada | C41: ='CGCM(T63)'!F$1 -> CGCM3.1(T63) | D41: ='CGCM(T63)'!B7 -> 1%to4x | E41: ='CGCM(T63)'!C7 -> Run 1 | F41: ='CGCM(T63)'!D7 -> 1850 | G41: ='CGCM(T63)'!E7 -> 1 | H41: ='CGCM(T63)'!F7 -> 1989 | I41: ='CGCM(T63)'!G7 -> 12 | J41: ='CGCM(T63)'!H7 -> Picntrl Run 1 | K41: ='CGCM(T63)'!I7 -> 1850 | L41: ='CGCM(T63)'!J7 -> Same initial condition as PIcntrl | M41: =H41-F41+1 -> 140 | N41: =12*(H41-F41)+I41-G41+1 -> 1680
A42: =CNRM!F$2 -> Météo-France / Centre National de Recherches Météorologiques | B42: =CNRM!F$3 -> France | C42: =CNRM!F$1 -> CNRM-CM3 | D42: =CNRM!B7 -> 1%to4x | E42: =CNRM!C7 -> Run 1 | F42: =CNRM!D7 -> 1860 | G42: =CNRM!E7 -> 1 | H42: =CNRM!F7 -> 2150 | I42: =CNRM!G7 -> 12 | J42: =CNRM!H7 -> PIcntrl Run 1 | K42: =CNRM!I7 -> 2040 | L42: =CNRM!J7 -> - | M42: =H42-F42+1 -> 291 | N42: =12*(H42-F42)+I42-G42+1 -> 3492
A43: =ECHAM5!F$2 -> Max Planck Institute for Meteorology | B43: =ECHAM5!F$3 -> Germany | C43: =ECHAM5!F$1 -> ECHAM5/MPI-OM | D43: =ECHAM5!B9 -> 1%to4x | E43: =ECHAM5!C9 -> Run 1 | F43: =ECHAM5!D9 -> 1930 | G43: =ECHAM5!E9 -> 1 | H43: =ECHAM5!F9 -> 2150 | I43: =ECHAM5!G9 -> 12 | J43: =ECHAM5!H9 -> 1%to2x | K43: =ECHAM5!I9 -> 1930 | L43: =ECHAM5!J9 -> - | M43: =H43-F43+1 -> 221 | N43: =12*(H43-F43)+I43-G43+1 -> 2652
A44: ='ECHO-G'!F$2 -> Meteorological Institute of the University of Bonn (MIUB), Meteorological Research Institute of KMA (METRI), and Model and Data group (M&D) | B44: ='ECHO-G'!F$3 -> Germany & Korea | C44: ='ECHO-G'!F$1 -> ECHO-G | D44: ='ECHO-G'!B7 -> 1%to4x | E44: ='ECHO-G'!C7 -> Run 1 | F44: ='ECHO-G'!D7 -> 2060 | G44: ='ECHO-G'!E7 -> 1 | H44: ='ECHO-G'!F7 -> 2300 | I44: ='ECHO-G'!G7 -> 12 | J44: ='ECHO-G'!H7 -> 1%to2x | K44: ='ECHO-G'!I7 -> 2060 | L44: ='ECHO-G'!J7 -> Using ECHO-G version without aerosols | M44: =H44-F44+1 -> 241 | N44: =12*(H44-F44)+I44-G44+1 -> 2892
A45: ='GFDL-2.0'!F$2 -> US Dept. of Commerce / NOAA / Geophysical Fluid Dynamics Laboratory | B45: ='GFDL-2.0'!F$3 -> USA | C45: ='GFDL-2.0'!F$1 -> GFDL-CM2.0 | D45: ='GFDL-2.0'!B7 -> 1%to4x | E45: ='GFDL-2.0'!C7 -> Run 1 | F45: ='GFDL-2.0'!D7 -> 1 | G45: ='GFDL-2.0'!E7 -> 1 | H45: ='GFDL-2.0'!F7 -> 300 | I45: ='GFDL-2.0'!G7 -> 12 | J45: ='GFDL-2.0'!H7 -> PIcntrl Run 1 | K45: ='GFDL-2.0'!I7 -> 41 | L45: ='GFDL-2.0'!J7 -> - | M45: =H45-F45+1 -> 300 | N45: =12*(H45-F45)+I45-G45+1 -> 3600
A46: ='GFDL-2.1'!F$2 -> US Dept. of Commerce / NOAA / Geophysical Fluid Dynamics Laboratory | B46: ='GFDL-2.1'!F$3 -> USA | C46: ='GFDL-2.1'!F$1 -> GFDL-CM2.1 | D46: ='GFDL-2.1'!B7 -> 1%to4x | E46: ='GFDL-2.1'!C7 -> Run 1 | F46: ='GFDL-2.1'!D7 -> 1 | G46: ='GFDL-2.1'!E7 -> 1 | H46: ='GFDL-2.1'!F7 -> 300 | I46: ='GFDL-2.1'!G7 -> 12 | J46: ='GFDL-2.1'!H7 -> PIcntrl Run 1 | K46: ='GFDL-2.1'!I7 -> 1 | L46: ='GFDL-2.1'!J7 -> - | M46: =H46-F46+1 -> 300 | N46: =12*(H46-F46)+I46-G46+1 -> 3600
A47: ='GISS-ER'!F$2 -> NASA / Goddard Institute for Space Studies | B47: ='GISS-ER'!F$3 -> USA | C47: ='GISS-ER'!F$1 -> GISS-ER | D47: ='GISS-ER'!B7 -> 1%to4x | E47: ='GISS-ER'!C7 -> Run 1 | F47: ='GISS-ER'!D7 -> 1901 | G47: ='GISS-ER'!E7 -> 1 | H47: ='GISS-ER'!F7 -> 2190 | I47: ='GISS-ER'!G7 -> 12 | J47: ='GISS-ER'!H7 -> PIcntrl | K47: ='GISS-ER'!I7 -> 1981 | L47: ='GISS-ER'!J7 -> - | M47: =H47-F47+1 -> 290 | N47: =12*(H47-F47)+I47-G47+1 -> 3480
A48: =INM!F$2 -> Institute for Numerical Mathematics | B48: =INM!F$3 -> Russia | C48: =INM!F$1 -> INM-CM3.0 | D48: =INM!B7 -> 1%to4x | E48: =INM!C7 -> Run 1 | F48: =INM!D7 -> 1871 | G48: =INM!E7 -> 1 | H48: =INM!F7 -> 2160 | I48: =INM!G7 -> 12 | J48: =INM!H7 -> PIcntrl | K48: =INM!I7 -> 1871 | L48: =INM!J7 -> - | M48: =H48-F48+1 -> 290 | N48: =12*(H48-F48)+I48-G48+1 -> 3480
A49: =IPSL!F$2 -> Institut Pierre Simon Laplace | B49: =IPSL!F$3 -> France | C49: =IPSL!F$1 -> IPSL-CM4 | D49: =IPSL!B7 -> 1%to4x | E49: =IPSL!C7 -> Run 1 | F49: =IPSL!D7 -> 1860 | G49: =IPSL!E7 -> 1 | H49: =IPSL!F7 -> 2000 | I49: =IPSL!G7 -> 12 | J49: =IPSL!H7 -> PIcntrl Run 1 | K49: =IPSL!I7 -> 1860 | L49: =IPSL!J7 -> - | M49: =H49-F49+1 -> 141 | N49: =12*(H49-F49)+I49-G49+1 -> 1692
A50: ='MIROC(medres)'!F$2 -> Center for Climate System Research (The University of Tokyo), National Institute for Environmental Studies, and Frontier Research Center for Global Change (JAMSTEC) | B50: ='MIROC(medres)'!F$3 -> Japan | C50: ='MIROC(medres)'!F$1 -> MIROC3.2(medres) | D50: ='MIROC(medres)'!B9 -> 1%to4x | E50: ='MIROC(medres)'!C9 -> Run 1 | F50: ='MIROC(medres)'!D9 -> 1 | G50: ='MIROC(medres)'!E9 -> 1 | H50: ='MIROC(medres)'!F9 -> 290 | I50: ='MIROC(medres)'!G9 -> 12 | J50: ='MIROC(medres)'!H9 -> PIcntrl Run 1 | K50: ='MIROC(medres)'!I9 -> 2300 | L50: ='MIROC(medres)'!J9 -> The same initial condition as PIcntrl. | M50: =H50-F50+1 -> 290 | N50: =12*(H50-F50)+I50-G50+1 -> 3480
A51: ='MIROC(medres)'!F$2 -> Center for Climate System Research (The University of Tokyo), National Institute for Environmental Studies, and Frontier Research Center for Global Change (JAMSTEC) | B51: ='MIROC(medres)'!F$3 -> Japan | C51: ='MIROC(medres)'!F$1 -> MIROC3.2(medres) | D51: ='MIROC(medres)'!B10 -> 1%to4x | E51: ='MIROC(medres)'!C10 -> Run 2 | F51: ='MIROC(medres)'!D10 -> 1 | G51: ='MIROC(medres)'!E10 -> 1 | H51: ='MIROC(medres)'!F10 -> 140 | I51: ='MIROC(medres)'!G10 -> 12 | J51: ='MIROC(medres)'!H10 -> PIcntrl Run 1 | K51: ='MIROC(medres)'!I10 -> 2400 | L51: ='MIROC(medres)'!J10 -> - | M51: =H51-F51+1 -> 140 | N51: =12*(H51-F51)+I51-G51+1 -> 1680
A52: ='MIROC(medres)'!F$2 -> Center for Climate System Research (The University of Tokyo), National Institute for Environmental Studies, and Frontier Research Center for Global Change (JAMSTEC) | B52: ='MIROC(medres)'!F$3 -> Japan | C52: ='MIROC(medres)'!F$1 -> MIROC3.2(medres) | D52: ='MIROC(medres)'!B11 -> 1%to4x | E52: ='MIROC(medres)'!C11 -> Run 3 | F52: ='MIROC(medres)'!D11 -> 1 | G52: ='MIROC(medres)'!E11 -> 1 | H52: ='MIROC(medres)'!F11 -> 140 | I52: ='MIROC(medres)'!G11 -> 12 | J52: ='MIROC(medres)'!H11 -> PIcntrl Run 1 | K52: ='MIROC(medres)'!I11 -> 2500 | L52: ='MIROC(medres)'!J11 -> - | M52: =H52-F52+1 -> 140 | N52: =12*(H52-F52)+I52-G52+1 -> 1680
A53: =MRI!F$2 -> Meteorological Research Institute | B53: =MRI!F$3 -> Japan | C53: =MRI!F$1 -> MRI-CGCM2.3.2 | D53: =MRI!B7 -> 1%to4x | E53: =MRI!C7 -> Run 1 | F53: =MRI!D7 -> 1801 | G53: =MRI!E7 -> 1 | H53: =MRI!F7 -> 2090 | I53: =MRI!G7 -> 12 | J53: =MRI!H7 -> PDcntrl Run 1 | K53: =MRI!I7 -> 1801 | L53: =MRI!J7 -> Initialized from year 429 of present-day spin-up | M53: =H53-F53+1 -> 290 | N53: =12*(H53-F53)+I53-G53+1 -> 3480
A54: =PCM!F$2 -> National Center for Atmospheric Research | B54: =PCM!F$3 -> USA | C54: =PCM!F$1 -> PCM | D54: =PCM!B11 -> 1%to4x | E54: =PCM!C11 -> Run 1 | F54: =PCM!D11 -> 141 | G54: =PCM!E11 -> 1 | H54: =PCM!F11 -> 309 | I54: =PCM!G11 -> 12 | J54: =PCM!H11 -> PDcntrl | K54: =PCM!I11 -> 141 | L54: =PCM!J11 -> B04.23
A55: =HadGEM1!F$2 -> Hadley Centre for Climate Prediction and Research , Met Office | B55: =HadGEM1!F$3 -> UK | C55: =HadGEM1!F$1 -> UKMO-HadGEM1 | D55: =HadGEM1!B8 -> 1%to4x | E55: =HadGEM1!C8 -> Run 1 | F55: =HadGEM1!D8 -> 1939 | G55: =HadGEM1!E8 -> 12 | H55: =HadGEM1!F8 -> 2049 | I55: =HadGEM1!G8 -> 11 | J55: =HadGEM1!H8 -> 1%to2x Run 1 | K55: =HadGEM1!I8 -> 1939 | L55: =HadGEM1!J8 -> The 80yrs up to 1939 are the same as the 1st 80 years of 1%to2x. | M55: =H55-F55+1 -> 111 | N55: =12*(H55-F55)+I55-G55+1 -> 1320
A56: 0 | B56: 0 | C56: 0 | D56: 20C3M | E56: 0 | F56: 0 | G56: 0 | H56: 0 | I56: 0 | J56: 0 | K56: 0 | L56: 0
A57: =BCC!F$2 -> Beijing Climate Center | B57: =BCC!F$3 -> China | C57: =BCC!F$1 -> BCC-CM1 | D57: =BCC!B8 -> 20C3M | E57: =BCC!C8 -> Run 1 | F57: =BCC!D8 -> 1870 | G57: =BCC!E8 -> 3 | H57: =BCC!F8 -> 2003 | I57: =BCC!G8 -> 12 | J57: =BCC!H8 -> PDcntrl | K57: =BCC!I8 -> 1870 | L57: =BCC!J8 -> - | M57: =H57-F57+1 -> 134 | N57: =12*(H57-F57)+I57-G57+1 -> 1606
A58: =BCC!F$2 -> Beijing Climate Center | B58: =BCC!F$3 -> China | C58: =BCC!F$1 -> BCC-CM1 | D58: =BCC!B9 -> 20C3M | E58: =BCC!C9 -> Run 2 | F58: =BCC!D9 -> 1870 | G58: =BCC!E9 -> 6 | H58: =BCC!F9 -> 2003 | I58: =BCC!G9 -> 12 | J58: =BCC!H9 -> PDcntrl | K58: =BCC!I9 -> 1870 | L58: =BCC!J9 -> - | M58: =H58-F58+1 -> 134 | N58: =12*(H58-F58)+I58-G58+1 -> 1603
A59: =BCC!F$2 -> Beijing Climate Center | B59: =BCC!F$3 -> China | C59: =BCC!F$1 -> BCC-CM1 | D59: =BCC!B10 -> 20C3M | E59: =BCC!C10 -> Run 3 | F59: =BCC!D10 -> 1870 | G59: =BCC!E10 -> 9 | H59: =BCC!F10 -> 2003 | I59: =BCC!G10 -> 12 | J59: =BCC!H10 -> PDcntrl | K59: =BCC!I10 -> 1870 | L59: =BCC!J10 -> - | M59: =H59-F59+1 -> 134 | N59: =12*(H59-F59)+I59-G59+1 -> 1600
A60: =BCC!F$2 -> Beijing Climate Center | B60: =BCC!F$3 -> China | C60: =BCC!F$1 -> BCC-CM1 | D60: =BCC!B11 -> 20C3M | E60: =BCC!C11 -> Run 4 | F60: =BCC!D11 -> 1870 | G60: =BCC!E11 -> 12 | H60: =BCC!F11 -> 2003 | I60: =BCC!G11 -> 12 | J60: =BCC!H11 -> PDcntrl | K60: =BCC!I11 -> 1870 | L60: =BCC!J11 -> - | M60: =H60-F60+1 -> 134 | N60: =12*(H60-F60)+I60-G60+1 -> 1597
A61: =CCSM3!F$2 -> National Center for Atmospheric Research | B61: =CCSM3!F$3 -> USA | C61: =CCSM3!F$1 -> CCSM3 | D61: =CCSM3!B8 -> 20C3M | E61: =CCSM3!C8 -> Run 1 | F61: =CCSM3!D8 -> 1870 | G61: =CCSM3!E8 -> 1 | H61: =CCSM3!F8 -> 1999 | I61: =CCSM3!G8 -> 12 | J61: =CCSM3!H8 -> PIcntrl Run 1 | K61: =CCSM3!I8 -> 360 | L61: =CCSM3!J8 -> b30.030a | M61: =H61-F61+1 -> 130 | N61: =12*(H61-F61)+I61-G61+1 -> 1560
A62: =CCSM3!F$2 -> National Center for Atmospheric Research | B62: =CCSM3!F$3 -> USA | C62: =CCSM3!F$1 -> CCSM3 | D62: =CCSM3!B9 -> 20C3M | E62: =CCSM3!C9 -> Run 2 | F62: =CCSM3!D9 -> 1870 | G62: =CCSM3!E9 -> 1 | H62: =CCSM3!F9 -> 1999 | I62: =CCSM3!G9 -> 12 | J62: =CCSM3!H9 -> PIcntrl Run 1 | K62: =CCSM3!I9 -> 380 | L62: =CCSM3!J9 -> b30.030b | M62: =H62-F62+1 -> 130 | N62: =12*(H62-F62)+I62-G62+1 -> 1560
A63: =CCSM3!F$2 -> National Center for Atmospheric Research | B63: =CCSM3!F$3 -> USA | C63: =CCSM3!F$1 -> CCSM3 | D63: =CCSM3!B10 -> 20C3M | E63: =CCSM3!C10 -> Run 3 | F63: =CCSM3!D10 -> 1870 | G63: =CCSM3!E10 -> 1 | H63: =CCSM3!F10 -> 1999 | I63: =CCSM3!G10 -> 12 | J63: =CCSM3!H10 -> PIcntrl Run 1 | K63: =CCSM3!I10 -> 400 | L63: =CCSM3!J10 -> b30.030c | M63: =H63-F63+1 -> 130 | N63: =12*(H63-F63)+I63-G63+1 -> 1560
A64: =CCSM3!F$2 -> National Center for Atmospheric Research | B64: =CCSM3!F$3 -> USA | C64: =CCSM3!F$1 -> CCSM3 | D64: =CCSM3!B11 -> 20C3M | E64: =CCSM3!C11 -> Run 4 | F64: =CCSM3!D11 -> 1870 | G64: =CCSM3!E11 -> 1 | H64: =CCSM3!F11 -> 1999 | I64: =CCSM3!G11 -> 12 | J64: =CCSM3!H11 -> PIcntrl Run 1 | K64: =CCSM3!I11 -> 420 | L64: =CCSM3!J11 -> b30.030d | M64: =H64-F64+1 -> 130 | N64: =12*(H64-F64)+I64-G64+1 -> 1560
A65: =CCSM3!F$2 -> National Center for Atmospheric Research | B65: =CCSM3!F$3 -> USA | C65: =CCSM3!F$1 -> CCSM3 | D65: =CCSM3!B12 -> 20C3M | E65: =CCSM3!C12 -> Run 5 | F65: =CCSM3!D12 -> 1870 | G65: =CCSM3!E12 -> 1 | H65: =CCSM3!F12 -> 1999 | I65: =CCSM3!G12 -> 12 | J65: =CCSM3!H12 -> PIcntrl Run 1 | K65: =CCSM3!I12 -> 440 | L65: =CCSM3!J12 -> b30.030e | M65: =H65-F65+1 -> 130 | N65: =12*(H65-F65)+I65-G65+1 -> 1560
A66: =CCSM3!F$2 -> National Center for Atmospheric Research | B66: =CCSM3!F$3 -> USA | C66: =CCSM3!F$1 -> CCSM3 | D66: =CCSM3!B13 -> 20C3M | E66: =CCSM3!C13 -> Run 6 | F66: =CCSM3!D13 -> 1870 | G66: =CCSM3!E13 -> 1 | H66: =CCSM3!F13 -> 1999 | I66: =CCSM3!G13 -> 12 | J66: =CCSM3!H13 -> PIcntrl Run 2 | K66: =CCSM3!I13 -> 380 | L66: =CCSM3!J13 -> b30.030b.ES01 | M66: =H66-F66+1 -> 130 | N66: =12*(H66-F66)+I66-G66+1 -> 1560
A67: =CCSM3!F$2 -> National Center for Atmospheric Research | B67: =CCSM3!F$3 -> USA | C67: =CCSM3!F$1 -> CCSM3 | D67: =CCSM3!B14 -> 20C3M | E67: =CCSM3!C14 -> Run 7 | F67: =CCSM3!D14 -> 1870 | G67: =CCSM3!E14 -> 1 | H67: =CCSM3!F14 -> 1999 | I67: =CCSM3!G14 -> 12 | J67: =CCSM3!H14 -> PIcntrl Run 2 | K67: =CCSM3!I14 -> 410 | L67: =CCSM3!J14 -> b30.030f.ES01 | M67: =H67-F67+1 -> 130 | N67: =12*(H67-F67)+I67-G67+1 -> 1560
A68: =CCSM3!F$2 -> National Center for Atmospheric Research | B68: =CCSM3!F$3 -> USA | C68: =CCSM3!F$1 -> CCSM3 | D68: =CCSM3!B15 -> 20C3M | E68: =CCSM3!C15 -> Run 8 | F68: =CCSM3!D15 -> 1870 | G68: =CCSM3!E15 -> 1 | H68: =CCSM3!F15 -> 1999 | I68: =CCSM3!G15 -> 12 | J68: =CCSM3!H15 -> PIcntrl Run 2 | K68: =CCSM3!I15 -> 460 | L68: =CCSM3!J15 -> b30.030g.ES01 | M68: =H68-F68+1 -> 130 | N68: =12*(H68-F68)+I68-G68+1 -> 1560
A69: =CCSM3!F$2 -> National Center for Atmospheric Research | B69: =CCSM3!F$3 -> USA | C69: =CCSM3!F$1 -> CCSM3 | D69: =CCSM3!B16 -> 20C3M | E69: =CCSM3!C16 -> Run 9 | F69: =CCSM3!D16 -> 1870 | G69: =CCSM3!E16 -> 1 | H69: =CCSM3!F16 -> 1999 | I69: =CCSM3!G16 -> 12 | J69: =CCSM3!H16 -> PIcntrl Run 2 | K69: =CCSM3!I16 -> 540 | L69: =CCSM3!J16 -> b30.030h.ES01 | M69: =H69-F69+1 -> 130 | N69: =12*(H69-F69)+I69-G69+1 -> 1560
A70: ='CGCM(T47)'!F$2 -> Canadian Centre for Climate Modeling & Analysis | B70: ='CGCM(T47)'!F$3 -> Canada | C70: ='CGCM(T47)'!F$1 -> CGCM3.1(T47) | D70: ='CGCM(T47)'!B8 -> 20C3M | E70: ='CGCM(T47)'!C8 -> Run 1 | F70: ='CGCM(T47)'!D8 -> 1850 | G70: ='CGCM(T47)'!E8 -> 1 | H70: ='CGCM(T47)'!F8 -> 2000 | I70: ='CGCM(T47)'!G8 -> 12 | J70: ='CGCM(T47)'!H8 -> Picntrl Run 1 | K70: ='CGCM(T47)'!I8 -> 1850 | L70: ='CGCM(T47)'!J8 -> Same initial condition as PIcntrl | M70: =H70-F70+1 -> 151 | N70: =12*(H70-F70)+I70-G70+1 -> 1812
A71: ='CGCM(T47)'!F$2 -> Canadian Centre for Climate Modeling & Analysis | B71: ='CGCM(T47)'!F$3 -> Canada | C71: ='CGCM(T47)'!F$1 -> CGCM3.1(T47) | D71: ='CGCM(T47)'!B9 -> 20C3M | E71: ='CGCM(T47)'!C9 -> Run 2 | F71: ='CGCM(T47)'!D9 -> 1850 | G71: ='CGCM(T47)'!E9 -> 1 | H71: ='CGCM(T47)'!F9 -> 2000 | I71: ='CGCM(T47)'!G9 -> 12 | J71: ='CGCM(T47)'!H9 -> Picntrl Run 1 | K71: ='CGCM(T47)'!I9 -> 1850 | L71: ='CGCM(T47)'!J9 -> Same initial condition as Picntrl, with a small pertubation added | M71: =H71-F71+1 -> 151 | N71: =12*(H71-F71)+I71-G71+1 -> 1812
A72: ='CGCM(T47)'!F$2 -> Canadian Centre for Climate Modeling & Analysis | B72: ='CGCM(T47)'!F$3 -> Canada | C72: ='CGCM(T47)'!F$1 -> CGCM3.1(T47) | D72: ='CGCM(T47)'!B10 -> 20C3M | E72: ='CGCM(T47)'!C10 -> Run 3 | F72: ='CGCM(T47)'!D10 -> 1850 | G72: ='CGCM(T47)'!E10 -> 1 | H72: ='CGCM(T47)'!F10 -> 2000 | I72: ='CGCM(T47)'!G10 -> 12 | J72: ='CGCM(T47)'!H10 -> Picntrl Run 1 | K72: ='CGCM(T47)'!I10 -> 1850 | L72: ='CGCM(T47)'!J10 -> Same initial condition as Picntrl, with a small pertubation added | M72: =H72-F72+1 -> 151 | N72: =12*(H72-F72)+I72-G72+1 -> 1812
A73: ='CGCM(T47)'!F$2 -> Canadian Centre for Climate Modeling & Analysis | B73: ='CGCM(T47)'!F$3 -> Canada | C73: ='CGCM(T47)'!F$1 -> CGCM3.1(T47) | D73: ='CGCM(T47)'!B11 -> 20C3M | E73: ='CGCM(T47)'!C11 -> Run 4 | F73: ='CGCM(T47)'!D11 -> 1850 | G73: ='CGCM(T47)'!E11 -> 1 | H73: ='CGCM(T47)'!F11 -> 2000 | I73: ='CGCM(T47)'!G11 -> 12 | J73: ='CGCM(T47)'!H11 -> Picntrl Run 1 | K73: ='CGCM(T47)'!I11 -> 1850 | L73: ='CGCM(T47)'!J11 -> Same initial condition as Picntrl, with a small pertubation added | M73: =H73-F73+1 -> 151 | N73: =12*(H73-F73)+I73-G73+1 -> 1812
A74: ='CGCM(T47)'!F$2 -> Canadian Centre for Climate Modeling & Analysis | B74: ='CGCM(T47)'!F$3 -> Canada | C74: ='CGCM(T47)'!F$1 -> CGCM3.1(T47) | D74: ='CGCM(T47)'!B12 -> 20C3M | E74: ='CGCM(T47)'!C12 -> Run 5 | F74: ='CGCM(T47)'!D12 -> 1850 | G74: ='CGCM(T47)'!E12 -> 1 | H74: ='CGCM(T47)'!F12 -> 2000 | I74: ='CGCM(T47)'!G12 -> 12 | J74: ='CGCM(T47)'!H12 -> Picntrl Run 1 | K74: ='CGCM(T47)'!I12 -> 1850 | L74: ='CGCM(T47)'!J12 -> Same initial condition as Picntrl, with a small pertubation added | M74: =H74-F74+1 -> 151 | N74: =12*(H74-F74)+I74-G74+1 -> 1812
A75: ='CGCM(T63)'!F$2 -> Canadian Centre for Climate Modeling & Analysis | B75: ='CGCM(T63)'!F$3 -> Canada | C75: ='CGCM(T63)'!F$1 -> CGCM3.1(T63) | D75: ='CGCM(T63)'!B8 -> 20C3M | E75: ='CGCM(T63)'!C8 -> Run 1 | F75: ='CGCM(T63)'!D8 -> 1850 | G75: ='CGCM(T63)'!E8 -> 1 | H75: ='CGCM(T63)'!F8 -> 2000 | I75: ='CGCM(T63)'!G8 -> 12 | J75: ='CGCM(T63)'!H8 -> Picntrl Run 1 | K75: ='CGCM(T63)'!I8 -> 1850 | L75: ='CGCM(T63)'!J8 -> Same initial condition as PIcntrl | M75: =H75-F75+1 -> 151 | N75: =12*(H75-F75)+I75-G75+1 -> 1812
A76: =CNRM!F$2 -> Météo-France / Centre National de Recherches Météorologiques | B76: =CNRM!F$3 -> France | C76: =CNRM!F$1 -> CNRM-CM3 | D76: =CNRM!B8 -> 20C3M | E76: =CNRM!C8 -> Run 1 | F76: =CNRM!D8 -> 1860 | G76: =CNRM!E8 -> 1 | H76: =CNRM!F8 -> 1999 | I76: =CNRM!G8 -> 12 | J76: =CNRM!H8 -> PIcntrl Run 1 | K76: =CNRM!I8 -> 2040 | L76: =CNRM!J8 -> - | M76: =H76-F76+1 -> 140 | N76: =12*(H76-F76)+I76-G76+1 -> 1680
A77: ='CSIRO-3.0'!F$2 -> CSIRO Atmospheric Research | B77: ='CSIRO-3.0'!F$3 -> Australia | C77: ='CSIRO-3.0'!F$1 -> CSIRO-Mk3.0 | D77: ='CSIRO-3.0'!B7 -> 20C3M | E77: ='CSIRO-3.0'!C7 -> Run 1 | F77: ='CSIRO-3.0'!D7 -> 1871 | G77: ='CSIRO-3.0'!E7 -> 1 | H77: ='CSIRO-3.0'!F7 -> 2000 | I77: ='CSIRO-3.0'!G7 -> 12 | J77: ='CSIRO-3.0'!H7 -> PIcntrl Run 1 | K77: ='CSIRO-3.0'!I7 -> 1871 | L77: ='CSIRO-3.0'!J7 -> i.e., Initialised from the end of the 120 year so-called adjustment coupled control run, as per PIcntrl | M77: =H77-F77+1 -> 130 | N77: =12*(H77-F77)+I77-G77+1 -> 1560
A78: ='CSIRO-3.0'!F$2 -> CSIRO Atmospheric Research | B78: ='CSIRO-3.0'!F$3 -> Australia | C78: ='CSIRO-3.0'!F$1 -> CSIRO-Mk3.0 | D78: ='CSIRO-3.0'!B8 -> 20C3M | E78: ='CSIRO-3.0'!C8 -> Run 2 | F78: ='CSIRO-3.0'!D8 -> 1871 | G78: ='CSIRO-3.0'!E8 -> 1 | H78: ='CSIRO-3.0'!F8 -> 2000 | I78: ='CSIRO-3.0'!G8 -> 12 | J78: ='CSIRO-3.0'!H8 -> PIcntrl Run 1 | K78: ='CSIRO-3.0'!I8 -> 1881 | L78: ='CSIRO-3.0'!J8 -> 20C3M Run 2 initialised from PIcntrl Run 1 ten years later than 20C3M Run 1, i.e., at end of Model year 130 = Data year 1880 of PIcntrl Run 1. I.e., year 1871 of 20CM3 Run 2 has corresponding control year of 1881 in PIcntrl Run 1 | M78: =H78-F78+1 -> 130 | N78: =12*(H78-F78)+I78-G78+1 -> 1560
A79: ='CSIRO-3.0'!F$2 -> CSIRO Atmospheric Research | B79: ='CSIRO-3.0'!F$3 -> Australia | C79: ='CSIRO-3.0'!F$1 -> CSIRO-Mk3.0 | D79: ='CSIRO-3.0'!B9 -> 20C3M | E79: ='CSIRO-3.0'!C9 -> Run 3 | F79: ='CSIRO-3.0'!D9 -> 1871 | G79: ='CSIRO-3.0'!E9 -> 1 | H79: ='CSIRO-3.0'!F9 -> 2000 | I79: ='CSIRO-3.0'!G9 -> 12 | J79: ='CSIRO-3.0'!H9 -> PIcntrl Run 1 | K79: ='CSIRO-3.0'!I9 -> 1891 | L79: ='CSIRO-3.0'!J9 -> 20C3M Run 3 initialised from PIcntrl Run 1 twenty years later than 20C3M Run 1, i.e., at end of Model year 140 = Data year 1890 of PIcntrl Run 1. I.e., year 1871 of 20CM3 Run 3 has corresponding control year of 1891 in PIcntrl Run 1 | M79: =H79-F79+1 -> 130 | N79: =12*(H79-F79)+I79-G79+1 -> 1560
A80: ='CSIRO-3.5'!F$2 -> CSIRO Atmospheric Research | B80: ='CSIRO-3.5'!F$3 -> Australia | C80: ='CSIRO-3.5'!F$1 -> CSIRO-Mk3.5 | D80: ='CSIRO-3.5'!B7 -> 20C3M | E80: ='CSIRO-3.5'!C7 -> Run1 | F80: ='CSIRO-3.5'!D7 -> 1871 | G80: ='CSIRO-3.5'!E7 -> 1 | H80: ='CSIRO-3.5'!F7 -> 2000 | I80: ='CSIRO-3.5'!G7 -> 12 | J80: ='CSIRO-3.5'!H7 -> PIcntrl Run 1 | K80: ='CSIRO-3.5'!I7 -> 1871 | L80: ='CSIRO-3.5'!J7 -> initialised from end of year 170 of PIcntrl Run1. | M80: =H80-F80+1 -> 130 | N80: =12*(H80-F80)+I80-G80+1 -> 1560
A81: ='CSIRO-3.5'!F$2 -> CSIRO Atmospheric Research | B81: ='CSIRO-3.5'!F$3 -> Australia | C81: ='CSIRO-3.5'!F$1 -> CSIRO-Mk3.5 | D81: ='CSIRO-3.5'!B8 -> 20C3M | E81: ='CSIRO-3.5'!C8 -> Run2 | F81: ='CSIRO-3.5'!D8 -> 1871 | G81: ='CSIRO-3.5'!E8 -> 1 | H81: ='CSIRO-3.5'!F8 -> 2000 | I81: ='CSIRO-3.5'!G8 -> 12 | J81: ='CSIRO-3.5'!H8 -> PIcntrl Run 1 | K81: ='CSIRO-3.5'!I8 -> 1891 | L81: ='CSIRO-3.5'!J8 -> initialised from end of year 190 of Picntrl Run1. | M81: =H81-F81+1 -> 130 | N81: =12*(H81-F81)+I81-G81+1 -> 1560
A82: ='CSIRO-3.5'!F$2 -> CSIRO Atmospheric Research | B82: ='CSIRO-3.5'!F$3 -> Australia | C82: ='CSIRO-3.5'!F$1 -> CSIRO-Mk3.5 | D82: ='CSIRO-3.5'!B9 -> 20C3M | E82: ='CSIRO-3.5'!C9 -> Run3 | F82: ='CSIRO-3.5'!D9 -> 1871 | G82: ='CSIRO-3.5'!E9 -> 1 | H82: ='CSIRO-3.5'!F9 -> 2000 | I82: ='CSIRO-3.5'!G9 -> 12 | J82: ='CSIRO-3.5'!H9 -> PIcntrl Run 1 | K82: ='CSIRO-3.5'!I9 -> 1911 | L82: ='CSIRO-3.5'!J9 -> initialised from end of year 210 of Picntrl Run1. | M82: =H82-F82+1 -> 130 | N82: =12*(H82-F82)+I82-G82+1 -> 1560
A83: =ECHAM5!F$2 -> Max Planck Institute for Meteorology | B83: =ECHAM5!F$3 -> Germany | C83: =ECHAM5!F$1 -> ECHAM5/MPI-OM | D83: =ECHAM5!B10 -> 20C3M | E83: =ECHAM5!C10 -> Run 1 | F83: =ECHAM5!D10 -> 1860 | G83: =ECHAM5!E10 -> 1 | H83: =ECHAM5!F10 -> 2000 | I83: =ECHAM5!G10 -> 12 | J83: =ECHAM5!H10 -> PIcntrl | K83: =ECHAM5!I10 -> 2190 | L83: =ECHAM5!J10 -> - | M83: =H83-F83+1 -> 141 | N83: =12*(H83-F83)+I83-G83+1 -> 1692
A84: =ECHAM5!F$2 -> Max Planck Institute for Meteorology | B84: =ECHAM5!F$3 -> Germany | C84: =ECHAM5!F$1 -> ECHAM5/MPI-OM | D84: =ECHAM5!B11 -> 20C3M | E84: =ECHAM5!C11 -> Run 2 | F84: =ECHAM5!D11 -> 1860 | G84: =ECHAM5!E11 -> 1 | H84: =ECHAM5!F11 -> 2000 | I84: =ECHAM5!G11 -> 12 | J84: =ECHAM5!H11 -> PIcntrl | K84: =ECHAM5!I11 -> 2215 | L84: =ECHAM5!J11 -> - | M84: =H84-F84+1 -> 141 | N84: =12*(H84-F84)+I84-G84+1 -> 1692
A85: =ECHAM5!F$2 -> Max Planck Institute for Meteorology | B85: =ECHAM5!F$3 -> Germany | C85: =ECHAM5!F$1 -> ECHAM5/MPI-OM | D85: =ECHAM5!B12 -> 20C3M | E85: =ECHAM5!C12 -> Run 3 | F85: =ECHAM5!D12 -> 1860 | G85: =ECHAM5!E12 -> 1 | H85: =ECHAM5!F12 -> 2000 | I85: =ECHAM5!G12 -> 12 | J85: =ECHAM5!H12 -> PIcntrl | K85: =ECHAM5!I12 -> 2240 | L85: =ECHAM5!J12 -> - | M85: =H85-F85+1 -> 141 | N85: =12*(H85-F85)+I85-G85+1 -> 1692
A86: ='ECHO-G'!F$2 -> Meteorological Institute of the University of Bonn (MIUB), Meteorological Research Institute of KMA (METRI), and Model and Data group (M&D) | B86: ='ECHO-G'!F$3 -> Germany & Korea | C86: ='ECHO-G'!F$1 -> ECHO-G | D86: ='ECHO-G'!B8 -> 20C3M | E86: ='ECHO-G'!C8 -> Run 1 | F86: ='ECHO-G'!D8 -> 1860 | G86: ='ECHO-G'!E8 -> 1 | H86: ='ECHO-G'!F8 -> 2000 | I86: ='ECHO-G'!G8 -> 12 | J86: ='ECHO-G'!H8 -> Picntrl | K86: ='ECHO-G'!I8 -> 1860 | L86: ='ECHO-G'!J8 -> run was initiated in year 1854 from year 199 of the Picntrl-FUB run. Besides imposed variations in GHG concentrations and aerosols, volcanic forcing was implemented through solar constant changes following Crowley (2000, Science, 289, 270-277). Also solar variability was included, with a value of 1366 W/m2 at year 1860 followed by variations that give an average over the period 1860-1998 near 1365 W/m2, which is also the value of the solar constant specified throughout the PIcntrl run. | M86: =H86-F86+1 -> 141 | N86: =12*(H86-F86)+I86-G86+1 -> 1692
A87: ='ECHO-G'!F$2 -> Meteorological Institute of the University of Bonn (MIUB), Meteorological Research Institute of KMA (METRI), and Model and Data group (M&D) | B87: ='ECHO-G'!F$3 -> Germany & Korea | C87: ='ECHO-G'!F$1 -> ECHO-G | D87: ='ECHO-G'!B9 -> 20C3M | E87: ='ECHO-G'!C9 -> Run 2 | F87: ='ECHO-G'!D9 -> 1860 | G87: ='ECHO-G'!E9 -> 1 | H87: ='ECHO-G'!F9 -> 2000 | I87: ='ECHO-G'!G9 -> 12 | J87: ='ECHO-G'!H9 -> Picntrl | K87: ='ECHO-G'!I9 -> 1960 | L87: ='ECHO-G'!J9 -> run was initiated in year 1854 from year 299 of the Picntrl-FUB run. | M87: =H87-F87+1 -> 141 | N87: =12*(H87-F87)+I87-G87+1 -> 1692
A88: ='ECHO-G'!F$2 -> Meteorological Institute of the University of Bonn (MIUB), Meteorological Research Institute of KMA (METRI), and Model and Data group (M&D) | B88: ='ECHO-G'!F$3 -> Germany & Korea | C88: ='ECHO-G'!F$1 -> ECHO-G | D88: ='ECHO-G'!B10 -> 20C3M | E88: ='ECHO-G'!C10 -> Run 3 | F88: ='ECHO-G'!D10 -> 1860 | G88: ='ECHO-G'!E10 -> 1 | H88: ='ECHO-G'!F10 -> 2000 | I88: ='ECHO-G'!G10 -> 12 | J88: ='ECHO-G'!H10 -> Picntrl | K88: ='ECHO-G'!I10 -> 2060 | L88: ='ECHO-G'!J10 -> run was initiated in year 1854 from year 399 of the Picntrl-FUB run. | M88: =H88-F88+1 -> 141 | N88: =12*(H88-F88)+I88-G88+1 -> 1692
A89: ='ECHO-G'!F$2 -> Meteorological Institute of the University of Bonn (MIUB), Meteorological Research Institute of KMA (METRI), and Model and Data group (M&D) | B89: ='ECHO-G'!F$3 -> Germany & Korea | C89: ='ECHO-G'!F$1 -> ECHO-G | D89: ='ECHO-G'!B11 -> 20C3M | E89: ='ECHO-G'!C11 -> Run 4 | F89: ='ECHO-G'!D11 -> 1860 | G89: ='ECHO-G'!E11 -> 1 | H89: ='ECHO-G'!F11 -> 2000 | I89: ='ECHO-G'!G11 -> 12 | J89: ='ECHO-G'!H11 -> 20C3M Run 1 | K89: ='ECHO-G'!I11 -> 1860 | L89: ='ECHO-G'!J11 -> run on a different platform, equivalent to using slightly different atmopsheric initial condition | M89: =H89-F89+1 -> 141 | N89: =12*(H89-F89)+I89-G89+1 -> 1692
A90: ='ECHO-G'!F$2 -> Meteorological Institute of the University of Bonn (MIUB), Meteorological Research Institute of KMA (METRI), and Model and Data group (M&D) | B90: ='ECHO-G'!F$3 -> Germany & Korea | C90: ='ECHO-G'!F$1 -> ECHO-G | D90: ='ECHO-G'!B12 -> 20C3M | E90: ='ECHO-G'!C12 -> Run 5 | F90: ='ECHO-G'!D12 -> 1860 | G90: ='ECHO-G'!E12 -> 1 | H90: ='ECHO-G'!F12 -> 2000 | I90: ='ECHO-G'!G12 -> 12 | J90: ='ECHO-G'!H12 -> 20C3M Run 2 | K90: ='ECHO-G'!I12 -> 1860 | L90: ='ECHO-G'!J12 -> run on a different platform, equivalent to using slightly different atmopsheric initial condition | M90: =H90-F90+1 -> 141 | N90: =12*(H90-F90)+I90-G90+1 -> 1692
A91: =FGOALS!F$2 -> LASG / Institute of Atmospheric Physics | B91: =FGOALS!F$3 -> China | C91: =FGOALS!F$1 -> FGOALS-g1.0 | D91: =FGOALS!B9 -> 20C3M | E91: =FGOALS!C9 -> Run 1 | F91: =FGOALS!D9 -> 1850 | G91: =FGOALS!E9 -> 1 | H91: =FGOALS!F9 -> 1999 | I91: =FGOALS!G9 -> 12 | J91: =FGOALS!H9 -> PIcntrl Run 1 | K91: =FGOALS!I9 -> 1850 | L91: =FGOALS!J9 -> - | M91: =H91-F91+1 -> 150 | N91: =12*(H91-F91)+I91-G91+1 -> 1800
A92: =FGOALS!F$2 -> LASG / Institute of Atmospheric Physics | B92: =FGOALS!F$3 -> China | C92: =FGOALS!F$1 -> FGOALS-g1.0 | D92: =FGOALS!B10 -> 20C3M | E92: =FGOALS!C10 -> Run 2 | F92: =FGOALS!D10 -> 1850 | G92: =FGOALS!E10 -> 1 | H92: =FGOALS!F10 -> 1999 | I92: =FGOALS!G10 -> 12 | J92: =FGOALS!H10 -> PIcntrl Run 1 | K92: =FGOALS!I10 -> 1855 | L92: =FGOALS!J10 -> - | M92: =H92-F92+1 -> 150 | N92: =12*(H92-F92)+I92-G92+1 -> 1800
A93: =FGOALS!F$2 -> LASG / Institute of Atmospheric Physics | B93: =FGOALS!F$3 -> China | C93: =FGOALS!F$1 -> FGOALS-g1.0 | D93: =FGOALS!B11 -> 20C3M | E93: =FGOALS!C11 -> Run 3 | F93: =FGOALS!D11 -> 1850 | G93: =FGOALS!E11 -> 1 | H93: =FGOALS!F11 -> 1999 | I93: =FGOALS!G11 -> 12 | J93: =FGOALS!H11 -> PIcntrl Run 1 | K93: =FGOALS!I11 -> 1860 | L93: =FGOALS!J11 -> - | M93: =H93-F93+1 -> 150 | N93: =12*(H93-F93)+I93-G93+1 -> 1800
A94: ='GFDL-2.0'!F$2 -> US Dept. of Commerce / NOAA / Geophysical Fluid Dynamics Laboratory | B94: ='GFDL-2.0'!F$3 -> USA | C94: ='GFDL-2.0'!F$1 -> GFDL-CM2.0 | D94: ='GFDL-2.0'!B8 -> 20C3M | E94: ='GFDL-2.0'!C8 -> Run 1 | F94: ='GFDL-2.0'!D8 -> 1861 | G94: ='GFDL-2.0'!E8 -> 1 | H94: ='GFDL-2.0'!F8 -> 2000 | I94: ='GFDL-2.0'!G8 -> 12 | J94: ='GFDL-2.0'!H8 -> PIcntrl Run 1 | K94: ='GFDL-2.0'!I8 -> 1 | L94: ='GFDL-2.0'!J8 -> - | M94: =H94-F94+1 -> 140 | N94: =12*(H94-F94)+I94-G94+1 -> 1680
A95: ='GFDL-2.0'!F$2 -> US Dept. of Commerce / NOAA / Geophysical Fluid Dynamics Laboratory | B95: ='GFDL-2.0'!F$3 -> USA | C95: ='GFDL-2.0'!F$1 -> GFDL-CM2.0 | D95: ='GFDL-2.0'!B9 -> 20C3M | E95: ='GFDL-2.0'!C9 -> Run 2 | F95: ='GFDL-2.0'!D9 -> 1861 | G95: ='GFDL-2.0'!E9 -> 1 | H95: ='GFDL-2.0'!F9 -> 2000 | I95: ='GFDL-2.0'!G9 -> 12 | J95: ='GFDL-2.0'!H9 -> PIcntrl Run 1 | K95: ='GFDL-2.0'!I9 -> 101 | L95: ='GFDL-2.0'!J9 -> - | M95: =H95-F95+1 -> 140 | N95: =12*(H95-F95)+I95-G95+1 -> 1680
A96: ='GFDL-2.0'!F$2 -> US Dept. of Commerce / NOAA / Geophysical Fluid Dynamics Laboratory | B96: ='GFDL-2.0'!F$3 -> USA | C96: ='GFDL-2.0'!F$1 -> GFDL-CM2.0 | D96: ='GFDL-2.0'!B10 -> 20C3M | E96: ='GFDL-2.0'!C10 -> Run 3 | F96: ='GFDL-2.0'!D10 -> 1861 | G96: ='GFDL-2.0'!E10 -> 1 | H96: ='GFDL-2.0'!F10 -> 2000 | I96: ='GFDL-2.0'!G10 -> 12 | J96: ='GFDL-2.0'!H10 -> PIcntrl Run 1 | K96: ='GFDL-2.0'!I10 -> 151 | L96: ='GFDL-2.0'!J10 -> - | M96: =H96-F96+1 -> 140 | N96: =12*(H96-F96)+I96-G96+1 -> 1680
A97: ='GFDL-2.1'!F$2 -> US Dept. of Commerce / NOAA / Geophysical Fluid Dynamics Laboratory | B97: ='GFDL-2.1'!F$3 -> USA | C97: ='GFDL-2.1'!F$1 -> GFDL-CM2.1 | D97: ='GFDL-2.1'!B8 -> 20C3M | E97: ='GFDL-2.1'!C8 -> Run 1 | F97: ='GFDL-2.1'!D8 -> 1861 | G97: ='GFDL-2.1'!E8 -> 1 | H97: ='GFDL-2.1'!F8 -> 2000 | I97: ='GFDL-2.1'!G8 -> 12 | J97: ='GFDL-2.1'!H8 -> PIcntrl Run 1 | K97: ='GFDL-2.1'!I8 -> 1 | L97: ='GFDL-2.1'!J8 -> - | M97: =H97-F97+1 -> 140 | N97: =12*(H97-F97)+I97-G97+1 -> 1680
A98: ='GFDL-2.1'!F$2 -> US Dept. of Commerce / NOAA / Geophysical Fluid Dynamics Laboratory | B98: ='GFDL-2.1'!F$3 -> USA | C98: ='GFDL-2.1'!F$1 -> GFDL-CM2.1 | D98: ='GFDL-2.1'!B9 -> 20C3M | E98: ='GFDL-2.1'!C9 -> Run 2 | F98: ='GFDL-2.1'!D9 -> 1861 | G98: ='GFDL-2.1'!E9 -> 1 | H98: ='GFDL-2.1'!F9 -> 2000 | I98: ='GFDL-2.1'!G9 -> 12 | J98: ='GFDL-2.1'!H9 -> PIcntrl Run 1 | K98: ='GFDL-2.1'!I9 -> 41 | L98: ='GFDL-2.1'!J9 -> - | M98: =H98-F98+1 -> 140 | N98: =12*(H98-F98)+I98-G98+1 -> 1680
A99: ='GFDL-2.1'!F$2 -> US Dept. of Commerce / NOAA / Geophysical Fluid Dynamics Laboratory | B99: ='GFDL-2.1'!F$3 -> USA | C99: ='GFDL-2.1'!F$1 -> GFDL-CM2.1 | D99: ='GFDL-2.1'!B10 -> 20C3M | E99: ='GFDL-2.1'!C10 -> Run 3 | F99: ='GFDL-2.1'!D10 -> 1861 | G99: ='GFDL-2.1'!E10 -> 1 | H99: ='GFDL-2.1'!F10 -> 2000 | I99: ='GFDL-2.1'!G10 -> 12 | J99: ='GFDL-2.1'!H10 -> PIcntrl Run 1 | K99: ='GFDL-2.1'!I10 -> 81 | L99: ='GFDL-2.1'!J10 -> - | M99: =H99-F99+1 -> 140 | N99: =12*(H99-F99)+I99-G99+1 -> 1680
A100: ='GISS-AOM'!F$2 -> NASA / Goddard Institute for Space Studies | B100: ='GISS-AOM'!F$3 -> USA | C100: ='GISS-AOM'!F$1 -> GISS-AOM | D100: ='GISS-AOM'!B6 -> 20C3M | E100: ='GISS-AOM'!C6 -> Run 1 | F100: ='GISS-AOM'!D6 -> 1850 | G100: ='GISS-AOM'!E6 -> 1 | H100: ='GISS-AOM'!F6 -> 2000 | I100: ='GISS-AOM'!G6 -> 12 | J100: ='GISS-AOM'!H6 -> PIcntrl Run 1 | K100: ='GISS-AOM'!I6 -> 1850 | L100: ='GISS-AOM'!J6 -> - | M100: =H100-F100+1 -> 151 | N100: =12*(H100-F100)+I100-G100+1 -> 1812
A101: ='GISS-AOM'!F$2 -> NASA / Goddard Institute for Space Studies | B101: ='GISS-AOM'!F$3 -> USA | C101: ='GISS-AOM'!F$1 -> GISS-AOM | D101: ='GISS-AOM'!B7 -> 20C3M | E101: ='GISS-AOM'!C7 -> Run 2 | F101: ='GISS-AOM'!D7 -> 1850 | G101: ='GISS-AOM'!E7 -> 1 | H101: ='GISS-AOM'!F7 -> 2000 | I101: ='GISS-AOM'!G7 -> 12 | J101: ='GISS-AOM'!H7 -> PIcntrl Run 2 | K101: ='GISS-AOM'!I7 -> 1850 | L101: ='GISS-AOM'!J7 -> C093 | M101: =H101-F101+1 -> 151 | N101: =12*(H101-F101)+I101-G101+1 -> 1812
A102: ='GISS-EH'!F$2 -> NASA / Goddard Institute for Space Studies | B102: ='GISS-EH'!F$3 -> USA | C102: ='GISS-EH'!F$1 -> GISS-EH | D102: ='GISS-EH'!B7 -> 20C3M | E102: ='GISS-EH'!C7 -> Run 1 | F102: ='GISS-EH'!D7 -> 1880 | G102: ='GISS-EH'!E7 -> 1 | H102: ='GISS-EH'!F7 -> 1999 | I102: ='GISS-EH'!G7 -> 12 | J102: ='GISS-EH'!H7 -> PIcntrl | K102: ='GISS-EH'!I7 -> 2000 | L102: ='GISS-EH'!J7 -> Three additional years from this run (1/2000-12/2002) are available as the first 3 years of the SRESA1B simulation (where they were mistakenly stored). | M102: =H102-F102+1 -> 120 | N102: =12*(H102-F102)+I102-G102+1 -> 1440
A103: ='GISS-EH'!F$2 -> NASA / Goddard Institute for Space Studies | B103: ='GISS-EH'!F$3 -> USA | C103: ='GISS-EH'!F$1 -> GISS-EH | D103: ='GISS-EH'!B8 -> 20C3M | E103: ='GISS-EH'!C8 -> Run 2 | F103: ='GISS-EH'!D8 -> 1880 | G103: ='GISS-EH'!E8 -> 1 | H103: ='GISS-EH'!F8 -> 1999 | I103: ='GISS-EH'!G8 -> 12 | J103: ='GISS-EH'!H8 -> PIcntrl | K103: ='GISS-EH'!I8 -> 2010 | L103: ='GISS-EH'!J8 -> Three additional years from this run (1/2000-12/2002) are available as the first 3 years of the SRESA1B simulation (where they were mistakenly stored). | M103: =H103-F103+1 -> 120 | N103: =12*(H103-F103)+I103-G103+1 -> 1440
A104: ='GISS-EH'!F$2 -> NASA / Goddard Institute for Space Studies | B104: ='GISS-EH'!F$3 -> USA | C104: ='GISS-EH'!F$1 -> GISS-EH | D104: ='GISS-EH'!B9 -> 20C3M | E104: ='GISS-EH'!C9 -> Run 3 | F104: ='GISS-EH'!D9 -> 1880 | G104: ='GISS-EH'!E9 -> 1 | H104: ='GISS-EH'!F9 -> 1999 | I104: ='GISS-EH'!G9 -> 12 | J104: ='GISS-EH'!H9 -> PIcntrl | K104: ='GISS-EH'!I9 -> 2020 | L104: ='GISS-EH'!J9 -> Three additional years from this run (1/2000-12/2002) are available as the first 3 years of the SRESA1B simulation (where they were mistakenly stored). | M104: =H104-F104+1 -> 120 | N104: =12*(H104-F104)+I104-G104+1 -> 1440
A105: ='GISS-EH'!F$2 -> NASA / Goddard Institute for Space Studies | B105: ='GISS-EH'!F$3 -> USA | C105: ='GISS-EH'!F$1 -> GISS-EH | D105: ='GISS-EH'!B10 -> 20C3M | E105: ='GISS-EH'!C10 -> Run 4 | F105: ='GISS-EH'!D10 -> 1880 | G105: ='GISS-EH'!E10 -> 1 | H105: ='GISS-EH'!F10 -> 1999 | I105: ='GISS-EH'!G10 -> 12 | J105: ='GISS-EH'!H10 -> PIcntrl | K105: ='GISS-EH'!I10 -> 2030 | L105: ='GISS-EH'!J10 -> Three additional years from this run (1/2000-12/2002) are available as the first 3 years of the SRESA1B simulation (where they were mistakenly stored). | M105: =H105-F105+1 -> 120 | N105: =12*(H105-F105)+I105-G105+1 -> 1440
A106: ='GISS-EH'!F$2 -> NASA / Goddard Institute for Space Studies | B106: ='GISS-EH'!F$3 -> USA | C106: ='GISS-EH'!F$1 -> GISS-EH | D106: ='GISS-EH'!B11 -> 20C3M | E106: ='GISS-EH'!C11 -> Run 5 | F106: ='GISS-EH'!D11 -> 1880 | G106: ='GISS-EH'!E11 -> 1 | H106: ='GISS-EH'!F11 -> 2002 | I106: ='GISS-EH'!G11 -> 12 | J106: ='GISS-EH'!H11 -> PIcntrl | K106: ='GISS-EH'!I11 -> 2040 | L106: ='GISS-EH'!J11 -> - | M106: =H106-F106+1 -> 123 | N106: =12*(H106-F106)+I106-G106+1 -> 1476
A107: ='GISS-ER'!F$2 -> NASA / Goddard Institute for Space Studies | B107: ='GISS-ER'!F$3 -> USA | C107: ='GISS-ER'!F$1 -> GISS-ER | D107: ='GISS-ER'!B8 -> 20C3M | E107: ='GISS-ER'!C8 -> Run 1 | F107: ='GISS-ER'!D8 -> 1880 | G107: ='GISS-ER'!E8 -> 1 | H107: ='GISS-ER'!F8 -> 2003 | I107: ='GISS-ER'!G8 -> 12 | J107: ='GISS-ER'!H8 -> PIcntrl | K107: ='GISS-ER'!I8 -> 1906 | L107: ='GISS-ER'!J8 -> - | M107: =H107-F107+1 -> 124 | N107: =12*(H107-F107)+I107-G107+1 -> 1488
A108: ='GISS-ER'!F$2 -> NASA / Goddard Institute for Space Studies | B108: ='GISS-ER'!F$3 -> USA | C108: ='GISS-ER'!F$1 -> GISS-ER | D108: ='GISS-ER'!B9 -> 20C3M | E108: ='GISS-ER'!C9 -> Run 2 | F108: ='GISS-ER'!D9 -> 1880 | G108: ='GISS-ER'!E9 -> 1 | H108: ='GISS-ER'!F9 -> 2003 | I108: ='GISS-ER'!G9 -> 12 | J108: ='GISS-ER'!H9 -> PIcntrl | K108: ='GISS-ER'!I9 -> 1907 | L108: ='GISS-ER'!J9 -> - | M108: =H108-F108+1 -> 124 | N108: =12*(H108-F108)+I108-G108+1 -> 1488
A109: ='GISS-ER'!F$2 -> NASA / Goddard Institute for Space Studies | B109: ='GISS-ER'!F$3 -> USA | C109: ='GISS-ER'!F$1 -> GISS-ER | D109: ='GISS-ER'!B10 -> 20C3M | E109: ='GISS-ER'!C10 -> Run 3 | F109: ='GISS-ER'!D10 -> 1880 | G109: ='GISS-ER'!E10 -> 1 | H109: ='GISS-ER'!F10 -> 2100 | I109: ='GISS-ER'!G10 -> 12 | J109: ='GISS-ER'!H10 -> PIcntrl | K109: ='GISS-ER'!I10 -> 1908 | L109: ='GISS-ER'!J10 -> Note that following year 2003, there are an addition 97 years of data which should be identical to the data stored in the committed climate change experiment (i.e., Commit) | M109: =H109-F109+1 -> 221 | N109: =12*(H109-F109)+I109-G109+1 -> 2652
A110: ='GISS-ER'!F$2 -> NASA / Goddard Institute for Space Studies | B110: ='GISS-ER'!F$3 -> USA | C110: ='GISS-ER'!F$1 -> GISS-ER | D110: ='GISS-ER'!B11 -> 20C3M | E110: ='GISS-ER'!C11 -> Run 4 | F110: ='GISS-ER'!D11 -> 1880 | G110: ='GISS-ER'!E11 -> 1 | H110: ='GISS-ER'!F11 -> 2003 | I110: ='GISS-ER'!G11 -> 12 | J110: ='GISS-ER'!H11 -> PIcntrl | K110: ='GISS-ER'!I11 -> 1909 | L110: ='GISS-ER'!J11 -> - | M110: =H110-F110+1 -> 124 | N110: =12*(H110-F110)+I110-G110+1 -> 1488
A111: ='GISS-ER'!F$2 -> NASA / Goddard Institute for Space Studies | B111: ='GISS-ER'!F$3 -> USA | C111: ='GISS-ER'!F$1 -> GISS-ER | D111: ='GISS-ER'!B12 -> 20C3M | E111: ='GISS-ER'!C12 -> Run 5 | F111: ='GISS-ER'!D12 -> 1880 | G111: ='GISS-ER'!E12 -> 1 | H111: ='GISS-ER'!F12 -> 2003 | I111: ='GISS-ER'!G12 -> 12 | J111: ='GISS-ER'!H12 -> PIcntrl | K111: ='GISS-ER'!I12 -> 1910 | L111: ='GISS-ER'!J12 -> - | M111: =H111-F111+1 -> 124 | N111: =12*(H111-F111)+I111-G111+1 -> 1488
A112: ='GISS-ER'!F$2 -> NASA / Goddard Institute for Space Studies | B112: ='GISS-ER'!F$3 -> USA | C112: ='GISS-ER'!F$1 -> GISS-ER | D112: ='GISS-ER'!B13 -> 20C3M | E112: ='GISS-ER'!C13 -> Run 6 | F112: ='GISS-ER'!D13 -> 1880 | G112: ='GISS-ER'!E13 -> 1 | H112: ='GISS-ER'!F13 -> 2003 | I112: ='GISS-ER'!G13 -> 12 | J112: ='GISS-ER'!H13 -> PIcntrl | K112: ='GISS-ER'!I13 -> 1931 | L112: ='GISS-ER'!J13 -> - | M112: =H112-F112+1 -> 124 | N112: =12*(H112-F112)+I112-G112+1 -> 1488
A113: ='GISS-ER'!F$2 -> NASA / Goddard Institute for Space Studies | B113: ='GISS-ER'!F$3 -> USA | C113: ='GISS-ER'!F$1 -> GISS-ER | D113: ='GISS-ER'!B14 -> 20C3M | E113: ='GISS-ER'!C14 -> Run 7 | F113: ='GISS-ER'!D14 -> 1880 | G113: ='GISS-ER'!E14 -> 1 | H113: ='GISS-ER'!F14 -> 2003 | I113: ='GISS-ER'!G14 -> 12 | J113: ='GISS-ER'!H14 -> PIcntrl | K113: ='GISS-ER'!I14 -> 1956 | L113: ='GISS-ER'!J14 -> - | M113: =H113-F113+1 -> 124 | N113: =12*(H113-F113)+I113-G113+1 -> 1488
A114: ='GISS-ER'!F$2 -> NASA / Goddard Institute for Space Studies | B114: ='GISS-ER'!F$3 -> USA | C114: ='GISS-ER'!F$1 -> GISS-ER | D114: ='GISS-ER'!B15 -> 20C3M | E114: ='GISS-ER'!C15 -> Run 8 | F114: ='GISS-ER'!D15 -> 1880 | G114: ='GISS-ER'!E15 -> 1 | H114: ='GISS-ER'!F15 -> 2003 | I114: ='GISS-ER'!G15 -> 12 | J114: ='GISS-ER'!H15 -> PIcntrl | K114: ='GISS-ER'!I15 -> 1981 | L114: ='GISS-ER'!J15 -> - | M114: =H114-F114+1 -> 124 | N114: =12*(H114-F114)+I114-G114+1 -> 1488
A115: ='GISS-ER'!F$2 -> NASA / Goddard Institute for Space Studies | B115: ='GISS-ER'!F$3 -> USA | C115: ='GISS-ER'!F$1 -> GISS-ER | D115: ='GISS-ER'!B16 -> 20C3M | E115: ='GISS-ER'!C16 -> Run 9 | F115: ='GISS-ER'!D16 -> 1880 | G115: ='GISS-ER'!E16 -> 1 | H115: ='GISS-ER'!F16 -> 2003 | I115: ='GISS-ER'!G16 -> 12 | J115: ='GISS-ER'!H16 -> PIcntrl | K115: ='GISS-ER'!I16 -> 2006 | L115: ='GISS-ER'!J16 -> - | M115: =H115-F115+1 -> 124 | N115: =12*(H115-F115)+I115-G115+1 -> 1488
A116: =INM!F$2 -> Institute for Numerical Mathematics | B116: =INM!F$3 -> Russia | C116: =INM!F$1 -> INM-CM3.0 | D116: =INM!B8 -> 20C3M | E116: =INM!C8 -> Run 1 | F116: =INM!D8 -> 1871 | G116: =INM!E8 -> 1 | H116: =INM!F8 -> 2000 | I116: =INM!G8 -> 12 | J116: =INM!H8 -> PIcntrl | K116: =INM!I8 -> 1871 | L116: =INM!J8 -> - | M116: =H116-F116+1 -> 130 | N116: =12*(H116-F116)+I116-G116+1 -> 1560
A117: =IPSL!F$2 -> Institut Pierre Simon Laplace | B117: =IPSL!F$3 -> France | C117: =IPSL!F$1 -> IPSL-CM4 | D117: =IPSL!B8 -> 20C3M | E117: =IPSL!C8 -> Run 1 | F117: =IPSL!D8 -> 1860 | G117: =IPSL!E8 -> 1 | H117: =IPSL!F8 -> 2000 | I117: =IPSL!G8 -> 12 | J117: =IPSL!H8 -> PIcntrl Run 1 | K117: =IPSL!I8 -> 1860 | L117: =IPSL!J8 -> - | M117: =H117-F117+1 -> 141 | N117: =12*(H117-F117)+I117-G117+1 -> 1692
A118: ='MIROC(hires)'!F$2 -> Center for Climate System Research (The University of Tokyo), National Institute for Environmental Studies, and Frontier Research Center for Global Change (JAMSTEC) | B118: ='MIROC(hires)'!F$3 -> Japan | C118: ='MIROC(hires)'!F$1 -> MIROC3.2(hires) | D118: ='MIROC(hires)'!B7 -> 20C3M | E118: ='MIROC(hires)'!C7 -> Run 1 | F118: ='MIROC(hires)'!D7 -> 1900 | G118: ='MIROC(hires)'!E7 -> 1 | H118: ='MIROC(hires)'!F7 -> 2000 | I118: ='MIROC(hires)'!G7 -> 12 | J118: ='MIROC(hires)'!H7 -> PIcntrl Run 1 | K118: ='MIROC(hires)'!I7 -> 1 | L118: ='MIROC(hires)'!J7 -> The same initial condition as PIcntrl | M118: =H118-F118+1 -> 101 | N118: =12*(H118-F118)+I118-G118+1 -> 1212
A119: ='MIROC(medres)'!F$2 -> Center for Climate System Research (The University of Tokyo), National Institute for Environmental Studies, and Frontier Research Center for Global Change (JAMSTEC) | B119: ='MIROC(medres)'!F$3 -> Japan | C119: ='MIROC(medres)'!F$1 -> MIROC3.2(medres) | D119: ='MIROC(medres)'!B12 -> 20C3M | E119: ='MIROC(medres)'!C12 -> Run 1 | F119: ='MIROC(medres)'!D12 -> 1850 | G119: ='MIROC(medres)'!E12 -> 1 | H119: ='MIROC(medres)'!F12 -> 2000 | I119: ='MIROC(medres)'!G12 -> 12 | J119: ='MIROC(medres)'!H12 -> PIcntrl Run 1 | K119: ='MIROC(medres)'!I12 -> 2300 | L119: ='MIROC(medres)'!J12 -> The same initial condition as PIcntrl. | M119: =H119-F119+1 -> 151 | N119: =12*(H119-F119)+I119-G119+1 -> 1812
A120: ='MIROC(medres)'!F$2 -> Center for Climate System Research (The University of Tokyo), National Institute for Environmental Studies, and Frontier Research Center for Global Change (JAMSTEC) | B120: ='MIROC(medres)'!F$3 -> Japan | C120: ='MIROC(medres)'!F$1 -> MIROC3.2(medres) | D120: ='MIROC(medres)'!B13 -> 20C3M | E120: ='MIROC(medres)'!C13 -> Run 2 | F120: ='MIROC(medres)'!D13 -> 1850 | G120: ='MIROC(medres)'!E13 -> 1 | H120: ='MIROC(medres)'!F13 -> 2000 | I120: ='MIROC(medres)'!G13 -> 12 | J120: ='MIROC(medres)'!H13 -> PIcntrl Run 1 | K120: ='MIROC(medres)'!I13 -> 2400 | L120: ='MIROC(medres)'!J13 -> - | M120: =H120-F120+1 -> 151 | N120: =12*(H120-F120)+I120-G120+1 -> 1812
A121: ='MIROC(medres)'!F$2 -> Center for Climate System Research (The University of Tokyo), National Institute for Environmental Studies, and Frontier Research Center for Global Change (JAMSTEC) | B121: ='MIROC(medres)'!F$3 -> Japan | C121: ='MIROC(medres)'!F$1 -> MIROC3.2(medres) | D121: ='MIROC(medres)'!B14 -> 20C3M | E121: ='MIROC(medres)'!C14 -> Run 3 | F121: ='MIROC(medres)'!D14 -> 1850 | G121: ='MIROC(medres)'!E14 -> 1 | H121: ='MIROC(medres)'!F14 -> 2000 | I121: ='MIROC(medres)'!G14 -> 12 | J121: ='MIROC(medres)'!H14 -> PIcntrl Run 1 | K121: ='MIROC(medres)'!I14 -> 2500 | L121: ='MIROC(medres)'!J14 -> - | M121: =H121-F121+1 -> 151 | N121: =12*(H121-F121)+I121-G121+1 -> 1812
A122: =MRI!F$2 -> Meteorological Research Institute | B122: =MRI!F$3 -> Japan | C122: =MRI!F$1 -> MRI-CGCM2.3.2 | D122: =MRI!B8 -> 20C3M | E122: =MRI!C8 -> Run 1 | F122: =MRI!D8 -> 1850 | G122: =MRI!E8 -> 1 | H122: =MRI!F8 -> 2000 | I122: =MRI!G8 -> 12 | J122: =MRI!H8 -> PIcntrl Run 1 | K122: =MRI!I8 -> 1851 | L122: =MRI!J8 -> - | M122: =H122-F122+1 -> 151 | N122: =12*(H122-F122)+I122-G122+1 -> 1812
A123: =MRI!F$2 -> Meteorological Research Institute | B123: =MRI!F$3 -> Japan | C123: =MRI!F$1 -> MRI-CGCM2.3.2 | D123: =MRI!B9 -> 20C3M | E123: =MRI!C9 -> Run 2 | F123: =MRI!D9 -> 1850 | G123: =MRI!E9 -> 1 | H123: =MRI!F9 -> 2000 | I123: =MRI!G9 -> 12 | J123: =MRI!H9 -> PIcntrl Run 1 | K123: =MRI!I9 -> 1901 | L123: =MRI!J9 -> - | M123: =H123-F123+1 -> 151 | N123: =12*(H123-F123)+I123-G123+1 -> 1812
A124: =MRI!F$2 -> Meteorological Research Institute | B124: =MRI!F$3 -> Japan | C124: =MRI!F$1 -> MRI-CGCM2.3.2 | D124: =MRI!B10 -> 20C3M | E124: =MRI!C10 -> Run 3 | F124: =MRI!D10 -> 1850 | G124: =MRI!E10 -> 1 | H124: =MRI!F10 -> 2000 | I124: =MRI!G10 -> 12 | J124: =MRI!H10 -> PIcntrl Run 1 | K124: =MRI!I10 -> 1951 | L124: =MRI!J10 -> - | M124: =H124-F124+1 -> 151 | N124: =12*(H124-F124)+I124-G124+1 -> 1812
A125: =MRI!F$2 -> Meteorological Research Institute | B125: =MRI!F$3 -> Japan | C125: =MRI!F$1 -> MRI-CGCM2.3.2 | D125: =MRI!B11 -> 20C3M | E125: =MRI!C11 -> Run 4 | F125: =MRI!D11 -> 1850 | G125: =MRI!E11 -> 1 | H125: =MRI!F11 -> 2000 | I125: =MRI!G11 -> 12 | J125: =MRI!H11 -> PIcntrl Run 1 | K125: =MRI!I11 -> 2001 | L125: =MRI!J11 -> - | M125: =H125-F125+1 -> 151 | N125: =12*(H125-F125)+I125-G125+1 -> 1812
A126: =MRI!F$2 -> Meteorological Research Institute | B126: =MRI!F$3 -> Japan | C126: =MRI!F$1 -> MRI-CGCM2.3.2 | D126: =MRI!B12 -> 20C3M | E126: =MRI!C12 -> Run 5 | F126: =MRI!D12 -> 1850 | G126: =MRI!E12 -> 1 | H126: =MRI!F12 -> 2000 | I126: =MRI!G12 -> 12 | J126: =MRI!H12 -> PIcntrl Run 1 | K126: =MRI!I12 -> 2051 | L126: =MRI!J12 -> - | M126: =H126-F126+1 -> 151 | N126: =12*(H126-F126)+I126-G126+1 -> 1812
A127: =PCM!F$2 -> National Center for Atmospheric Research | B127: =PCM!F$3 -> USA | C127: =PCM!F$1 -> PCM | D127: =PCM!B12 -> 20C3M | E127: =PCM!C12 -> Run 1 | F127: =PCM!D12 -> 1890 | G127: =PCM!E12 -> 1 | H127: =PCM!F12 -> 1999 | I127: =PCM!G12 -> 12 | J127: =PCM!H12 -> Picntrl | K127: =PCM!I12 -> 150 | L127: =PCM!J12 -> B06.57 this run din not branch directly from the control run, but from January 1, 1890 of a ghg+sulfate+ozone run, which began in 1870 and branched from year 130 of Picntrl. | M127: =H127-F127+1 -> 110 | N127: =12*(H127-F127)+I127-G127+1 -> 1320
A128: =PCM!F$2 -> National Center for Atmospheric Research | B128: =PCM!F$3 -> USA | C128: =PCM!F$1 -> PCM | D128: =PCM!B13 -> 20C3M | E128: =PCM!C13 -> Run 2 | F128: =PCM!D13 -> 1890 | G128: =PCM!E13 -> 1 | H128: =PCM!F13 -> 1999 | I128: =PCM!G13 -> 12 | J128: =PCM!H13 -> Picntrl | K128: =PCM!I13 -> 120 | L128: =PCM!J13 -> B06.59 First year of this run was 1870, which corresponds to year 100 of Picntrl. | M128: =H128-F128+1 -> 110 | N128: =12*(H128-F128)+I128-G128+1 -> 1320
A129: =PCM!F$2 -> National Center for Atmospheric Research | B129: =PCM!F$3 -> USA | C129: =PCM!F$1 -> PCM | D129: =PCM!B14 -> 20C3M | E129: =PCM!C14 -> Run 3 | F129: =PCM!D14 -> 1890 | G129: =PCM!E14 -> 1 | H129: =PCM!F14 -> 1999 | I129: =PCM!G14 -> 12 | J129: =PCM!H14 -> Picntrl | K129: =PCM!I14 -> 130 | L129: =PCM!J14 -> B06.60 First year of this run was 1870, which corresponds to year 110 of Picntrl. | M129: =H129-F129+1 -> 110 | N129: =12*(H129-F129)+I129-G129+1 -> 1320
A130: =PCM!F$2 -> National Center for Atmospheric Research | B130: =PCM!F$3 -> USA | C130: =PCM!F$1 -> PCM | D130: =PCM!B15 -> 20C3M | E130: =PCM!C15 -> Run 4 | F130: =PCM!D15 -> 1890 | G130: =PCM!E15 -> 1 | H130: =PCM!F15 -> 1999 | I130: =PCM!G15 -> 12 | J130: =PCM!H15 -> Picntrl | K130: =PCM!I15 -> 140 | L130: =PCM!J15 -> B06.61 First year of this run was 1870, which corresponds to year 120 of Picntrl. | M130: =H130-F130+1 -> 110 | N130: =12*(H130-F130)+I130-G130+1 -> 1320
A131: =HadCM3!F$2 -> Hadley Centre for Climate Prediction and Research, Met Office | B131: =HadCM3!F$3 -> UK | C131: =HadCM3!F$1 -> UKMO-HadCM3 | D131: =HadCM3!B8 -> 20C3M | E131: =HadCM3!C8 -> Run 1 | F131: =HadCM3!D8 -> 1860 | G131: =HadCM3!E8 -> 1 | H131: =HadCM3!F8 -> 1999 | I131: =HadCM3!G8 -> 12 | J131: =HadCM3!H8 -> PIcntrl Run 1 | K131: =HadCM3!I8 -> 1860 | L131: =HadCM3!J8 -> Includes historic anthropogenic forcings. Initialized in Dec. 1859 of the control | M131: =H131-F131+1 -> 140 | N131: =12*(H131-F131)+I131-G131+1 -> 1680
A132: =HadCM3!F$2 -> Hadley Centre for Climate Prediction and Research, Met Office | B132: =HadCM3!F$3 -> UK | C132: =HadCM3!F$1 -> UKMO-HadCM3 | D132: =HadCM3!B9 -> 20C3M | E132: =HadCM3!C9 -> Run 2 | F132: =HadCM3!D9 -> 1860 | G132: =HadCM3!E9 -> 1 | H132: =HadCM3!F9 -> 1999 | I132: =HadCM3!G9 -> 12 | J132: =HadCM3!H9 -> PIcntrl Run 1 | K132: =HadCM3!I9 -> 1960 | L132: =HadCM3!J9 -> Includes historic anthropogenic forcings. Initialized in Dec. 1959 of the control | M132: =H132-F132+1 -> 140 | N132: =12*(H132-F132)+I132-G132+1 -> 1680
A133: =HadGEM1!F$2 -> Hadley Centre for Climate Prediction and Research , Met Office | B133: =HadGEM1!F$3 -> UK | C133: =HadGEM1!F$1 -> UKMO-HadGEM1 | D133: =HadGEM1!B9 -> 20C3M | E133: =HadGEM1!C9 -> Run 1 | F133: =HadGEM1!D9 -> 1860 | G133: =HadGEM1!E9 -> 1 | H133: =HadGEM1!F9 -> 1999 | I133: =HadGEM1!G9 -> 12 | J133: =HadGEM1!H9 -> PIcntrl Run 1 | K133: =HadGEM1!I9 -> 1860 | L133: =HadGEM1!J9 -> Historic anthropogenic forcings only. Run initiated in Dec. 1859 of control | M133: =H133-F133+1 -> 140 | N133: =12*(H133-F133)+I133-G133+1 -> 1680
A134: =HadGEM1!F$2 -> Hadley Centre for Climate Prediction and Research , Met Office | B134: =HadGEM1!F$3 -> UK | C134: =HadGEM1!F$1 -> UKMO-HadGEM1 | D134: =HadGEM1!B10 -> 20C3M | E134: =HadGEM1!C10 -> Run 2 | F134: =HadGEM1!D10 -> 1860 | G134: =HadGEM1!E10 -> 1 | H134: =HadGEM1!F10 -> 1999 | I134: =HadGEM1!G10 -> 12 | J134: =HadGEM1!H10 -> PIcntrl Run 1 | K134: =HadGEM1!I10 -> 1860 | L134: =HadGEM1!J10 -> Historic anthropogenic and natural forcings. Run initiated in Dec. 1859 of control. | M134: =H134-F134+1 -> 140 | N134: =12*(H134-F134)+I134-G134+1 -> 1680
A135: 0 | B135: 0 | C135: 0 | D135: 2xCO2 | E135: 0 | F135: 0 | G135: 0 | H135: 0 | I135: 0 | J135: 0 | K135: 0 | L135: 0
A136: =CCSM3!F$2 -> National Center for Atmospheric Research | B136: =CCSM3!F$3 -> USA | C136: =CCSM3!F$1 -> CCSM3 | D136: =CCSM3!B17 -> 2xCO2 | E136: =CCSM3!C17 -> Run 1 | F136: =CCSM3!D17 -> 0 | G136: =CCSM3!E17 -> 1 | H136: =CCSM3!F17 -> 67 | I136: =CCSM3!G17 -> 12 | J136: =CCSM3!H17 -> NA | K136: =CCSM3!I17 -> NA | L136: =CCSM3!J17 -> eul128x256_d50somd | M136: =H136-F136+1 -> 68 | N136: =12*(H136-F136)+I136-G136+1 -> 816
A137: ='CGCM(T47)'!F$2 -> Canadian Centre for Climate Modeling & Analysis | B137: ='CGCM(T47)'!F$3 -> Canada | C137: ='CGCM(T47)'!F$1 -> CGCM3.1(T47) | D137: ='CGCM(T47)'!B13 -> 2xCO2 | E137: ='CGCM(T47)'!C13 -> Run 1 | F137: ='CGCM(T47)'!D13 -> 1 | G137: ='CGCM(T47)'!E13 -> 1 | H137: ='CGCM(T47)'!F13 -> 30 | I137: ='CGCM(T47)'!G13 -> 12 | J137: ='CGCM(T47)'!H13 -> Slabcntl Run 1 | K137: ='CGCM(T47)'!I13 -> 1 | L137: ='CGCM(T47)'!J13 -> Same initial condition as Slabcntl | M137: =H137-F137+1 -> 30 | N137: =12*(H137-F137)+I137-G137+1 -> 360
A138: ='CGCM(T63)'!F$2 -> Canadian Centre for Climate Modeling & Analysis | B138: ='CGCM(T63)'!F$3 -> Canada | C138: ='CGCM(T63)'!F$1 -> CGCM3.1(T63) | D138: ='CGCM(T63)'!B9 -> 2xCO2 | E138: ='CGCM(T63)'!C9 -> Run 1 | F138: ='CGCM(T63)'!D9 -> 1 | G138: ='CGCM(T63)'!E9 -> 1 | H138: ='CGCM(T63)'!F9 -> 30 | I138: ='CGCM(T63)'!G9 -> 12 | J138: ='CGCM(T63)'!H9 -> Slabcntl Run 1 | K138: ='CGCM(T63)'!I9 -> 1 | L138: ='CGCM(T63)'!J9 -> Same initial condition as Slabcntl | M138: =H138-F138+1 -> 30 | N138: =12*(H138-F138)+I138-G138+1 -> 360
A139: =CNRM!F$2 -> Météo-France / Centre National de Recherches Météorologiques | B139: =CNRM!F$3 -> France | C139: =CNRM!F$1 -> CNRM-CM3 | D139: =CNRM!B9 -> 2xCO2 | E139: =CNRM!C9 -> Run 1 | F139: =CNRM!D9 -> 1990 | G139: =CNRM!E9 -> 1 | H139: =CNRM!F9 -> 2090 | I139: =CNRM!G9 -> 12 | J139: =CNRM!H9 -> NA | K139: =CNRM!I9 -> NA | L139: =CNRM!J9 -> - | M139: =H139-F139+1 -> 101 | N139: =12*(H139-F139)+I139-G139+1 -> 1212
A140: ='CSIRO-3.0'!F$2 -> CSIRO Atmospheric Research | B140: ='CSIRO-3.0'!F$3 -> Australia | C140: ='CSIRO-3.0'!F$1 -> CSIRO-Mk3.0 | D140: ='CSIRO-3.0'!B10 -> 2xCO2 | E140: ='CSIRO-3.0'!C10 -> Run 1 | F140: ='CSIRO-3.0'!D10 -> 2001 | G140: ='CSIRO-3.0'!E10 -> 1 | H140: ='CSIRO-3.0'!F10 -> 2060 | I140: ='CSIRO-3.0'!G10 -> 12 | J140: ='CSIRO-3.0'!H10 -> Slabcntl | K140: ='CSIRO-3.0'!I10 -> 2001 | L140: ='CSIRO-3.0'!J10 -> Initialized from year 110 of a specified SST run (as for Slabcntl) | M140: =H140-F140+1 -> 60 | N140: =12*(H140-F140)+I140-G140+1 -> 720
A141: =ECHAM5!F$2 -> Max Planck Institute for Meteorology | B141: =ECHAM5!F$3 -> Germany | C141: =ECHAM5!F$1 -> ECHAM5/MPI-OM | D141: =ECHAM5!B13 -> 2xCO2 | E141: =ECHAM5!C13 -> Run 1 | F141: =ECHAM5!D13 -> 2001 | G141: =ECHAM5!E13 -> 1 | H141: =ECHAM5!F13 -> 2100 | I141: =ECHAM5!G13 -> 12 | J141: =ECHAM5!H13 -> NA | K141: =ECHAM5!I13 -> NA | L141: =ECHAM5!J13 -> - | M141: =H141-F141+1 -> 100 | N141: =12*(H141-F141)+I141-G141+1 -> 1200
A142: ='GFDL-2.1'!F$2 -> US Dept. of Commerce / NOAA / Geophysical Fluid Dynamics Laboratory | B142: ='GFDL-2.1'!F$3 -> USA | C142: ='GFDL-2.1'!F$1 -> GFDL-CM2.1 | D142: ='GFDL-2.1'!B11 -> 2xCO2 | E142: ='GFDL-2.1'!C11 -> Run 1 | F142: ='GFDL-2.1'!D11 -> 0 | G142: ='GFDL-2.1'!E11 -> 0 | H142: ='GFDL-2.1'!F11 -> 0 | I142: ='GFDL-2.1'!G11 -> 0 | J142: ='GFDL-2.1'!H11 -> NA | K142: ='GFDL-2.1'!I11 -> NA | L142: ='GFDL-2.1'!J11 -> pending | M142: =H142-F142+1 -> 1 | N142: =12*(H142-F142)+I142-G142+1 -> 1
A143: ='GISS-ER'!F$2 -> NASA / Goddard Institute for Space Studies | B143: ='GISS-ER'!F$3 -> USA | C143: ='GISS-ER'!F$1 -> GISS-ER | D143: ='GISS-ER'!B17 -> 2xCO2 | E143: ='GISS-ER'!C17 -> Run 1 | F143: ='GISS-ER'!D17 -> 1901 | G143: ='GISS-ER'!E17 -> 1 | H143: ='GISS-ER'!F17 -> 2020 | I143: ='GISS-ER'!G17 -> 12 | J143: ='GISS-ER'!H17 -> Slabcntl | K143: ='GISS-ER'!I17 -> 1901 | L143: ='GISS-ER'!J17 -> - | M143: =H143-F143+1 -> 120 | N143: =12*(H143-F143)+I143-G143+1 -> 1440
A144: =INM!F$2 -> Institute for Numerical Mathematics | B144: =INM!F$3 -> Russia | C144: =INM!F$1 -> INM-CM3.0 | D144: =INM!B9 -> 2xCO2 | E144: =INM!C9 -> Run 1 | F144: =INM!D9 -> 2000 | G144: =INM!E9 -> 1 | H144: =INM!F9 -> 2059 | I144: =INM!G9 -> 12 | J144: =INM!H9 -> NA | K144: =INM!I9 -> NA | L144: =INM!J9 -> - | M144: =H144-F144+1 -> 60 | N144: =12*(H144-F144)+I144-G144+1 -> 720
A145: ='MIROC(hires)'!F$2 -> Center for Climate System Research (The University of Tokyo), National Institute for Environmental Studies, and Frontier Research Center for Global Change (JAMSTEC) | B145: ='MIROC(hires)'!F$3 -> Japan | C145: ='MIROC(hires)'!F$1 -> MIROC3.2(hires) | D145: ='MIROC(hires)'!B8 -> 2xCO2 | E145: ='MIROC(hires)'!C8 -> Run 1 | F145: ='MIROC(hires)'!D8 -> 1 | G145: ='MIROC(hires)'!E8 -> 1 | H145: ='MIROC(hires)'!F8 -> 20 | I145: ='MIROC(hires)'!G8 -> 12 | J145: ='MIROC(hires)'!H8 -> NA | K145: ='MIROC(hires)'!I8 -> NA | L145: ='MIROC(hires)'!J8 -> - | M145: =H145-F145+1 -> 20 | N145: =12*(H145-F145)+I145-G145+1 -> 240
A146: ='MIROC(medres)'!F$2 -> Center for Climate System Research (The University of Tokyo), National Institute for Environmental Studies, and Frontier Research Center for Global Change (JAMSTEC) | B146: ='MIROC(medres)'!F$3 -> Japan | C146: ='MIROC(medres)'!F$1 -> MIROC3.2(medres) | D146: ='MIROC(medres)'!B15 -> 2xCO2 | E146: ='MIROC(medres)'!C15 -> Run 1 | F146: ='MIROC(medres)'!D15 -> 15 | G146: ='MIROC(medres)'!E15 -> 1 | H146: ='MIROC(medres)'!F15 -> 75 | I146: ='MIROC(medres)'!G15 -> 12 | J146: ='MIROC(medres)'!H15 -> Slabcntl | K146: ='MIROC(medres)'!I15 -> 15 | L146: ='MIROC(medres)'!J15 -> The same initial condition as Slabcntl | M146: =H146-F146+1 -> 61 | N146: =12*(H146-F146)+I146-G146+1 -> 732
A147: =MRI!F$2 -> Meteorological Research Institute | B147: =MRI!F$3 -> Japan | C147: =MRI!F$1 -> MRI-CGCM2.3.2 | D147: =MRI!B13 -> 2xCO2 | E147: =MRI!C13 -> Run 1 | F147: =MRI!D13 -> 1901 | G147: =MRI!E13 -> 1 | H147: =MRI!F13 -> 2050 | I147: =MRI!G13 -> 12 | J147: =MRI!H13 -> PDcntrl Run 1 | K147: =MRI!I13 -> 1801 | L147: =MRI!J13 -> Initialized from year 429 of present-day spin-up | M147: =H147-F147+1 -> 150 | N147: =12*(H147-F147)+I147-G147+1 -> 1800
A148: =PCM!F$2 -> National Center for Atmospheric Research | B148: =PCM!F$3 -> USA | C148: =PCM!F$1 -> PCM | D148: =PCM!B16 -> 2xCO2 | E148: =PCM!C16 -> Run 1 | F148: =PCM!D16 -> 0 | G148: =PCM!E16 -> 1 | H148: =PCM!F16 -> 0 | I148: =PCM!G16 -> 12 | J148: =PCM!H16 -> 0 | K148: =PCM!I16 -> 0 | L148: =PCM!J16 -> 0 | M148: =H148-F148+1 -> 1 | N148: =12*(H148-F148)+I148-G148+1 -> 12
A149: =HadGEM1!F$2 -> Hadley Centre for Climate Prediction and Research , Met Office | B149: =HadGEM1!F$3 -> UK | C149: =HadGEM1!F$1 -> UKMO-HadGEM1 | D149: =HadGEM1!B11 -> 2xCO2 | E149: =HadGEM1!C11 -> Run 1 | F149: =HadGEM1!D11 -> 2006 | G149: =HadGEM1!E11 -> 12 | H149: =HadGEM1!F11 -> 2076 | I149: =HadGEM1!G11 -> 12 | J149: =HadGEM1!H11 -> PIcntrl Run 1 | K149: =HadGEM1!I11 -> NA | L149: =HadGEM1!J11 -> - | M149: =H149-F149+1 -> 71 | N149: =12*(H149-F149)+I149-G149+1 -> 841
A150: 0 | B150: 0 | C150: 0 | D150: AMIP | E150: 0 | F150: 0 | G150: 0 | H150: 0 | I150: 0 | J150: 0 | K150: 0 | L150: 0
A151: =BCC!F$2 -> Beijing Climate Center | B151: =BCC!F$3 -> China | C151: =BCC!F$1 -> BCC-CM1 | D151: =BCC!B12 -> AMIP | E151: =BCC!C12 -> Run 1 | F151: =BCC!D12 -> 1978 | G151: =BCC!E12 -> 3 | H151: =BCC!F12 -> 2003 | I151: =BCC!G12 -> 12 | J151: =BCC!H12 -> PDcntrl | K151: =BCC!I12 -> 1978 | L151: =BCC!J12 -> - | M151: =H151-F151+1 -> 26 | N151: =12*(H151-F151)+I151-G151+1 -> 310
A152: =BCC!F$2 -> Beijing Climate Center | B152: =BCC!F$3 -> China | C152: =BCC!F$1 -> BCC-CM1 | D152: =BCC!B13 -> AMIP | E152: =BCC!C13 -> Run 2 | F152: =BCC!D13 -> 1978 | G152: =BCC!E13 -> 6 | H152: =BCC!F13 -> 2003 | I152: =BCC!G13 -> 12 | J152: =BCC!H13 -> PDcntrl | K152: =BCC!I13 -> 1978 | L152: =BCC!J13 -> - | M152: =H152-F152+1 -> 26 | N152: =12*(H152-F152)+I152-G152+1 -> 307
A153: =BCC!F$2 -> Beijing Climate Center | B153: =BCC!F$3 -> China | C153: =BCC!F$1 -> BCC-CM1 | D153: =BCC!B14 -> AMIP | E153: =BCC!C14 -> Run 3 | F153: =BCC!D14 -> 1978 | G153: =BCC!E14 -> 9 | H153: =BCC!F14 -> 2003 | I153: =BCC!G14 -> 12 | J153: =BCC!H14 -> PDcntrl | K153: =BCC!I14 -> 1978 | L153: =BCC!J14 -> - | M153: =H153-F153+1 -> 26 | N153: =12*(H153-F153)+I153-G153+1 -> 304
A154: =BCC!F$2 -> Beijing Climate Center | B154: =BCC!F$3 -> China | C154: =BCC!F$1 -> BCC-CM1 | D154: =BCC!B15 -> AMIP | E154: =BCC!C15 -> Run 3 | F154: =BCC!D15 -> 1978 | G154: =BCC!E15 -> 12 | H154: =BCC!F15 -> 2003 | I154: =BCC!G15 -> 12 | J154: =BCC!H15 -> PDcntrl | K154: =BCC!I15 -> 1978 | L154: =BCC!J15 -> - | M154: =H154-F154+1 -> 26 | N154: =12*(H154-F154)+I154-G154+1 -> 301
A155: =CCSM3!F$2 -> National Center for Atmospheric Research | B155: =CCSM3!F$3 -> USA | C155: =CCSM3!F$1 -> CCSM3 | D155: =CCSM3!B18 -> AMIP | E155: =CCSM3!C18 -> Run 1 | F155: =CCSM3!D18 -> 1978 | G155: =CCSM3!E18 -> 1 | H155: =CCSM3!F18 -> 2000 | I155: =CCSM3!G18 -> 12 | J155: =CCSM3!H18 -> NA | K155: =CCSM3!I18 -> NA | L155: =CCSM3!J18 -> eul128x256_d48ttne2amip | M155: =H155-F155+1 -> 23 | N155: =12*(H155-F155)+I155-G155+1 -> 276
A156: =CNRM!F$2 -> Météo-France / Centre National de Recherches Météorologiques | B156: =CNRM!F$3 -> France | C156: =CNRM!F$1 -> CNRM-CM3 | D156: =CNRM!B10 -> AMIP | E156: =CNRM!C10 -> Run 1 | F156: =CNRM!D10 -> 1979 | G156: =CNRM!E10 -> 1 | H156: =CNRM!F10 -> 2000 | I156: =CNRM!G10 -> 12 | J156: =CNRM!H10 -> NA | K156: =CNRM!I10 -> NA | L156: =CNRM!J10 -> - | M156: =H156-F156+1 -> 22 | N156: =12*(H156-F156)+I156-G156+1 -> 264
A157: =ECHAM5!F$2 -> Max Planck Institute for Meteorology | B157: =ECHAM5!F$3 -> Germany | C157: =ECHAM5!F$1 -> ECHAM5/MPI-OM | D157: =ECHAM5!B14 -> AMIP | E157: =ECHAM5!C14 -> Run 1 | F157: =ECHAM5!D14 -> 1978 | G157: =ECHAM5!E14 -> 1 | H157: =ECHAM5!F14 -> 1999 | I157: =ECHAM5!G14 -> 12 | J157: =ECHAM5!H14 -> NA | K157: =ECHAM5!I14 -> NA | L157: =ECHAM5!J14 -> - | M157: =H157-F157+1 -> 22 | N157: =12*(H157-F157)+I157-G157+1 -> 264
A158: =ECHAM5!F$2 -> Max Planck Institute for Meteorology | B158: =ECHAM5!F$3 -> Germany | C158: =ECHAM5!F$1 -> ECHAM5/MPI-OM | D158: =ECHAM5!B15 -> AMIP | E158: =ECHAM5!C15 -> Run 2 | F158: =ECHAM5!D15 -> 1978 | G158: =ECHAM5!E15 -> 1 | H158: =ECHAM5!F15 -> 1999 | I158: =ECHAM5!G15 -> 12 | J158: =ECHAM5!H15 -> NA | K158: =ECHAM5!I15 -> NA | L158: =ECHAM5!J15 -> - | M158: =H158-F158+1 -> 22 | N158: =12*(H158-F158)+I158-G158+1 -> 264
A159: =ECHAM5!F$2 -> Max Planck Institute for Meteorology | B159: =ECHAM5!F$3 -> Germany | C159: =ECHAM5!F$1 -> ECHAM5/MPI-OM | D159: =ECHAM5!B16 -> AMIP | E159: =ECHAM5!C16 -> Run 3 | F159: =ECHAM5!D16 -> 1978 | G159: =ECHAM5!E16 -> 1 | H159: =ECHAM5!F16 -> 1999 | I159: =ECHAM5!G16 -> 12 | J159: =ECHAM5!H16 -> NA | K159: =ECHAM5!I16 -> NA | L159: =ECHAM5!J16 -> - | M159: =H159-F159+1 -> 22 | N159: =12*(H159-F159)+I159-G159+1 -> 264
A160: ='GFDL-2.1'!F$2 -> US Dept. of Commerce / NOAA / Geophysical Fluid Dynamics Laboratory | B160: ='GFDL-2.1'!F$3 -> USA | C160: ='GFDL-2.1'!F$1 -> GFDL-CM2.1 | D160: ='GFDL-2.1'!B12 -> AMIP | E160: ='GFDL-2.1'!C12 -> Run 1 | F160: ='GFDL-2.1'!D12 -> 0 | G160: ='GFDL-2.1'!E12 -> 0 | H160: ='GFDL-2.1'!F12 -> 0 | I160: ='GFDL-2.1'!G12 -> 0 | J160: ='GFDL-2.1'!H12 -> NA | K160: ='GFDL-2.1'!I12 -> NA | L160: ='GFDL-2.1'!J12 -> pending | M160: =H160-F160+1 -> 1 | N160: =12*(H160-F160)+I160-G160+1 -> 1
A161: ='GISS-ER'!F$2 -> NASA / Goddard Institute for Space Studies | B161: ='GISS-ER'!F$3 -> USA | C161: ='GISS-ER'!F$1 -> GISS-ER | D161: ='GISS-ER'!B18 -> AMIP | E161: ='GISS-ER'!C18 -> Run 1 | F161: ='GISS-ER'!D18 -> 1979 | G161: ='GISS-ER'!E18 -> 1 | H161: ='GISS-ER'!F18 -> 2000 | I161: ='GISS-ER'!G18 -> 12 | J161: ='GISS-ER'!H18 -> NA | K161: ='GISS-ER'!I18 -> NA | L161: ='GISS-ER'!J18 -> - | M161: =H161-F161+1 -> 22 | N161: =12*(H161-F161)+I161-G161+1 -> 264
A162: =INM!F$2 -> Institute for Numerical Mathematics | B162: =INM!F$3 -> Russia | C162: =INM!F$1 -> INM-CM3.0 | D162: =INM!B10 -> AMIP | E162: =INM!C10 -> Run 1 | F162: =INM!D10 -> 1979 | G162: =INM!E10 -> 1 | H162: =INM!F10 -> 2003 | I162: =INM!G10 -> 12 | J162: =INM!H10 -> NA | K162: =INM!I10 -> NA | L162: =INM!J10 -> - | M162: =H162-F162+1 -> 25 | N162: =12*(H162-F162)+I162-G162+1 -> 300
A163: ='MIROC(hires)'!F$2 -> Center for Climate System Research (The University of Tokyo), National Institute for Environmental Studies, and Frontier Research Center for Global Change (JAMSTEC) | B163: ='MIROC(hires)'!F$3 -> Japan | C163: ='MIROC(hires)'!F$1 -> MIROC3.2(hires) | D163: ='MIROC(hires)'!B9 -> AMIP | E163: ='MIROC(hires)'!C9 -> Run 1 | F163: ='MIROC(hires)'!D9 -> 1979 | G163: ='MIROC(hires)'!E9 -> 1 | H163: ='MIROC(hires)'!F9 -> 2002 | I163: ='MIROC(hires)'!G9 -> 12 | J163: ='MIROC(hires)'!H9 -> NA | K163: ='MIROC(hires)'!I9 -> NA | L163: ='MIROC(hires)'!J9 -> - | M163: =H163-F163+1 -> 24 | N163: =12*(H163-F163)+I163-G163+1 -> 288
A164: ='MIROC(medres)'!F$2 -> Center for Climate System Research (The University of Tokyo), National Institute for Environmental Studies, and Frontier Research Center for Global Change (JAMSTEC) | B164: ='MIROC(medres)'!F$3 -> Japan | C164: ='MIROC(medres)'!F$1 -> MIROC3.2(medres) | D164: ='MIROC(medres)'!B16 -> AMIP | E164: ='MIROC(medres)'!C16 -> Run 1 | F164: ='MIROC(medres)'!D16 -> 1979 | G164: ='MIROC(medres)'!E16 -> 1 | H164: ='MIROC(medres)'!F16 -> 2002 | I164: ='MIROC(medres)'!G16 -> 12 | J164: ='MIROC(medres)'!H16 -> NA | K164: ='MIROC(medres)'!I16 -> NA | L164: ='MIROC(medres)'!J16 -> - | M164: =H164-F164+1 -> 24 | N164: =12*(H164-F164)+I164-G164+1 -> 288
A165: ='MIROC(medres)'!F$2 -> Center for Climate System Research (The University of Tokyo), National Institute for Environmental Studies, and Frontier Research Center for Global Change (JAMSTEC) | B165: ='MIROC(medres)'!F$3 -> Japan | C165: ='MIROC(medres)'!F$1 -> MIROC3.2(medres) | D165: ='MIROC(medres)'!B17 -> AMIP | E165: ='MIROC(medres)'!C17 -> Run 2 | F165: ='MIROC(medres)'!D17 -> 1979 | G165: ='MIROC(medres)'!E17 -> 1 | H165: ='MIROC(medres)'!F17 -> 2002 | I165: ='MIROC(medres)'!G17 -> 12 | J165: ='MIROC(medres)'!H17 -> NA | K165: ='MIROC(medres)'!I17 -> NA | L165: ='MIROC(medres)'!J17 -> - | M165: =H165-F165+1 -> 24 | N165: =12*(H165-F165)+I165-G165+1 -> 288
A166: ='MIROC(medres)'!F$2 -> Center for Climate System Research (The University of Tokyo), National Institute for Environmental Studies, and Frontier Research Center for Global Change (JAMSTEC) | B166: ='MIROC(medres)'!F$3 -> Japan | C166: ='MIROC(medres)'!F$1 -> MIROC3.2(medres) | D166: ='MIROC(medres)'!B18 -> AMIP | E166: ='MIROC(medres)'!C18 -> Run 3 | F166: ='MIROC(medres)'!D18 -> 1979 | G166: ='MIROC(medres)'!E18 -> 1 | H166: ='MIROC(medres)'!F18 -> 2002 | I166: ='MIROC(medres)'!G18 -> 12 | J166: ='MIROC(medres)'!H18 -> NA | K166: ='MIROC(medres)'!I18 -> NA | L166: ='MIROC(medres)'!J18 -> - | M166: =H166-F166+1 -> 24 | N166: =12*(H166-F166)+I166-G166+1 -> 288
A167: =MRI!F$2 -> Meteorological Research Institute | B167: =MRI!F$3 -> Japan | C167: =MRI!F$1 -> MRI-CGCM2.3.2 | D167: =MRI!B14 -> AMIP | E167: =MRI!C14 -> Run 1 | F167: =MRI!D14 -> 1979 | G167: =MRI!E14 -> 1 | H167: =MRI!F14 -> 2002 | I167: =MRI!G14 -> 12 | J167: =MRI!H14 -> PDcntrl Run 1 | K167: =MRI!I14 -> 1801 | L167: =MRI!J14 -> Initialized from year 429 of present-day spin-up | M167: =H167-F167+1 -> 24 | N167: =12*(H167-F167)+I167-G167+1 -> 288
A168: =PCM!F$2 -> National Center for Atmospheric Research | B168: =PCM!F$3 -> USA | C168: =PCM!F$1 -> PCM | D168: =PCM!B17 -> AMIP | E168: =PCM!C17 -> Run 1 | F168: =PCM!D17 -> 1979 | G168: =PCM!E17 -> 1 | H168: =PCM!F17 -> 1997 | I168: =PCM!G17 -> 12 | J168: =PCM!H17 -> NA | K168: =PCM!I17 -> NA | L168: =PCM!J17 -> amip2a
A169: =HadGEM1!F$2 -> Hadley Centre for Climate Prediction and Research , Met Office | B169: =HadGEM1!F$3 -> UK | C169: =HadGEM1!F$1 -> UKMO-HadGEM1 | D169: =HadGEM1!B12 -> AMIP | E169: =HadGEM1!C12 -> Run 1 | F169: =HadGEM1!D12 -> 1978 | G169: =HadGEM1!E12 -> 9 | H169: =HadGEM1!F12 -> 2000 | I169: =HadGEM1!G12 -> 12 | J169: =HadGEM1!H12 -> NA | K169: =HadGEM1!I12 -> NA | L169: =HadGEM1!J12 -> - | M169: =H169-F169+1 -> 23 | N169: =12*(H169-F169)+I169-G169+1 -> 268
A170: 0 | B170: 0 | C170: 0 | D170: Commit | E170: 0 | F170: 0 | G170: 0 | H170: 0 | I170: 0 | J170: 0 | K170: 0 | L170: 0
A171: =CCSM3!F$2 -> National Center for Atmospheric Research | B171: =CCSM3!F$3 -> USA | C171: =CCSM3!F$1 -> CCSM3 | D171: =CCSM3!B19 -> Commit | E171: =CCSM3!C19 -> Run 1 | F171: =CCSM3!D19 -> 2000 | G171: =CCSM3!E19 -> 1 | H171: =CCSM3!F19 -> 2099 | I171: =CCSM3!G19 -> 12 | J171: =CCSM3!H19 -> 20C3M run 1 | K171: =CCSM3!I19 -> 2000 | L171: =CCSM3!J19 -> b30.036a | M171: =H171-F171+1 -> 100 | N171: =12*(H171-F171)+I171-G171+1 -> 1200
A172: =CCSM3!F$2 -> National Center for Atmospheric Research | B172: =CCSM3!F$3 -> USA | C172: =CCSM3!F$1 -> CCSM3 | D172: =CCSM3!B20 -> Commit | E172: =CCSM3!C20 -> Run 2 | F172: =CCSM3!D20 -> 2000 | G172: =CCSM3!E20 -> 1 | H172: =CCSM3!F20 -> 2099 | I172: =CCSM3!G20 -> 12 | J172: =CCSM3!H20 -> 20C3M run 2 | K172: =CCSM3!I20 -> 2000 | L172: =CCSM3!J20 -> b30.036b | M172: =H172-F172+1 -> 100 | N172: =12*(H172-F172)+I172-G172+1 -> 1200
A173: =CCSM3!F$2 -> National Center for Atmospheric Research | B173: =CCSM3!F$3 -> USA | C173: =CCSM3!F$1 -> CCSM3 | D173: =CCSM3!B21 -> Commit | E173: =CCSM3!C21 -> Run 3 | F173: =CCSM3!D21 -> 2000 | G173: =CCSM3!E21 -> 1 | H173: =CCSM3!F21 -> 2099 | I173: =CCSM3!G21 -> 12 | J173: =CCSM3!H21 -> 20C3M run 3 | K173: =CCSM3!I21 -> 2000 | L173: =CCSM3!J21 -> b30.036c | M173: =H173-F173+1 -> 100 | N173: =12*(H173-F173)+I173-G173+1 -> 1200
A174: =CCSM3!F$2 -> National Center for Atmospheric Research | B174: =CCSM3!F$3 -> USA | C174: =CCSM3!F$1 -> CCSM3 | D174: =CCSM3!B22 -> Commit | E174: =CCSM3!C22 -> Run 4 | F174: =CCSM3!D22 -> 2000 | G174: =CCSM3!E22 -> 1 | H174: =CCSM3!F22 -> 2099 | I174: =CCSM3!G22 -> 12 | J174: =CCSM3!H22 -> 20C3M run 4 | K174: =CCSM3!I22 -> 2000 | L174: =CCSM3!J22 -> b30.036d | M174: =H174-F174+1 -> 100 | N174: =12*(H174-F174)+I174-G174+1 -> 1200
A175: =CCSM3!F$2 -> National Center for Atmospheric Research | B175: =CCSM3!F$3 -> USA | C175: =CCSM3!F$1 -> CCSM3 | D175: =CCSM3!B23 -> Commit | E175: =CCSM3!C23 -> Run 5 | F175: =CCSM3!D23 -> 2000 | G175: =CCSM3!E23 -> 1 | H175: =CCSM3!F23 -> 2099 | I175: =CCSM3!G23 -> 12 | J175: =CCSM3!H23 -> 20C3M run 5 | K175: =CCSM3!I23 -> 2000 | L175: =CCSM3!J23 -> b30.036e | M175: =H175-F175+1 -> 100 | N175: =12*(H175-F175)+I175-G175+1 -> 1200
A176: =CCSM3!F$2 -> National Center for Atmospheric Research | B176: =CCSM3!F$3 -> USA | C176: =CCSM3!F$1 -> CCSM3 | D176: =CCSM3!B24 -> Commit | E176: =CCSM3!C24 -> Run 6 | F176: =CCSM3!D24 -> 2000 | G176: =CCSM3!E24 -> 1 | H176: =CCSM3!F24 -> 2049 | I176: =CCSM3!G24 -> 12 | J176: =CCSM3!H24 -> 20C3M run 6 | K176: =CCSM3!I24 -> 2000 | L176: =CCSM3!J24 -> b30.036b.ES01 | M176: =H176-F176+1 -> 50 | N176: =12*(H176-F176)+I176-G176+1 -> 600
A177: =CCSM3!F$2 -> National Center for Atmospheric Research | B177: =CCSM3!F$3 -> USA | C177: =CCSM3!F$1 -> CCSM3 | D177: =CCSM3!B25 -> Commit | E177: =CCSM3!C25 -> Run 7 | F177: =CCSM3!D25 -> 2000 | G177: =CCSM3!E25 -> 1 | H177: =CCSM3!F25 -> 2049 | I177: =CCSM3!G25 -> 12 | J177: =CCSM3!H25 -> 20C3M run 7 | K177: =CCSM3!I25 -> 2000 | L177: =CCSM3!J25 -> b30.036f.ES01 | M177: =H177-F177+1 -> 50 | N177: =12*(H177-F177)+I177-G177+1 -> 600
A178: =CCSM3!F$2 -> National Center for Atmospheric Research | B178: =CCSM3!F$3 -> USA | C178: =CCSM3!F$1 -> CCSM3 | D178: =CCSM3!B26 -> Commit | E178: =CCSM3!C26 -> Run 8 | F178: =CCSM3!D26 -> 2000 | G178: =CCSM3!E26 -> 1 | H178: =CCSM3!F26 -> 2049 | I178: =CCSM3!G26 -> 12 | J178: =CCSM3!H26 -> 20C3M run 8 | K178: =CCSM3!I26 -> 2000 | L178: =CCSM3!J26 -> b30.036g.ES01 | M178: =H178-F178+1 -> 50 | N178: =12*(H178-F178)+I178-G178+1 -> 600
A179: ='CGCM(T47)'!F$2 -> Canadian Centre for Climate Modeling & Analysis | B179: ='CGCM(T47)'!F$3 -> Canada | C179: ='CGCM(T47)'!F$1 -> CGCM3.1(T47) | D179: ='CGCM(T47)'!B14 -> Commit | E179: ='CGCM(T47)'!C14 -> Run 1 | F179: ='CGCM(T47)'!D14 -> 2001 | G179: ='CGCM(T47)'!E14 -> 1 | H179: ='CGCM(T47)'!F14 -> 2100 | I179: ='CGCM(T47)'!G14 -> 12 | J179: ='CGCM(T47)'!H14 -> 20C3M Run 1 | K179: ='CGCM(T47)'!I14 -> 2001 | L179: ='CGCM(T47)'!J14 -> - | M179: =H179-F179+1 -> 100 | N179: =12*(H179-F179)+I179-G179+1 -> 1200
A180: ='CGCM(T47)'!F$2 -> Canadian Centre for Climate Modeling & Analysis | B180: ='CGCM(T47)'!F$3 -> Canada | C180: ='CGCM(T47)'!F$1 -> CGCM3.1(T47) | D180: ='CGCM(T47)'!B15 -> Commit | E180: ='CGCM(T47)'!C15 -> Run 2 | F180: ='CGCM(T47)'!D15 -> 2001 | G180: ='CGCM(T47)'!E15 -> 1 | H180: ='CGCM(T47)'!F15 -> 2100 | I180: ='CGCM(T47)'!G15 -> 12 | J180: ='CGCM(T47)'!H15 -> 20C3M Run 2 | K180: ='CGCM(T47)'!I15 -> 2001 | L180: ='CGCM(T47)'!J15 -> - | M180: =H180-F180+1 -> 100 | N180: =12*(H180-F180)+I180-G180+1 -> 1200
A181: ='CGCM(T47)'!F$2 -> Canadian Centre for Climate Modeling & Analysis | B181: ='CGCM(T47)'!F$3 -> Canada | C181: ='CGCM(T47)'!F$1 -> CGCM3.1(T47) | D181: ='CGCM(T47)'!B16 -> Commit | E181: ='CGCM(T47)'!C16 -> Run 3 | F181: ='CGCM(T47)'!D16 -> 2001 | G181: ='CGCM(T47)'!E16 -> 1 | H181: ='CGCM(T47)'!F16 -> 2100 | I181: ='CGCM(T47)'!G16 -> 12 | J181: ='CGCM(T47)'!H16 -> 20C3M Run 3 | K181: ='CGCM(T47)'!I16 -> 2001 | L181: ='CGCM(T47)'!J16 -> - | M181: =H181-F181+1 -> 100 | N181: =12*(H181-F181)+I181-G181+1 -> 1200
A182: ='CGCM(T47)'!F$2 -> Canadian Centre for Climate Modeling & Analysis | B182: ='CGCM(T47)'!F$3 -> Canada | C182: ='CGCM(T47)'!F$1 -> CGCM3.1(T47) | D182: ='CGCM(T47)'!B17 -> Commit | E182: ='CGCM(T47)'!C17 -> Run 4 | F182: ='CGCM(T47)'!D17 -> 2001 | G182: ='CGCM(T47)'!E17 -> 1 | H182: ='CGCM(T47)'!F17 -> 2100 | I182: ='CGCM(T47)'!G17 -> 12 | J182: ='CGCM(T47)'!H17 -> 20C3M Run 4 | K182: ='CGCM(T47)'!I17 -> 2001 | L182: ='CGCM(T47)'!J17 -> - | M182: =H182-F182+1 -> 100 | N182: =12*(H182-F182)+I182-G182+1 -> 1200
A183: ='CGCM(T47)'!F$2 -> Canadian Centre for Climate Modeling & Analysis | B183: ='CGCM(T47)'!F$3 -> Canada | C183: ='CGCM(T47)'!F$1 -> CGCM3.1(T47) | D183: ='CGCM(T47)'!B18 -> Commit | E183: ='CGCM(T47)'!C18 -> Run 5 | F183: ='CGCM(T47)'!D18 -> 2001 | G183: ='CGCM(T47)'!E18 -> 1 | H183: ='CGCM(T47)'!F18 -> 2100 | I183: ='CGCM(T47)'!G18 -> 12 | J183: ='CGCM(T47)'!H18 -> 20C3M Run 5 | K183: ='CGCM(T47)'!I18 -> 2001 | L183: ='CGCM(T47)'!J18 -> - | M183: =H183-F183+1 -> 100 | N183: =12*(H183-F183)+I183-G183+1 -> 1200
A184: =CNRM!F$2 -> Météo-France / Centre National de Recherches Météorologiques | B184: =CNRM!F$3 -> France | C184: =CNRM!F$1 -> CNRM-CM3 | D184: =CNRM!B11 -> Commit | E184: =CNRM!C11 -> Run 1 | F184: =CNRM!D11 -> 2000 | G184: =CNRM!E11 -> 1 | H184: =CNRM!F11 -> 2100 | I184: =CNRM!G11 -> 12 | J184: =CNRM!H11 -> 20C3M Run 1 | K184: =CNRM!I11 -> 2000 | L184: =CNRM!J11 -> - | M184: =H184-F184+1 -> 101 | N184: =12*(H184-F184)+I184-G184+1 -> 1212
A185: ='CSIRO-3.0'!F$2 -> CSIRO Atmospheric Research | B185: ='CSIRO-3.0'!F$3 -> Australia | C185: ='CSIRO-3.0'!F$1 -> CSIRO-Mk3.0 | D185: ='CSIRO-3.0'!B11 -> Commit | E185: ='CSIRO-3.0'!C11 -> Run 1 | F185: ='CSIRO-3.0'!D11 -> 2001 | G185: ='CSIRO-3.0'!E11 -> 1 | H185: ='CSIRO-3.0'!F11 -> 2100 | I185: ='CSIRO-3.0'!G11 -> 12 | J185: ='CSIRO-3.0'!H11 -> 20C3M Run 1 | K185: ='CSIRO-3.0'!I11 -> 2001 | L185: ='CSIRO-3.0'!J11 -> - | M185: =H185-F185+1 -> 100 | N185: =12*(H185-F185)+I185-G185+1 -> 1200
A186: ='CSIRO-3.5'!F$2 -> CSIRO Atmospheric Research | B186: ='CSIRO-3.5'!F$3 -> Australia | C186: ='CSIRO-3.5'!F$1 -> CSIRO-Mk3.5 | D186: ='CSIRO-3.5'!B10 -> Commit | E186: ='CSIRO-3.5'!C10 -> Run1 | F186: ='CSIRO-3.5'!D10 -> 2001 | G186: ='CSIRO-3.5'!E10 -> 1 | H186: ='CSIRO-3.5'!F10 -> 2100 | I186: ='CSIRO-3.5'!G10 -> 12 | J186: ='CSIRO-3.5'!H10 -> 20C3M Run 1 | K186: ='CSIRO-3.5'!I10 -> 2001 | L186: ='CSIRO-3.5'!J10 -> initialised from end of model year 300 (beginning of 2001 of 20C3M Run1). | M186: =H186-F186+1 -> 100 | N186: =12*(H186-F186)+I186-G186+1 -> 1200
A187: =ECHAM5!F$2 -> Max Planck Institute for Meteorology | B187: =ECHAM5!F$3 -> Germany | C187: =ECHAM5!F$1 -> ECHAM5/MPI-OM | D187: =ECHAM5!B17 -> Commit | E187: =ECHAM5!C17 -> Run 1 | F187: =ECHAM5!D17 -> 2001 | G187: =ECHAM5!E17 -> 1 | H187: =ECHAM5!F17 -> 2100 | I187: =ECHAM5!G17 -> 12 | J187: =ECHAM5!H17 -> 20C3M | K187: =ECHAM5!I17 -> 2001 | L187: =ECHAM5!J17 -> - | M187: =H187-F187+1 -> 100 | N187: =12*(H187-F187)+I187-G187+1 -> 1200
A188: =ECHAM5!F$2 -> Max Planck Institute for Meteorology | B188: =ECHAM5!F$3 -> Germany | C188: =ECHAM5!F$1 -> ECHAM5/MPI-OM | D188: =ECHAM5!B18 -> Commit | E188: =ECHAM5!C18 -> Run 2 | F188: =ECHAM5!D18 -> 2001 | G188: =ECHAM5!E18 -> 1 | H188: =ECHAM5!F18 -> 2070 | I188: =ECHAM5!G18 -> 12 | J188: =ECHAM5!H18 -> 20C3M | K188: =ECHAM5!I18 -> 2001 | L188: =ECHAM5!J18 -> - | M188: =H188-F188+1 -> 70 | N188: =12*(H188-F188)+I188-G188+1 -> 840
A189: =ECHAM5!F$2 -> Max Planck Institute for Meteorology | B189: =ECHAM5!F$3 -> Germany | C189: =ECHAM5!F$1 -> ECHAM5/MPI-OM | D189: =ECHAM5!B19 -> Commit | E189: =ECHAM5!C19 -> Run 3 | F189: =ECHAM5!D19 -> 2001 | G189: =ECHAM5!E19 -> 1 | H189: =ECHAM5!F19 -> 2100 | I189: =ECHAM5!G19 -> 12 | J189: =ECHAM5!H19 -> 20C3M | K189: =ECHAM5!I19 -> 2001 | L189: =ECHAM5!J19 -> -
A190: ='ECHO-G'!F$2 -> Meteorological Institute of the University of Bonn (MIUB), Meteorological Research Institute of KMA (METRI), and Model and Data group (M&D) | B190: ='ECHO-G'!F$3 -> Germany & Korea | C190: ='ECHO-G'!F$1 -> ECHO-G | D190: ='ECHO-G'!B13 -> Commit | E190: ='ECHO-G'!C13 -> Run 1 | F190: ='ECHO-G'!D13 -> 2001 | G190: ='ECHO-G'!E13 -> 1 | H190: ='ECHO-G'!F13 -> 2100 | I190: ='ECHO-G'!G13 -> 12 | J190: ='ECHO-G'!H13 -> 20C3M Run 1 | K190: ='ECHO-G'!I13 -> 2001 | L190: ='ECHO-G'!J13 -> - | M190: =H190-F190+1 -> 100 | N190: =12*(H190-F190)+I190-G190+1 -> 1200
A191: ='ECHO-G'!F$2 -> Meteorological Institute of the University of Bonn (MIUB), Meteorological Research Institute of KMA (METRI), and Model and Data group (M&D) | B191: ='ECHO-G'!F$3 -> Germany & Korea | C191: ='ECHO-G'!F$1 -> ECHO-G | D191: ='ECHO-G'!B14 -> Commit | E191: ='ECHO-G'!C14 -> Run 2 | F191: ='ECHO-G'!D14 -> 2001 | G191: ='ECHO-G'!E14 -> 1 | H191: ='ECHO-G'!F14 -> 2100 | I191: ='ECHO-G'!G14 -> 12 | J191: ='ECHO-G'!H14 -> 20C3M Run 2 | K191: ='ECHO-G'!I14 -> 2001 | L191: ='ECHO-G'!J14 -> - | M191: =H191-F191+1 -> 100 | N191: =12*(H191-F191)+I191-G191+1 -> 1200
A192: ='ECHO-G'!F$2 -> Meteorological Institute of the University of Bonn (MIUB), Meteorological Research Institute of KMA (METRI), and Model and Data group (M&D) | B192: ='ECHO-G'!F$3 -> Germany & Korea | C192: ='ECHO-G'!F$1 -> ECHO-G | D192: ='ECHO-G'!B15 -> Commit | E192: ='ECHO-G'!C15 -> Run 3 | F192: ='ECHO-G'!D15 -> 2001 | G192: ='ECHO-G'!E15 -> 1 | H192: ='ECHO-G'!F15 -> 2100 | I192: ='ECHO-G'!G15 -> 12 | J192: ='ECHO-G'!H15 -> 20C3M Run 3 | K192: ='ECHO-G'!I15 -> 2001 | L192: ='ECHO-G'!J15 -> - | M192: =H192-F192+1 -> 100 | N192: =12*(H192-F192)+I192-G192+1 -> 1200
A193: ='ECHO-G'!F$2 -> Meteorological Institute of the University of Bonn (MIUB), Meteorological Research Institute of KMA (METRI), and Model and Data group (M&D) | B193: ='ECHO-G'!F$3 -> Germany & Korea | C193: ='ECHO-G'!F$1 -> ECHO-G | D193: ='ECHO-G'!B16 -> Commit | E193: ='ECHO-G'!C16 -> Run 4 | F193: ='ECHO-G'!D16 -> 2001 | G193: ='ECHO-G'!E16 -> 1 | H193: ='ECHO-G'!F16 -> 2100 | I193: ='ECHO-G'!G16 -> 12 | J193: ='ECHO-G'!H16 -> 20C3M Run 4 | K193: ='ECHO-G'!I16 -> 2001 | L193: ='ECHO-G'!J16 -> - | M193: =H193-F193+1 -> 100 | N193: =12*(H193-F193)+I193-G193+1 -> 1200
A194: =FGOALS!F$2 -> LASG / Institute of Atmospheric Physics | B194: =FGOALS!F$3 -> China | C194: =FGOALS!F$1 -> FGOALS-g1.0 | D194: =FGOALS!B12 -> Commit | E194: =FGOALS!C12 -> Run 1 | F194: =FGOALS!D12 -> 2000 | G194: =FGOALS!E12 -> 1 | H194: =FGOALS!F12 -> 2099 | I194: =FGOALS!G12 -> 12 | J194: =FGOALS!H12 -> 20C3M Run 1 | K194: =FGOALS!I12 -> 2000 | L194: =FGOALS!J12 -> - | M194: =H194-F194+1 -> 100 | N194: =12*(H194-F194)+I194-G194+1 -> 1200
A195: =FGOALS!F$2 -> LASG / Institute of Atmospheric Physics | B195: =FGOALS!F$3 -> China | C195: =FGOALS!F$1 -> FGOALS-g1.0 | D195: =FGOALS!B13 -> Commit | E195: =FGOALS!C13 -> Run 2 | F195: =FGOALS!D13 -> 2000 | G195: =FGOALS!E13 -> 1 | H195: =FGOALS!F13 -> 2099 | I195: =FGOALS!G13 -> 12 | J195: =FGOALS!H13 -> 20C3M Run 2 | K195: =FGOALS!I13 -> 2000 | L195: =FGOALS!J13 -> - | M195: =H195-F195+1 -> 100 | N195: =12*(H195-F195)+I195-G195+1 -> 1200
A196: =FGOALS!F$2 -> LASG / Institute of Atmospheric Physics | B196: =FGOALS!F$3 -> China | C196: =FGOALS!F$1 -> FGOALS-g1.0 | D196: =FGOALS!B14 -> Commit | E196: =FGOALS!C14 -> Run 3 | F196: =FGOALS!D14 -> 2000 | G196: =FGOALS!E14 -> 1 | H196: =FGOALS!F14 -> 2099 | I196: =FGOALS!G14 -> 12 | J196: =FGOALS!H14 -> 20C3M Run 3 | K196: =FGOALS!I14 -> 2000 | L196: =FGOALS!J14 -> - | M196: =H196-F196+1 -> 100 | N196: =12*(H196-F196)+I196-G196+1 -> 1200
A197: ='GFDL-2.0'!F$2 -> US Dept. of Commerce / NOAA / Geophysical Fluid Dynamics Laboratory | B197: ='GFDL-2.0'!F$3 -> USA | C197: ='GFDL-2.0'!F$1 -> GFDL-CM2.0 | D197: ='GFDL-2.0'!B11 -> Commit | E197: ='GFDL-2.0'!C11 -> Run 1 | F197: ='GFDL-2.0'!D11 -> 2001 | G197: ='GFDL-2.0'!E11 -> 1 | H197: ='GFDL-2.0'!F11 -> 2100 | I197: ='GFDL-2.0'!G11 -> 12 | J197: ='GFDL-2.0'!H11 -> 20C3M Run 1 | K197: ='GFDL-2.0'!I11 -> 2001 | L197: ='GFDL-2.0'!J11 -> - | M197: =H197-F197+1 -> 100 | N197: =12*(H197-F197)+I197-G197+1 -> 1200
A198: ='GFDL-2.1'!F$2 -> US Dept. of Commerce / NOAA / Geophysical Fluid Dynamics Laboratory | B198: ='GFDL-2.1'!F$3 -> USA | C198: ='GFDL-2.1'!F$1 -> GFDL-CM2.1 | D198: ='GFDL-2.1'!B13 -> Commit | E198: ='GFDL-2.1'!C13 -> Run 1 | F198: ='GFDL-2.1'!D13 -> 2001 | G198: ='GFDL-2.1'!E13 -> 1 | H198: ='GFDL-2.1'!F13 -> 2100 | I198: ='GFDL-2.1'!G13 -> 12 | J198: ='GFDL-2.1'!H13 -> 20C3M Run 2 | K198: ='GFDL-2.1'!I13 -> 2001 | L198: ='GFDL-2.1'!J13 -> - | M198: =H198-F198+1 -> 100 | N198: =12*(H198-F198)+I198-G198+1 -> 1200
A199: ='GISS-ER'!F$2 -> NASA / Goddard Institute for Space Studies | B199: ='GISS-ER'!F$3 -> USA | C199: ='GISS-ER'!F$1 -> GISS-ER | D199: ='GISS-ER'!B19 -> Commit | E199: ='GISS-ER'!C19 -> Run 1 | F199: ='GISS-ER'!D19 -> 2004 | G199: ='GISS-ER'!E19 -> 1 | H199: ='GISS-ER'!F19 -> 2100 | I199: ='GISS-ER'!G19 -> 12 | J199: ='GISS-ER'!H19 -> 20C3M Run 3 | K199: ='GISS-ER'!I19 -> 2004 | L199: ='GISS-ER'!J19 -> - | M199: =H199-F199+1 -> 97 | N199: =12*(H199-F199)+I199-G199+1 -> 1164
A200: =INM!F$2 -> Institute for Numerical Mathematics | B200: =INM!F$3 -> Russia | C200: =INM!F$1 -> INM-CM3.0 | D200: =INM!B11 -> Commit | E200: =INM!C11 -> Run 1 | F200: =INM!D11 -> 2001 | G200: =INM!E11 -> 1 | H200: =INM!F11 -> 2100 | I200: =INM!G11 -> 12 | J200: =INM!H11 -> 20C3M | K200: =INM!I11 -> 2001 | L200: =INM!J11 -> - | M200: =H200-F200+1 -> 100 | N200: =12*(H200-F200)+I200-G200+1 -> 1200
A201: =IPSL!F$2 -> Institut Pierre Simon Laplace | B201: =IPSL!F$3 -> France | C201: =IPSL!F$1 -> IPSL-CM4 | D201: =IPSL!B9 -> Commit | E201: =IPSL!C9 -> Run 1 | F201: =IPSL!D9 -> 2001 | G201: =IPSL!E9 -> 1 | H201: =IPSL!F9 -> 2100 | I201: =IPSL!G9 -> 12 | J201: =IPSL!H9 -> 20C3M Run 0 | K201: =IPSL!I9 -> 2001 | L201: =IPSL!J9 -> Run 0 (not sent to PCMDI) is exactly the same as RUN 1 until year 1970, then it differs because of a bug reading the file of sulfate from year 1970 to 1975. We verify that the climate of year 2000 of RUN 0 is very close to climate of year 2000 of run 1. | M201: =H201-F201+1 -> 100 | N201: =12*(H201-F201)+I201-G201+1 -> 1200
A202: ='MIROC(medres)'!F$2 -> Center for Climate System Research (The University of Tokyo), National Institute for Environmental Studies, and Frontier Research Center for Global Change (JAMSTEC) | B202: ='MIROC(medres)'!F$3 -> Japan | C202: ='MIROC(medres)'!F$1 -> MIROC3.2(medres) | D202: ='MIROC(medres)'!B19 -> Commit | E202: ='MIROC(medres)'!C19 -> Run 1 | F202: ='MIROC(medres)'!D19 -> 2001 | G202: ='MIROC(medres)'!E19 -> 1 | H202: ='MIROC(medres)'!F19 -> 2100 | I202: ='MIROC(medres)'!G19 -> 12 | J202: ='MIROC(medres)'!H19 -> 20C3M Run 1 | K202: ='MIROC(medres)'!I19 -> 2001 | L202: ='MIROC(medres)'!J19 -> The initial condition is the end of the corresponding 20C3M run. | M202: =H202-F202+1 -> 100 | N202: =12*(H202-F202)+I202-G202+1 -> 1200
A203: =MRI!F$2 -> Meteorological Research Institute | B203: =MRI!F$3 -> Japan | C203: =MRI!F$1 -> MRI-CGCM2.3.2 | D203: =MRI!B15 -> Commit | E203: =MRI!C15 -> Run 1 | F203: =MRI!D15 -> 2001 | G203: =MRI!E15 -> 1 | H203: =MRI!F15 -> 2100 | I203: =MRI!G15 -> 12 | J203: =MRI!H15 -> 20C3M Run 1 | K203: =MRI!I15 -> 2001 | L203: =MRI!J15 -> - | M203: =H203-F203+1 -> 100 | N203: =12*(H203-F203)+I203-G203+1 -> 1200
A204: =PCM!F$2 -> National Center for Atmospheric Research | B204: =PCM!F$3 -> USA | C204: =PCM!F$1 -> PCM | D204: =PCM!B18 -> Commit | E204: =PCM!C18 -> Run 1 | F204: =PCM!D18 -> 2000 | G204: =PCM!E18 -> 1 | H204: =PCM!F18 -> 2099 | I204: =PCM!G18 -> 12 | J204: =PCM!H18 -> NA | K204: =PCM!I18 -> 2000 | L204: =PCM!J18 -> B07.73a; this run did not branch directly from the control run, but from January 1, 2000 of a ghg+sulfate+ozone run, which began in 1870 and branched from year 100 of the Picntrl Run 1. Thus, year 2000 of this run correponds to year 230 of the control run, but presumably has already strayed from the control run because of the 130 years under ghg+sulfate+ozone forcing. | M204: =H204-F204+1 -> 100 | N204: =12*(H204-F204)+I204-G204+1 -> 1200
A205: =PCM!F$2 -> National Center for Atmospheric Research | B205: =PCM!F$3 -> USA | C205: =PCM!F$1 -> PCM | D205: =PCM!B19 -> Commit | E205: =PCM!C19 -> Run 2 | F205: =PCM!D19 -> 2000 | G205: =PCM!E19 -> 1 | H205: =PCM!F19 -> 2099 | I205: =PCM!G19 -> 12 | J205: =PCM!H19 -> NA | K205: =PCM!I19 -> 2000 | L205: =PCM!J19 -> B07.73b; this run did not branch directly from the control run, but from January 1, 2000 of a ghg+sulfate+ozone run, which began in 1870 and branched from year 110 of the Picntrl Run 1. Thus, year 2000 of this run correponds to year 240 of the control run, but presumably has already strayed from the control run because of the 130 years under ghg+sulfate+ozone forcing. | M205: =H205-F205+1 -> 100 | N205: =12*(H205-F205)+I205-G205+1 -> 1200
A206: =PCM!F$2 -> National Center for Atmospheric Research | B206: =PCM!F$3 -> USA | C206: =PCM!F$1 -> PCM | D206: =PCM!B20 -> Commit | E206: =PCM!C20 -> Run 3 | F206: =PCM!D20 -> 2000 | G206: =PCM!E20 -> 1 | H206: =PCM!F20 -> 2099 | I206: =PCM!G20 -> 12 | J206: =PCM!H20 -> NA | K206: =PCM!I20 -> 2000 | L206: =PCM!J20 -> B07.73c; this run did not branch directly from the control run, but from January 1, 2000 of a ghg+sulfate+ozone run, which began in 1870 and branched from year 170 of the Picntrl Run 1. Thus, year 2000 of this run correponds to year 300 of the control run, but presumably has already strayed from the control run because of the 130 years under ghg+sulfate+ozone forcing. | M206: =H206-F206+1 -> 100 | N206: =12*(H206-F206)+I206-G206+1 -> 1200
A207: =PCM!F$2 -> National Center for Atmospheric Research | B207: =PCM!F$3 -> USA | C207: =PCM!F$1 -> PCM | D207: =PCM!B21 -> Commit | E207: =PCM!C21 -> Run 4 | F207: =PCM!D21 -> 2000 | G207: =PCM!E21 -> 1 | H207: =PCM!F21 -> 2099 | I207: =PCM!G21 -> 12 | J207: =PCM!H21 -> NA | K207: =PCM!I21 -> 2000 | L207: =PCM!J21 -> B07.52a; this run did not branch directly from the control run, but from January 1, 2000 of a ghg+sulfate+ozone run, which began in 1870 and branched from year 140 of the Picntrl Run 1. Thus, year 2000 of this run correponds to year 270 of the control run, but presumably has already strayed from the control run because of the 130 years under ghg+sulfate+ozone forcing. | M207: =H207-F207+1 -> 100 | N207: =12*(H207-F207)+I207-G207+1 -> 1200
A208: =HadCM3!F$2 -> Hadley Centre for Climate Prediction and Research, Met Office | B208: =HadCM3!F$3 -> UK | C208: =HadCM3!F$1 -> UKMO-HadCM3 | D208: =HadCM3!B10 -> Commit | E208: =HadCM3!C10 -> Run 1 | F208: =HadCM3!D10 -> 2000 | G208: =HadCM3!E10 -> 1 | H208: =HadCM3!F10 -> 2099 | I208: =HadCM3!G10 -> 11 | J208: =HadCM3!H10 -> 20C3M Run 2 | K208: =HadCM3!I10 -> 1999 | L208: =HadCM3!J10 -> - | M208: =H208-F208+1 -> 100 | N208: =12*(H208-F208)+I208-G208+1 -> 1199
A209: 0 | B209: 0 | C209: 0 | D209: PDcntrl | E209: 0 | F209: 0 | G209: 0 | H209: 0 | I209: 0 | J209: 0 | K209: 0 | L209: 0
A210: =BCC!F$2 -> Beijing Climate Center | B210: =BCC!F$3 -> China | C210: =BCC!F$1 -> BCC-CM1 | D210: =BCC!B16 -> PDcntrl | E210: =BCC!C16 -> Run 1 | F210: =BCC!D16 -> 1980 | G210: =BCC!E16 -> 1 | H210: =BCC!F16 -> 2192 | I210: =BCC!G16 -> 12 | J210: =BCC!H16 -> PDcntrl | K210: =BCC!I16 -> 1950 | L210: =BCC!J16 -> - | M210: =H210-F210+1 -> 213 | N210: =12*(H210-F210)+I210-G210+1 -> 2556
A211: =CCSM3!F$2 -> National Center for Atmospheric Research | B211: =CCSM3!F$3 -> USA | C211: =CCSM3!F$1 -> CCSM3 | D211: =CCSM3!B27 -> PDcntrl | E211: =CCSM3!C27 -> Run 1 | F211: =CCSM3!D27 -> 100 | G211: =CCSM3!E27 -> 1 | H211: =CCSM3!F27 -> 699 | I211: =CCSM3!G27 -> 12 | J211: =CCSM3!H27 -> NA | K211: =CCSM3!I27 -> NA | L211: =CCSM3!J27 -> b30.009 | M211: =H211-F211+1 -> 600 | N211: =12*(H211-F211)+I211-G211+1 -> 7200
A212: ='ECHO-G'!F$2 -> Meteorological Institute of the University of Bonn (MIUB), Meteorological Research Institute of KMA (METRI), and Model and Data group (M&D) | B212: ='ECHO-G'!F$3 -> Germany & Korea | C212: ='ECHO-G'!F$1 -> ECHO-G | D212: ='ECHO-G'!B17 -> PDcntrl | E212: ='ECHO-G'!C17 -> Run 1 | F212: ='ECHO-G'!D17 -> 6 | G212: ='ECHO-G'!E17 -> 1 | H212: ='ECHO-G'!F17 -> 316 | I212: ='ECHO-G'!G17 -> 12 | J212: ='ECHO-G'!H17 -> NA | K212: ='ECHO-G'!I17 -> NA | L212: ='ECHO-G'!J17 -> Using ECHO-G version without aerosols | M212: =H212-F212+1 -> 311 | N212: =12*(H212-F212)+I212-G212+1 -> 3732
A213: =IPSL!F$2 -> Institut Pierre Simon Laplace | B213: =IPSL!F$3 -> France | C213: =IPSL!F$1 -> IPSL-CM4 | D213: =IPSL!B10 -> PDcntrl | E213: =IPSL!C10 -> Run 1 | F213: =IPSL!D10 -> 1910 | G213: =IPSL!E10 -> 1 | H213: =IPSL!F10 -> 2309 | I213: =IPSL!G10 -> 12 | J213: =IPSL!H10 -> NA | K213: =IPSL!I10 -> NA | L213: =IPSL!J10 -> - | M213: =H213-F213+1 -> 400 | N213: =12*(H213-F213)+I213-G213+1 -> 4800
A214: =MRI!F$2 -> Meteorological Research Institute | B214: =MRI!F$3 -> Japan | C214: =MRI!F$1 -> MRI-CGCM2.3.2 | D214: =MRI!B16 -> PDcntrl | E214: =MRI!C16 -> Run 1 | F214: =MRI!D16 -> 1801 | G214: =MRI!E16 -> 1 | H214: =MRI!F16 -> 1950 | I214: =MRI!G16 -> 12 | J214: =MRI!H16 -> NA | K214: =MRI!I16 -> NA | L214: =MRI!J16 -> Initialized from year 429 of present-day spin-up | M214: =H214-F214+1 -> 150 | N214: =12*(H214-F214)+I214-G214+1 -> 1800
A215: =PCM!F$2 -> National Center for Atmospheric Research | B215: =PCM!F$3 -> USA | C215: =PCM!F$1 -> PCM | D215: =PCM!B22 -> PDcntrl | E215: =PCM!C22 -> Run 1 | F215: =PCM!D22 -> 50 | G215: =PCM!E22 -> 1 | H215: =PCM!F22 -> 349 | I215: =PCM!G22 -> 12 | J215: =PCM!H22 -> NA | K215: =PCM!I22 -> NA | L215: =PCM!J22 -> B04.10 | M215: =H215-F215+1 -> 300 | N215: =12*(H215-F215)+I215-G215+1 -> 3600
A216: 0 | B216: 0 | C216: 0 | D216: PIcntrl | E216: 0 | F216: 0 | G216: 0 | H216: 0 | I216: 0 | J216: 0 | K216: 0 | L216: 0
A217: =CCSM3!F$2 -> National Center for Atmospheric Research | B217: =CCSM3!F$3 -> USA | C217: =CCSM3!F$1 -> CCSM3 | D217: =CCSM3!B28 -> PIcntrl | E217: =CCSM3!C28 -> Run 1 | F217: =CCSM3!D28 -> 280 | G217: =CCSM3!E28 -> 1 | H217: =CCSM3!F28 -> 509 | I217: =CCSM3!G28 -> 12 | J217: =CCSM3!H28 -> b30.017 | K217: =CCSM3!I28 -> 280 | L217: =CCSM3!J28 -> b30.020 | M217: =H217-F217+1 -> 230 | N217: =12*(H217-F217)+I217-G217+1 -> 2760
A218: =CCSM3!F$2 -> National Center for Atmospheric Research | B218: =CCSM3!F$3 -> USA | C218: =CCSM3!F$1 -> CCSM3 | D218: =CCSM3!B29 -> PIcntrl | E218: =CCSM3!C29 -> Run 2 | F218: =CCSM3!D29 -> 300 | G218: =CCSM3!E29 -> 1 | H218: =CCSM3!F29 -> 799 | I218: =CCSM3!G29 -> 12 | J218: =CCSM3!H29 -> b30.020 | K218: =CCSM3!I29 -> 300 | L218: =CCSM3!J29 -> b30.020.ES01, b30.020.ES02 | M218: =H218-F218+1 -> 500 | N218: =12*(H218-F218)+I218-G218+1 -> 6000
A219: ='CGCM(T47)'!F$2 -> Canadian Centre for Climate Modeling & Analysis | B219: ='CGCM(T47)'!F$3 -> Canada | C219: ='CGCM(T47)'!F$1 -> CGCM3.1(T47) | D219: ='CGCM(T47)'!B19 -> PIcntrl | E219: ='CGCM(T47)'!C19 -> Run 1 | F219: ='CGCM(T47)'!D19 -> 1850 | G219: ='CGCM(T47)'!E19 -> 1 | H219: ='CGCM(T47)'!F19 -> 2850 | I219: ='CGCM(T47)'!G19 -> 12 | J219: ='CGCM(T47)'!H19 -> NA | K219: ='CGCM(T47)'!I19 -> NA | L219: ='CGCM(T47)'!J19 -> - | M219: =H219-F219+1 -> 1001 | N219: =12*(H219-F219)+I219-G219+1 -> 12012
A220: ='CGCM(T63)'!F$2 -> Canadian Centre for Climate Modeling & Analysis | B220: ='CGCM(T63)'!F$3 -> Canada | C220: ='CGCM(T63)'!F$1 -> CGCM3.1(T63) | D220: ='CGCM(T63)'!B10 -> PIcntrl | E220: ='CGCM(T63)'!C10 -> Run 1 | F220: ='CGCM(T63)'!D10 -> 1850 | G220: ='CGCM(T63)'!E10 -> 1 | H220: ='CGCM(T63)'!F10 -> 2350 | I220: ='CGCM(T63)'!G10 -> 12 | J220: ='CGCM(T63)'!H10 -> NA | K220: ='CGCM(T63)'!I10 -> NA | L220: ='CGCM(T63)'!J10 -> Some results between 2200 and 2349 are still to be submitted | M220: =H220-F220+1 -> 501 | N220: =12*(H220-F220)+I220-G220+1 -> 6012
A221: =CNRM!F$2 -> Météo-France / Centre National de Recherches Météorologiques | B221: =CNRM!F$3 -> France | C221: =CNRM!F$1 -> CNRM-CM3 | D221: =CNRM!B12 -> PIcntrl | E221: =CNRM!C12 -> Run 1 | F221: =CNRM!D12 -> 1930 | G221: =CNRM!E12 -> 1 | H221: =CNRM!F12 -> 2430 | I221: =CNRM!G12 -> 12 | J221: =CNRM!H12 -> NA | K221: =CNRM!I12 -> NA | L221: =CNRM!J12 -> - | M221: =H221-F221+1 -> 501 | N221: =12*(H221-F221)+I221-G221+1 -> 6012
A222: ='CSIRO-3.0'!F$2 -> CSIRO Atmospheric Research | B222: ='CSIRO-3.0'!F$3 -> Australia | C222: ='CSIRO-3.0'!F$1 -> CSIRO-Mk3.0 | D222: ='CSIRO-3.0'!B12 -> PIcntrl | E222: ='CSIRO-3.0'!C12 -> Run 1 | F222: ='CSIRO-3.0'!D12 -> 1871 | G222: ='CSIRO-3.0'!E12 -> 1 | H222: ='CSIRO-3.0'!F12 -> 2250 | I222: ='CSIRO-3.0'!G12 -> 12 | J222: ='CSIRO-3.0'!H12 -> NA | K222: ='CSIRO-3.0'!I12 -> NA | L222: ='CSIRO-3.0'!J12 -> Both Run 1 and Run 2 of PIcntrl were initialised from the end of a 120 year so-called adjustment control run with the full coupled model. Model year 121 renamed as 1871 to make it easier to match years to scenario runs | M222: =H222-F222+1 -> 380 | N222: =12*(H222-F222)+I222-G222+1 -> 4560
A223: ='CSIRO-3.0'!F$2 -> CSIRO Atmospheric Research | B223: ='CSIRO-3.0'!F$3 -> Australia | C223: ='CSIRO-3.0'!F$1 -> CSIRO-Mk3.0 | D223: ='CSIRO-3.0'!B13 -> PIcntrl | E223: ='CSIRO-3.0'!C13 -> Run 2 | F223: ='CSIRO-3.0'!D13 -> 2001 | G223: ='CSIRO-3.0'!E13 -> 1 | H223: ='CSIRO-3.0'!F13 -> 2080 | I223: ='CSIRO-3.0'!G13 -> 12 | J223: ='CSIRO-3.0'!H13 -> NA | K223: ='CSIRO-3.0'!I13 -> NA | L223: ='CSIRO-3.0'!J13 -> Same start as Run 1, tiny perturbation applied at end of year 120 of the so-called adjustment coupled control to give a different control realisation. Model year 121 of this realisation renamed as 2001 to match the 1% run | M223: =H223-F223+1 -> 80 | N223: =12*(H223-F223)+I223-G223+1 -> 960
A224: ='CSIRO-3.5'!F$2 -> CSIRO Atmospheric Research | B224: ='CSIRO-3.5'!F$3 -> Australia | C224: ='CSIRO-3.5'!F$1 -> CSIRO-Mk3.5 | D224: ='CSIRO-3.5'!B11 -> PIcntrl | E224: ='CSIRO-3.5'!C11 -> Run1 | F224: ='CSIRO-3.5'!D11 -> 1871 | G224: ='CSIRO-3.5'!E11 -> 1 | H224: ='CSIRO-3.5'!F11 -> 2870 | I224: ='CSIRO-3.5'!G11 -> 12 | J224: ='CSIRO-3.5'!H11 -> PIcntrl Run 1 | K224: ='CSIRO-3.5'!I11 -> NA | L224: ='CSIRO-3.5'!J11 -> Model year 171 renamed 1871 to make it easier to match years to scenarios runs. | M224: =H224-F224+1 -> 1000 | N224: =12*(H224-F224)+I224-G224+1 -> 12000
A225: =ECHAM5!F$2 -> Max Planck Institute for Meteorology | B225: =ECHAM5!F$3 -> Germany | C225: =ECHAM5!F$1 -> ECHAM5/MPI-OM | D225: =ECHAM5!B20 -> PIcntrl | E225: =ECHAM5!C20 -> Run 1 | F225: =ECHAM5!D20 -> 2150 | G225: =ECHAM5!E20 -> 1 | H225: =ECHAM5!F20 -> 2655 | I225: =ECHAM5!G20 -> 12 | J225: =ECHAM5!H20 -> NA | K225: =ECHAM5!I20 -> NA | L225: =ECHAM5!J20 -> - | M225: =H225-F225+1 -> 506 | N225: =12*(H225-F225)+I225-G225+1 -> 6072
A226: ='ECHO-G'!F$2 -> Meteorological Institute of the University of Bonn (MIUB), Meteorological Research Institute of KMA (METRI), and Model and Data group (M&D) | B226: ='ECHO-G'!F$3 -> Germany & Korea | C226: ='ECHO-G'!F$1 -> ECHO-G | D226: ='ECHO-G'!B18 -> PIcntrl | E226: ='ECHO-G'!C18 -> Run 1 | F226: ='ECHO-G'!D18 -> 1860 | G226: ='ECHO-G'!E18 -> 1 | H226: ='ECHO-G'!F18 -> 2200 | I226: ='ECHO-G'!G18 -> 12 | J226: ='ECHO-G'!H18 -> NA | K226: ='ECHO-G'!I18 -> NA | L226: ='ECHO-G'!J18 -> This run was initiated from another spun-up control (Picntrl-FUB, not available at PCMDI). It was initiated at year 199 of Picntrl-FUB and run for 6 years. The beginning of year 7 was then renamed 1860. PIcntrl differs from PIcntrl-FUB in that aerosol emissions were added, fixed at 1860 values, CO2 was changed from 277.28 to 286.20 ppm, CH4 changed from 722.82 to 805.60 ppb, and N2O changed from 310 to 276.69 ppb. These changes caused very little subsequent drift in the global mean surface temperature of this run (-0.0024 K per century). | M226: =H226-F226+1 -> 341 | N226: =12*(H226-F226)+I226-G226+1 -> 4092
A227: =FGOALS!F$2 -> LASG / Institute of Atmospheric Physics | B227: =FGOALS!F$3 -> China | C227: =FGOALS!F$1 -> FGOALS-g1.0 | D227: =FGOALS!B15 -> PIcntrl | E227: =FGOALS!C15 -> Run 1 | F227: =FGOALS!D15 -> 1850 | G227: =FGOALS!E15 -> 1 | H227: =FGOALS!F15 -> 2200 | I227: =FGOALS!G15 -> 12 | J227: =FGOALS!H15 -> NA | K227: =FGOALS!I15 -> NA | L227: =FGOALS!J15 -> - | M227: =H227-F227+1 -> 351 | N227: =12*(H227-F227)+I227-G227+1 -> 4212
A228: ='GFDL-2.0'!F$2 -> US Dept. of Commerce / NOAA / Geophysical Fluid Dynamics Laboratory | B228: ='GFDL-2.0'!F$3 -> USA | C228: ='GFDL-2.0'!F$1 -> GFDL-CM2.0 | D228: ='GFDL-2.0'!B12 -> PIcntrl | E228: ='GFDL-2.0'!C12 -> Run 1 | F228: ='GFDL-2.0'!D12 -> 1 | G228: ='GFDL-2.0'!E12 -> 1 | H228: ='GFDL-2.0'!F12 -> 500 | I228: ='GFDL-2.0'!G12 -> 12 | J228: ='GFDL-2.0'!H12 -> NA | K228: ='GFDL-2.0'!I12 -> NA | L228: ='GFDL-2.0'!J12 -> - | M228: =H228-F228+1 -> 500 | N228: =12*(H228-F228)+I228-G228+1 -> 6000
A229: ='GFDL-2.1'!F$2 -> US Dept. of Commerce / NOAA / Geophysical Fluid Dynamics Laboratory | B229: ='GFDL-2.1'!F$3 -> USA | C229: ='GFDL-2.1'!F$1 -> GFDL-CM2.1 | D229: ='GFDL-2.1'!B14 -> PIcntrl | E229: ='GFDL-2.1'!C14 -> Run 1 | F229: ='GFDL-2.1'!D14 -> 1 | G229: ='GFDL-2.1'!E14 -> 1 | H229: ='GFDL-2.1'!F14 -> 500 | I229: ='GFDL-2.1'!G14 -> 12 | J229: ='GFDL-2.1'!H14 -> NA | K229: ='GFDL-2.1'!I14 -> NA | L229: ='GFDL-2.1'!J14 -> - | M229: =H229-F229+1 -> 500 | N229: =12*(H229-F229)+I229-G229+1 -> 6000
A230: ='GISS-AOM'!F$2 -> NASA / Goddard Institute for Space Studies | B230: ='GISS-AOM'!F$3 -> USA | C230: ='GISS-AOM'!F$1 -> GISS-AOM | D230: ='GISS-AOM'!B8 -> PIcntrl | E230: ='GISS-AOM'!C8 -> Run 1 | F230: ='GISS-AOM'!D8 -> 1850 | G230: ='GISS-AOM'!E8 -> 1 | H230: ='GISS-AOM'!F8 -> 2100 | I230: ='GISS-AOM'!G8 -> 12 | J230: ='GISS-AOM'!H8 -> NA | K230: ='GISS-AOM'!I8 -> NA | L230: ='GISS-AOM'!J8 -> C080 | M230: =H230-F230+1 -> 251 | N230: =12*(H230-F230)+I230-G230+1 -> 3012
A231: ='GISS-AOM'!F$2 -> NASA / Goddard Institute for Space Studies | B231: ='GISS-AOM'!F$3 -> USA | C231: ='GISS-AOM'!F$1 -> GISS-AOM | D231: ='GISS-AOM'!B9 -> PIcntrl | E231: ='GISS-AOM'!C9 -> Run 2 | F231: ='GISS-AOM'!D9 -> 1850 | G231: ='GISS-AOM'!E9 -> 1 | H231: ='GISS-AOM'!F9 -> 2100 | I231: ='GISS-AOM'!G9 -> 12 | J231: ='GISS-AOM'!H9 -> NA | K231: ='GISS-AOM'!I9 -> NA | L231: ='GISS-AOM'!J9 -> C090 | M231: =H231-F231+1 -> 251 | N231: =12*(H231-F231)+I231-G231+1 -> 3012
A232: ='GISS-EH'!F$2 -> NASA / Goddard Institute for Space Studies | B232: ='GISS-EH'!F$3 -> USA | C232: ='GISS-EH'!F$1 -> GISS-EH | D232: ='GISS-EH'!B12 -> PIcntrl | E232: ='GISS-EH'!C12 -> Run 1 | F232: ='GISS-EH'!D12 -> 1880 | G232: ='GISS-EH'!E12 -> 1 | H232: ='GISS-EH'!F12 -> 2279 | I232: ='GISS-EH'!G12 -> 12 | J232: ='GISS-EH'!H12 -> NA | K232: ='GISS-EH'!I12 -> NA | L232: ='GISS-EH'!J12 -> - | M232: =H232-F232+1 -> 400 | N232: =12*(H232-F232)+I232-G232+1 -> 4800
A233: ='GISS-ER'!F$2 -> NASA / Goddard Institute for Space Studies | B233: ='GISS-ER'!F$3 -> USA | C233: ='GISS-ER'!F$1 -> GISS-ER | D233: ='GISS-ER'!B20 -> PIcntrl | E233: ='GISS-ER'!C20 -> Run 1 | F233: ='GISS-ER'!D20 -> 1901 | G233: ='GISS-ER'!E20 -> 1 | H233: ='GISS-ER'!F20 -> 2400 | I233: ='GISS-ER'!G20 -> 12 | J233: ='GISS-ER'!H20 -> NA | K233: ='GISS-ER'!I20 -> NA | L233: ='GISS-ER'!J20 -> - | M233: =H233-F233+1 -> 500 | N233: =12*(H233-F233)+I233-G233+1 -> 6000
A234: =INM!F$2 -> Institute for Numerical Mathematics | B234: =INM!F$3 -> Russia | C234: =INM!F$1 -> INM-CM3.0 | D234: =INM!B12 -> PIcntrl | E234: =INM!C12 -> Run 1 | F234: =INM!D12 -> 1871 | G234: =INM!E12 -> 1 | H234: =INM!F12 -> 2200 | I234: =INM!G12 -> 12 | J234: =INM!H12 -> NA | K234: =INM!I12 -> NA | L234: =INM!J12 -> - | M234: =H234-F234+1 -> 330 | N234: =12*(H234-F234)+I234-G234+1 -> 3960
A235: =IPSL!F$2 -> Institut Pierre Simon Laplace | B235: =IPSL!F$3 -> France | C235: =IPSL!F$1 -> IPSL-CM4 | D235: =IPSL!B11 -> PIcntrl | E235: =IPSL!C11 -> Run 1 | F235: =IPSL!D11 -> 1860 | G235: =IPSL!E11 -> 1 | H235: =IPSL!F11 -> 2179 | I235: =IPSL!G11 -> 12 | J235: =IPSL!H11 -> NA | K235: =IPSL!I11 -> NA | L235: =IPSL!J11 -> - | M235: =H235-F235+1 -> 320 | N235: =12*(H235-F235)+I235-G235+1 -> 3840
A236: ='MIROC(hires)'!F$2 -> Center for Climate System Research (The University of Tokyo), National Institute for Environmental Studies, and Frontier Research Center for Global Change (JAMSTEC) | B236: ='MIROC(hires)'!F$3 -> Japan | C236: ='MIROC(hires)'!F$1 -> MIROC3.2(hires) | D236: ='MIROC(hires)'!B10 -> PIcntrl | E236: ='MIROC(hires)'!C10 -> Run 1 | F236: ='MIROC(hires)'!D10 -> 1 | G236: ='MIROC(hires)'!E10 -> 1 | H236: ='MIROC(hires)'!F10 -> 100 | I236: ='MIROC(hires)'!G10 -> 12 | J236: ='MIROC(hires)'!H10 -> NA | K236: ='MIROC(hires)'!I10 -> NA | L236: ='MIROC(hires)'!J10 -> - | M236: =H236-F236+1 -> 100 | N236: =12*(H236-F236)+I236-G236+1 -> 1200
A237: ='MIROC(medres)'!F$2 -> Center for Climate System Research (The University of Tokyo), National Institute for Environmental Studies, and Frontier Research Center for Global Change (JAMSTEC) | B237: ='MIROC(medres)'!F$3 -> Japan | C237: ='MIROC(medres)'!F$1 -> MIROC3.2(medres) | D237: ='MIROC(medres)'!B20 -> PIcntrl | E237: ='MIROC(medres)'!C20 -> Run 1 | F237: ='MIROC(medres)'!D20 -> 2300 | G237: ='MIROC(medres)'!E20 -> 1 | H237: ='MIROC(medres)'!F20 -> 2799 | I237: ='MIROC(medres)'!G20 -> 12 | J237: ='MIROC(medres)'!H20 -> NA | K237: ='MIROC(medres)'!I20 -> NA | L237: ='MIROC(medres)'!J20 -> - | M237: =H237-F237+1 -> 500 | N237: =12*(H237-F237)+I237-G237+1 -> 6000
A238: =MRI!F$2 -> Meteorological Research Institute | B238: =MRI!F$3 -> Japan | C238: =MRI!F$1 -> MRI-CGCM2.3.2 | D238: =MRI!B17 -> PIcntrl | E238: =MRI!C17 -> Run 1 | F238: =MRI!D17 -> 1851 | G238: =MRI!E17 -> 1 | H238: =MRI!F17 -> 2200 | I238: =MRI!G17 -> 12 | J238: =MRI!H17 -> NA | K238: =MRI!I17 -> NA | L238: =MRI!J17 -> Initialized from year 451 of pre-industrial spin-up | M238: =H238-F238+1 -> 350 | N238: =12*(H238-F238)+I238-G238+1 -> 4200
A239: =PCM!F$2 -> National Center for Atmospheric Research | B239: =PCM!F$3 -> USA | C239: =PCM!F$1 -> PCM | D239: =PCM!B23 -> PIcntrl | E239: =PCM!C23 -> Run 1 | F239: =PCM!D23 -> 100 | G239: =PCM!E23 -> 1 | H239: =PCM!F23 -> 449 | I239: =PCM!G23 -> 12 | J239: =PCM!H23 -> NA | K239: =PCM!I23 -> NA | L239: =PCM!J23 -> B05.02/B06.18/B06.38/B06.62 | M239: =H239-F239+1 -> 350 | N239: =12*(H239-F239)+I239-G239+1 -> 4200
A240: =HadCM3!F$2 -> Hadley Centre for Climate Prediction and Research, Met Office | B240: =HadCM3!F$3 -> UK | C240: =HadCM3!F$1 -> UKMO-HadCM3 | D240: =HadCM3!B11 -> PIcntrl | E240: =HadCM3!C11 -> Run 1 | F240: =HadCM3!D11 -> 1859 | G240: =HadCM3!E11 -> 1 | H240: =HadCM3!F11 -> 2199 | I240: =HadCM3!G11 -> 12 | J240: =HadCM3!H11 -> NA | K240: =HadCM3!I11 -> NA | L240: =HadCM3!J11 -> Initialised 360 years into the HadCM3 spinup experiment that started from Levitus T and S conditions at rest. | M240: =H240-F240+1 -> 341 | N240: =12*(H240-F240)+I240-G240+1 -> 4092
A241: =HadCM3!F$2 -> Hadley Centre for Climate Prediction and Research, Met Office | B241: =HadCM3!F$3 -> UK | C241: =HadCM3!F$1 -> UKMO-HadCM3 | D241: =HadCM3!B12 -> PIcntrl | E241: =HadCM3!C12 -> Run 2 | F241: =HadCM3!D12 -> 1859 | G241: =HadCM3!E12 -> 1 | H241: =HadCM3!F12 -> 1939 | I241: =HadCM3!G12 -> 12 | J241: =HadCM3!H12 -> NA | K241: =HadCM3!I12 -> NA | L241: =HadCM3!J12 -> Initialised 100 years into the HadCM3 spinup experiment that started from Levitus T and S conditions at rest. | M241: =H241-F241+1 -> 81 | N241: =12*(H241-F241)+I241-G241+1 -> 972
A242: =HadGEM1!F$2 -> Hadley Centre for Climate Prediction and Research , Met Office | B242: =HadGEM1!F$3 -> UK | C242: =HadGEM1!F$1 -> UKMO-HadGEM1 | D242: =HadGEM1!B13 -> PIcntrl | E242: =HadGEM1!C13 -> Run 1 | F242: =HadGEM1!D13 -> 1859 | G242: =HadGEM1!E13 -> 12 | H242: =HadGEM1!F13 -> 2199 | I242: =HadGEM1!G13 -> 12 | J242: =HadGEM1!H13 -> NA | K242: =HadGEM1!I13 -> NA | L242: =HadGEM1!J13 -> Initialised 85 years into the HadGEM1 spinup experiment that started from Levitus T and S conditions at rest. | M242: =H242-F242+1 -> 341 | N242: =12*(H242-F242)+I242-G242+1 -> 4081
A243: 0 | B243: 0 | C243: 0 | D243: Slabcntl | E243: 0 | F243: 0 | G243: 0 | H243: 0 | I243: 0 | J243: 0 | K243: 0 | L243: 0
A244: =CCSM3!F$2 -> National Center for Atmospheric Research | B244: =CCSM3!F$3 -> USA | C244: =CCSM3!F$1 -> CCSM3 | D244: =CCSM3!B30 -> Slabcntl | E244: =CCSM3!C30 -> Run 1 | F244: =CCSM3!D30 -> 0 | G244: =CCSM3!E30 -> 1 | H244: =CCSM3!F30 -> 50 | I244: =CCSM3!G30 -> 12 | J244: =CCSM3!H30 -> NA | K244: =CCSM3!I30 -> NA | L244: =CCSM3!J30 -> eul128x256_d50som | M244: =H244-F244+1 -> 51 | N244: =12*(H244-F244)+I244-G244+1 -> 612
A245: ='CGCM(T47)'!F$2 -> Canadian Centre for Climate Modeling & Analysis | B245: ='CGCM(T47)'!F$3 -> Canada | C245: ='CGCM(T47)'!F$1 -> CGCM3.1(T47) | D245: ='CGCM(T47)'!B20 -> Slabcntl | E245: ='CGCM(T47)'!C20 -> Run 1 | F245: ='CGCM(T47)'!D20 -> 1 | G245: ='CGCM(T47)'!E20 -> 1 | H245: ='CGCM(T47)'!F20 -> 30 | I245: ='CGCM(T47)'!G20 -> 12 | J245: ='CGCM(T47)'!H20 -> NA | K245: ='CGCM(T47)'!I20 -> NA | L245: ='CGCM(T47)'!J20 -> - | M245: =H245-F245+1 -> 30 | N245: =12*(H245-F245)+I245-G245+1 -> 360
A246: ='CGCM(T63)'!F$2 -> Canadian Centre for Climate Modeling & Analysis | B246: ='CGCM(T63)'!F$3 -> Canada | C246: ='CGCM(T63)'!F$1 -> CGCM3.1(T63) | D246: ='CGCM(T63)'!B11 -> Slabcntl | E246: ='CGCM(T63)'!C11 -> Run 1 | F246: ='CGCM(T63)'!D11 -> 1 | G246: ='CGCM(T63)'!E11 -> 1 | H246: ='CGCM(T63)'!F11 -> 30 | I246: ='CGCM(T63)'!G11 -> 12 | J246: ='CGCM(T63)'!H11 -> NA | K246: ='CGCM(T63)'!I11 -> NA | L246: ='CGCM(T63)'!J11 -> - | M246: =H246-F246+1 -> 30 | N246: =12*(H246-F246)+I246-G246+1 -> 360
A247: =CNRM!F$2 -> Météo-France / Centre National de Recherches Météorologiques | B247: =CNRM!F$3 -> France | C247: =CNRM!F$1 -> CNRM-CM3 | D247: =CNRM!B13 -> Slabcntl | E247: =CNRM!C13 -> Run 1 | F247: =CNRM!D13 -> 1990 | G247: =CNRM!E13 -> 1 | H247: =CNRM!F13 -> 2090 | I247: =CNRM!G13 -> 12 | J247: =CNRM!H13 -> NA | K247: =CNRM!I13 -> NA | L247: =CNRM!J13 -> - | M247: =H247-F247+1 -> 101 | N247: =12*(H247-F247)+I247-G247+1 -> 1212
A248: ='CSIRO-3.0'!F$2 -> CSIRO Atmospheric Research | B248: ='CSIRO-3.0'!F$3 -> Australia | C248: ='CSIRO-3.0'!F$1 -> CSIRO-Mk3.0 | D248: ='CSIRO-3.0'!B14 -> Slabcntl | E248: ='CSIRO-3.0'!C14 -> Run 1 | F248: ='CSIRO-3.0'!D14 -> 2001 | G248: ='CSIRO-3.0'!E14 -> 1 | H248: ='CSIRO-3.0'!F14 -> 2060 | I248: ='CSIRO-3.0'!G14 -> 12 | J248: ='CSIRO-3.0'!H14 -> NA | K248: ='CSIRO-3.0'!I14 -> NA | L248: ='CSIRO-3.0'!J14 -> Started from year 110 of a specified SST run. No separate qflux spinup period. | M248: =H248-F248+1 -> 60 | N248: =12*(H248-F248)+I248-G248+1 -> 720
A249: =ECHAM5!F$2 -> Max Planck Institute for Meteorology | B249: =ECHAM5!F$3 -> Germany | C249: =ECHAM5!F$1 -> ECHAM5/MPI-OM | D249: =ECHAM5!B21 -> Slabcntl | E249: =ECHAM5!C21 -> Run 1 | F249: =ECHAM5!D21 -> 2001 | G249: =ECHAM5!E21 -> 1 | H249: =ECHAM5!F21 -> 2100 | I249: =ECHAM5!G21 -> 12 | J249: =ECHAM5!H21 -> NA | K249: =ECHAM5!I21 -> NA | L249: =ECHAM5!J21 -> - | M249: =H249-F249+1 -> 100 | N249: =12*(H249-F249)+I249-G249+1 -> 1200
A250: ='GFDL-2.1'!F$2 -> US Dept. of Commerce / NOAA / Geophysical Fluid Dynamics Laboratory | B250: ='GFDL-2.1'!F$3 -> USA | C250: ='GFDL-2.1'!F$1 -> GFDL-CM2.1 | D250: ='GFDL-2.1'!B15 -> Slabcntl | E250: ='GFDL-2.1'!C15 -> Run 1 | F250: ='GFDL-2.1'!D15 -> 0 | G250: ='GFDL-2.1'!E15 -> 0 | H250: ='GFDL-2.1'!F15 -> 0 | I250: ='GFDL-2.1'!G15 -> 0 | J250: ='GFDL-2.1'!H15 -> NA | K250: ='GFDL-2.1'!I15 -> NA | L250: ='GFDL-2.1'!J15 -> pending | M250: =H250-F250+1 -> 1 | N250: =12*(H250-F250)+I250-G250+1 -> 1
A251: ='GISS-ER'!F$2 -> NASA / Goddard Institute for Space Studies | B251: ='GISS-ER'!F$3 -> USA | C251: ='GISS-ER'!F$1 -> GISS-ER | D251: ='GISS-ER'!B21 -> Slabcntl | E251: ='GISS-ER'!C21 -> Run 1 | F251: ='GISS-ER'!D21 -> 1901 | G251: ='GISS-ER'!E21 -> 1 | H251: ='GISS-ER'!F21 -> 2020 | I251: ='GISS-ER'!G21 -> 12 | J251: ='GISS-ER'!H21 -> NA | K251: ='GISS-ER'!I21 -> NA | L251: ='GISS-ER'!J21 -> - | M251: =H251-F251+1 -> 120 | N251: =12*(H251-F251)+I251-G251+1 -> 1440
A252: =INM!F$2 -> Institute for Numerical Mathematics | B252: =INM!F$3 -> Russia | C252: =INM!F$1 -> INM-CM3.0 | D252: =INM!B13 -> Slabcntl | E252: =INM!C13 -> Run 1 | F252: =INM!D13 -> 2000 | G252: =INM!E13 -> 1 | H252: =INM!F13 -> 2059 | I252: =INM!G13 -> 12 | J252: =INM!H13 -> NA | K252: =INM!I13 -> NA | L252: =INM!J13 -> - | M252: =H252-F252+1 -> 60 | N252: =12*(H252-F252)+I252-G252+1 -> 720
A253: ='MIROC(hires)'!F$2 -> Center for Climate System Research (The University of Tokyo), National Institute for Environmental Studies, and Frontier Research Center for Global Change (JAMSTEC) | B253: ='MIROC(hires)'!F$3 -> Japan | C253: ='MIROC(hires)'!F$1 -> MIROC3.2(hires) | D253: ='MIROC(hires)'!B11 -> Slabcntl | E253: ='MIROC(hires)'!C11 -> Run 1 | F253: ='MIROC(hires)'!D11 -> 1 | G253: ='MIROC(hires)'!E11 -> 1 | H253: ='MIROC(hires)'!F11 -> 20 | I253: ='MIROC(hires)'!G11 -> 12 | J253: ='MIROC(hires)'!H11 -> NA | K253: ='MIROC(hires)'!I11 -> NA | L253: ='MIROC(hires)'!J11 -> - | M253: =H253-F253+1 -> 20 | N253: =12*(H253-F253)+I253-G253+1 -> 240
A254: ='MIROC(medres)'!F$2 -> Center for Climate System Research (The University of Tokyo), National Institute for Environmental Studies, and Frontier Research Center for Global Change (JAMSTEC) | B254: ='MIROC(medres)'!F$3 -> Japan | C254: ='MIROC(medres)'!F$1 -> MIROC3.2(medres) | D254: ='MIROC(medres)'!B21 -> Slabcntl | E254: ='MIROC(medres)'!C21 -> Run 1 | F254: ='MIROC(medres)'!D21 -> 15 | G254: ='MIROC(medres)'!E21 -> 1 | H254: ='MIROC(medres)'!F21 -> 75 | I254: ='MIROC(medres)'!G21 -> 12 | J254: ='MIROC(medres)'!H21 -> NA | K254: ='MIROC(medres)'!I21 -> NA | L254: ='MIROC(medres)'!J21 -> - | M254: =H254-F254+1 -> 61 | N254: =12*(H254-F254)+I254-G254+1 -> 732
A255: =MRI!F$2 -> Meteorological Research Institute | B255: =MRI!F$3 -> Japan | C255: =MRI!F$1 -> MRI-CGCM2.3.2 | D255: =MRI!B18 -> Slabcntl | E255: =MRI!C18 -> Run 1 | F255: =MRI!D18 -> 1901 | G255: =MRI!E18 -> 1 | H255: =MRI!F18 -> 2050 | I255: =MRI!G18 -> 12 | J255: =MRI!H18 -> PDcntrl Run 1 | K255: =MRI!I18 -> 1801 | L255: =MRI!J18 -> Initialized from year 429 of present-day spin-up | M255: =H255-F255+1 -> 150 | N255: =12*(H255-F255)+I255-G255+1 -> 1800
A256: =PCM!F$2 -> National Center for Atmospheric Research | B256: =PCM!F$3 -> USA | C256: =PCM!F$1 -> PCM | D256: =PCM!B24 -> Slabcntl | E256: =PCM!C24 -> Run 1 | F256: =PCM!D24 -> 0 | G256: =PCM!E24 -> 1 | H256: =PCM!F24 -> 0 | I256: =PCM!G24 -> 12 | J256: =PCM!H24 -> NA | K256: =PCM!I24 -> NA | L256: =PCM!J24 -> 0 | M256: =H256-F256+1 -> 1 | N256: =12*(H256-F256)+I256-G256+1 -> 12
A257: =HadGEM1!F$2 -> Hadley Centre for Climate Prediction and Research , Met Office | B257: =HadGEM1!F$3 -> UK | C257: =HadGEM1!F$1 -> UKMO-HadGEM1 | D257: =HadGEM1!B14 -> Slabcntl | E257: =HadGEM1!C14 -> Run 1 | F257: =HadGEM1!D14 -> 2006 | G257: =HadGEM1!E14 -> 12 | H257: =HadGEM1!F14 -> 2076 | I257: =HadGEM1!G14 -> 12 | J257: =HadGEM1!H14 -> PIcntrl Run 1 | K257: =HadGEM1!I14 -> NA | L257: =HadGEM1!J14 -> - | M257: =H257-F257+1 -> 71 | N257: =12*(H257-F257)+I257-G257+1 -> 841
A258: 0 | B258: 0 | C258: 0 | D258: SRESA1B | E258: 0 | F258: 0 | G258: 0 | H258: 0 | I258: 0 | J258: 0 | K258: 0 | L258: 0
A259: =CCSM3!F$2 -> National Center for Atmospheric Research | B259: =CCSM3!F$3 -> USA | C259: =CCSM3!F$1 -> CCSM3 | D259: =CCSM3!B31 -> SRESA1B | E259: =CCSM3!C31 -> Run 1 | F259: =CCSM3!D31 -> 2000 | G259: =CCSM3!E31 -> 1 | H259: =CCSM3!F31 -> 2199 | I259: =CCSM3!G31 -> 12 | J259: =CCSM3!H31 -> 20C3M run 1 | K259: =CCSM3!I31 -> 2000 | L259: =CCSM3!J31 -> b30.040a (2000-2099) b30.044a (2100-2199) | M259: =H259-F259+1 -> 200 | N259: =12*(H259-F259)+I259-G259+1 -> 2400
A260: =CCSM3!F$2 -> National Center for Atmospheric Research | B260: =CCSM3!F$3 -> USA | C260: =CCSM3!F$1 -> CCSM3 | D260: =CCSM3!B32 -> SRESA1B | E260: =CCSM3!C32 -> Run 2 | F260: =CCSM3!D32 -> 2000 | G260: =CCSM3!E32 -> 1 | H260: =CCSM3!F32 -> 2199 | I260: =CCSM3!G32 -> 12 | J260: =CCSM3!H32 -> 20C3M run 2 | K260: =CCSM3!I32 -> 2000 | L260: =CCSM3!J32 -> b30.040b (2000-2099) b30.44b (2100-2199) | M260: =H260-F260+1 -> 200 | N260: =12*(H260-F260)+I260-G260+1 -> 2400
A261: =CCSM3!F$2 -> National Center for Atmospheric Research | B261: =CCSM3!F$3 -> USA | C261: =CCSM3!F$1 -> CCSM3 | D261: =CCSM3!B33 -> SRESA1B | E261: =CCSM3!C33 -> Run 3 | F261: =CCSM3!D33 -> 2000 | G261: =CCSM3!E33 -> 1 | H261: =CCSM3!F33 -> 2199 | I261: =CCSM3!G33 -> 12 | J261: =CCSM3!H33 -> 20C3M run 3 | K261: =CCSM3!I33 -> 2000 | L261: =CCSM3!J33 -> b30.040c (2000-2099) b30.044c (2100-2199) | M261: =H261-F261+1 -> 200 | N261: =12*(H261-F261)+I261-G261+1 -> 2400
A262: =CCSM3!F$2 -> National Center for Atmospheric Research | B262: =CCSM3!F$3 -> USA | C262: =CCSM3!F$1 -> CCSM3 | D262: =CCSM3!B34 -> SRESA1B | E262: =CCSM3!C34 -> Run 4 | F262: =CCSM3!D34 -> 2000 | G262: =CCSM3!E34 -> 1 | H262: =CCSM3!F34 -> 2199 | I262: =CCSM3!G34 -> 12 | J262: =CCSM3!H34 -> 20C3M run 4 | K262: =CCSM3!I34 -> 2000 | L262: =CCSM3!J34 -> b30.040d (2000-2099) b30.044d (2100-2199) | M262: =H262-F262+1 -> 200 | N262: =12*(H262-F262)+I262-G262+1 -> 2400
A263: =CCSM3!F$2 -> National Center for Atmospheric Research | B263: =CCSM3!F$3 -> USA | C263: =CCSM3!F$1 -> CCSM3 | D263: =CCSM3!B35 -> SRESA1B | E263: =CCSM3!C35 -> Run 5 | F263: =CCSM3!D35 -> 2000 | G263: =CCSM3!E35 -> 1 | H263: =CCSM3!F35 -> 2199 | I263: =CCSM3!G35 -> 12 | J263: =CCSM3!H35 -> 20C3M run 5 | K263: =CCSM3!I35 -> 2000 | L263: =CCSM3!J35 -> b30.040e (2000-2099) b30.044e (2100-2199) | M263: =H263-F263+1 -> 200 | N263: =12*(H263-F263)+I263-G263+1 -> 2400
A264: =CCSM3!F$2 -> National Center for Atmospheric Research | B264: =CCSM3!F$3 -> USA | C264: =CCSM3!F$1 -> CCSM3 | D264: =CCSM3!B36 -> SRESA1B | E264: =CCSM3!C36 -> Run 6 | F264: =CCSM3!D36 -> 2000 | G264: =CCSM3!E36 -> 1 | H264: =CCSM3!F36 -> 2449 | I264: =CCSM3!G36 -> 12 | J264: =CCSM3!H36 -> 20C3M run 6 | K264: =CCSM3!I36 -> 2000 | L264: =CCSM3!J36 -> b30.040b.ES01 (2000-2099) b30.044b.ES01 (2100-2449) | M264: =H264-F264+1 -> 450 | N264: =12*(H264-F264)+I264-G264+1 -> 5400
A265: =CCSM3!F$2 -> National Center for Atmospheric Research | B265: =CCSM3!F$3 -> USA | C265: =CCSM3!F$1 -> CCSM3 | D265: =CCSM3!B37 -> SRESA1B | E265: =CCSM3!C37 -> Run 7 | F265: =CCSM3!D37 -> 2000 | G265: =CCSM3!E37 -> 1 | H265: =CCSM3!F37 -> 2349 | I265: =CCSM3!G37 -> 12 | J265: =CCSM3!H37 -> 20C3M run 7 | K265: =CCSM3!I37 -> 2000 | L265: =CCSM3!J37 -> b30.040f.ES01 (2000-2099) b30.044f.ES01 (2100-2349) | M265: =H265-F265+1 -> 350 | N265: =12*(H265-F265)+I265-G265+1 -> 4200
A266: =CCSM3!F$2 -> National Center for Atmospheric Research | B266: =CCSM3!F$3 -> USA | C266: =CCSM3!F$1 -> CCSM3 | D266: =CCSM3!B38 -> SRESA1B | E266: =CCSM3!C38 -> Run 8 | F266: =CCSM3!D38 -> 2000 | G266: =CCSM3!E38 -> 1 | H266: =CCSM3!F38 -> 2349 | I266: =CCSM3!G38 -> 12 | J266: =CCSM3!H38 -> 20C3M run 8 | K266: =CCSM3!I38 -> 2000 | L266: =CCSM3!J38 -> b30.040g.ES01 (2000-2099) b30.044g.ES01 (2100-2349) | M266: =H266-F266+1 -> 350 | N266: =12*(H266-F266)+I266-G266+1 -> 4200
A267: ='CGCM(T47)'!F$2 -> Canadian Centre for Climate Modeling & Analysis | B267: ='CGCM(T47)'!F$3 -> Canada | C267: ='CGCM(T47)'!F$1 -> CGCM3.1(T47) | D267: ='CGCM(T47)'!B21 -> SRESA1B | E267: ='CGCM(T47)'!C21 -> Run 1 | F267: ='CGCM(T47)'!D21 -> 2001 | G267: ='CGCM(T47)'!E21 -> 1 | H267: ='CGCM(T47)'!F21 -> 2300 | I267: ='CGCM(T47)'!G21 -> 12 | J267: ='CGCM(T47)'!H21 -> 20C3M Run 1 | K267: ='CGCM(T47)'!I21 -> 2001 | L267: ='CGCM(T47)'!J21 -> - | M267: =H267-F267+1 -> 300 | N267: =12*(H267-F267)+I267-G267+1 -> 3600
A268: ='CGCM(T47)'!F$2 -> Canadian Centre for Climate Modeling & Analysis | B268: ='CGCM(T47)'!F$3 -> Canada | C268: ='CGCM(T47)'!F$1 -> CGCM3.1(T47) | D268: ='CGCM(T47)'!B22 -> SRESA1B | E268: ='CGCM(T47)'!C22 -> Run 2 | F268: ='CGCM(T47)'!D22 -> 2001 | G268: ='CGCM(T47)'!E22 -> 1 | H268: ='CGCM(T47)'!F22 -> 2200 | I268: ='CGCM(T47)'!G22 -> 12 | J268: ='CGCM(T47)'!H22 -> 20C3M Run 2 | K268: ='CGCM(T47)'!I22 -> 2001 | L268: ='CGCM(T47)'!J22 -> - | M268: =H268-F268+1 -> 200 | N268: =12*(H268-F268)+I268-G268+1 -> 2400
A269: ='CGCM(T47)'!F$2 -> Canadian Centre for Climate Modeling & Analysis | B269: ='CGCM(T47)'!F$3 -> Canada | C269: ='CGCM(T47)'!F$1 -> CGCM3.1(T47) | D269: ='CGCM(T47)'!B23 -> SRESA1B | E269: ='CGCM(T47)'!C23 -> Run 3 | F269: ='CGCM(T47)'!D23 -> 2001 | G269: ='CGCM(T47)'!E23 -> 1 | H269: ='CGCM(T47)'!F23 -> 2200 | I269: ='CGCM(T47)'!G23 -> 12 | J269: ='CGCM(T47)'!H23 -> 20C3M Run 3 | K269: ='CGCM(T47)'!I23 -> 2001 | L269: ='CGCM(T47)'!J23 -> - | M269: =H269-F269+1 -> 200 | N269: =12*(H269-F269)+I269-G269+1 -> 2400
A270: ='CGCM(T47)'!F$2 -> Canadian Centre for Climate Modeling & Analysis | B270: ='CGCM(T47)'!F$3 -> Canada | C270: ='CGCM(T47)'!F$1 -> CGCM3.1(T47) | D270: ='CGCM(T47)'!B24 -> SRESA1B | E270: ='CGCM(T47)'!C24 -> Run 4 | F270: ='CGCM(T47)'!D24 -> 2001 | G270: ='CGCM(T47)'!E24 -> 1 | H270: ='CGCM(T47)'!F24 -> 2200 | I270: ='CGCM(T47)'!G24 -> 12 | J270: ='CGCM(T47)'!H24 -> 20C3M Run 4 | K270: ='CGCM(T47)'!I24 -> 2001 | L270: ='CGCM(T47)'!J24 -> - | M270: =H270-F270+1 -> 200 | N270: =12*(H270-F270)+I270-G270+1 -> 2400
A271: ='CGCM(T47)'!F$2 -> Canadian Centre for Climate Modeling & Analysis | B271: ='CGCM(T47)'!F$3 -> Canada | C271: ='CGCM(T47)'!F$1 -> CGCM3.1(T47) | D271: ='CGCM(T47)'!B25 -> SRESA1B | E271: ='CGCM(T47)'!C25 -> Run 5 | F271: ='CGCM(T47)'!D25 -> 2001 | G271: ='CGCM(T47)'!E25 -> 1 | H271: ='CGCM(T47)'!F25 -> 2200 | I271: ='CGCM(T47)'!G25 -> 12 | J271: ='CGCM(T47)'!H25 -> 20C3M Run 5 | K271: ='CGCM(T47)'!I25 -> 2001 | L271: ='CGCM(T47)'!J25 -> - | M271: =H271-F271+1 -> 200 | N271: =12*(H271-F271)+I271-G271+1 -> 2400
A272: ='CGCM(T63)'!F$2 -> Canadian Centre for Climate Modeling & Analysis | B272: ='CGCM(T63)'!F$3 -> Canada | C272: ='CGCM(T63)'!F$1 -> CGCM3.1(T63) | D272: ='CGCM(T63)'!B12 -> SRESA1B | E272: ='CGCM(T63)'!C12 -> Run 1 | F272: ='CGCM(T63)'!D12 -> 2001 | G272: ='CGCM(T63)'!E12 -> 1 | H272: ='CGCM(T63)'!F12 -> 2300 | I272: ='CGCM(T63)'!G12 -> 12 | J272: ='CGCM(T63)'!H12 -> 20C3M Run 1 | K272: ='CGCM(T63)'!I12 -> 2001 | L272: ='CGCM(T63)'!J12 -> - | M272: =H272-F272+1 -> 300 | N272: =12*(H272-F272)+I272-G272+1 -> 3600
A273: =CNRM!F$2 -> Météo-France / Centre National de Recherches Météorologiques | B273: =CNRM!F$3 -> France | C273: =CNRM!F$1 -> CNRM-CM3 | D273: =CNRM!B14 -> SRESA1B | E273: =CNRM!C14 -> Run 1 | F273: =CNRM!D14 -> 2000 | G273: =CNRM!E14 -> 1 | H273: =CNRM!F14 -> 2300 | I273: =CNRM!G14 -> 12 | J273: =CNRM!H14 -> 20C3M Run 1 | K273: =CNRM!I14 -> 2000 | L273: =CNRM!J14 -> - | M273: =H273-F273+1 -> 301 | N273: =12*(H273-F273)+I273-G273+1 -> 3612
A274: ='CSIRO-3.0'!F$2 -> CSIRO Atmospheric Research | B274: ='CSIRO-3.0'!F$3 -> Australia | C274: ='CSIRO-3.0'!F$1 -> CSIRO-Mk3.0 | D274: ='CSIRO-3.0'!B15 -> SRESA1B | E274: ='CSIRO-3.0'!C15 -> Run 1 | F274: ='CSIRO-3.0'!D15 -> 2001 | G274: ='CSIRO-3.0'!E15 -> 1 | H274: ='CSIRO-3.0'!F15 -> 2200 | I274: ='CSIRO-3.0'!G15 -> 12 | J274: ='CSIRO-3.0'!H15 -> 20C3M Run 1 | K274: ='CSIRO-3.0'!I15 -> 2001 | L274: ='CSIRO-3.0'!J15 -> - | M274: =H274-F274+1 -> 200 | N274: =12*(H274-F274)+I274-G274+1 -> 2400
A275: ='CSIRO-3.5'!F$2 -> CSIRO Atmospheric Research | B275: ='CSIRO-3.5'!F$3 -> Australia | C275: ='CSIRO-3.5'!F$1 -> CSIRO-Mk3.5 | D275: ='CSIRO-3.5'!B12 -> SRESA1B | E275: ='CSIRO-3.5'!C12 -> Run1 | F275: ='CSIRO-3.5'!D12 -> 2001 | G275: ='CSIRO-3.5'!E12 -> 1 | H275: ='CSIRO-3.5'!F12 -> 2300 | I275: ='CSIRO-3.5'!G12 -> 12 | J275: ='CSIRO-3.5'!H12 -> 20C3M Run 1 | K275: ='CSIRO-3.5'!I12 -> 2001 | L275: ='CSIRO-3.5'!J12 -> initialised from end of model year 300 (beginning of 2001 of 20C3M Run1). | M275: =H275-F275+1 -> 300 | N275: =12*(H275-F275)+I275-G275+1 -> 3600
A276: =ECHAM5!F$2 -> Max Planck Institute for Meteorology | B276: =ECHAM5!F$3 -> Germany | C276: =ECHAM5!F$1 -> ECHAM5/MPI-OM | D276: =ECHAM5!B22 -> SRESA1B | E276: =ECHAM5!C22 -> Run 1 | F276: =ECHAM5!D22 -> 2001 | G276: =ECHAM5!E22 -> 1 | H276: =ECHAM5!F22 -> 2200 | I276: =ECHAM5!G22 -> 12 | J276: =ECHAM5!H22 -> 20C3M | K276: =ECHAM5!I22 -> 2001 | L276: =ECHAM5!J22 -> - | M276: =H276-F276+1 -> 200 | N276: =12*(H276-F276)+I276-G276+1 -> 2400
A277: =ECHAM5!F$2 -> Max Planck Institute for Meteorology | B277: =ECHAM5!F$3 -> Germany | C277: =ECHAM5!F$1 -> ECHAM5/MPI-OM | D277: =ECHAM5!B23 -> SRESA1B | E277: =ECHAM5!C23 -> Run 2 | F277: =ECHAM5!D23 -> 2001 | G277: =ECHAM5!E23 -> 1 | H277: =ECHAM5!F23 -> 2300 | I277: =ECHAM5!G23 -> 12 | J277: =ECHAM5!H23 -> 20C3M | K277: =ECHAM5!I23 -> 2001 | L277: =ECHAM5!J23 -> - | M277: =H277-F277+1 -> 300 | N277: =12*(H277-F277)+I277-G277+1 -> 3600
A278: =ECHAM5!F$2 -> Max Planck Institute for Meteorology | B278: =ECHAM5!F$3 -> Germany | C278: =ECHAM5!F$1 -> ECHAM5/MPI-OM | D278: =ECHAM5!B24 -> SRESA1B | E278: =ECHAM5!C24 -> Run 3 | F278: =ECHAM5!D24 -> 2001 | G278: =ECHAM5!E24 -> 1 | H278: =ECHAM5!F24 -> 2200 | I278: =ECHAM5!G24 -> 12 | J278: =ECHAM5!H24 -> 20C3M | K278: =ECHAM5!I24 -> 2001 | L278: =ECHAM5!J24 -> - | M278: =H278-F278+1 -> 200 | N278: =12*(H278-F278)+I278-G278+1 -> 2400
A279: ='ECHO-G'!F$2 -> Meteorological Institute of the University of Bonn (MIUB), Meteorological Research Institute of KMA (METRI), and Model and Data group (M&D) | B279: ='ECHO-G'!F$3 -> Germany & Korea | C279: ='ECHO-G'!F$1 -> ECHO-G | D279: ='ECHO-G'!B19 -> SRESA1B | E279: ='ECHO-G'!C19 -> Run 1 | F279: ='ECHO-G'!D19 -> 2001 | G279: ='ECHO-G'!E19 -> 1 | H279: ='ECHO-G'!F19 -> 2300 | I279: ='ECHO-G'!G19 -> 12 | J279: ='ECHO-G'!H19 -> 20C3M Run 1 | K279: ='ECHO-G'!I19 -> 2001 | L279: ='ECHO-G'!J19 -> - | M279: =H279-F279+1 -> 300 | N279: =12*(H279-F279)+I279-G279+1 -> 3600
A280: ='ECHO-G'!F$2 -> Meteorological Institute of the University of Bonn (MIUB), Meteorological Research Institute of KMA (METRI), and Model and Data group (M&D) | B280: ='ECHO-G'!F$3 -> Germany & Korea | C280: ='ECHO-G'!F$1 -> ECHO-G | D280: ='ECHO-G'!B20 -> SRESA1B | E280: ='ECHO-G'!C20 -> Run 2 | F280: ='ECHO-G'!D20 -> 2001 | G280: ='ECHO-G'!E20 -> 1 | H280: ='ECHO-G'!F20 -> 2200 | I280: ='ECHO-G'!G20 -> 12 | J280: ='ECHO-G'!H20 -> 20C3M Run 2 | K280: ='ECHO-G'!I20 -> 2001 | L280: ='ECHO-G'!J20 -> - | M280: =H280-F280+1 -> 200 | N280: =12*(H280-F280)+I280-G280+1 -> 2400
A281: ='ECHO-G'!F$2 -> Meteorological Institute of the University of Bonn (MIUB), Meteorological Research Institute of KMA (METRI), and Model and Data group (M&D) | B281: ='ECHO-G'!F$3 -> Germany & Korea | C281: ='ECHO-G'!F$1 -> ECHO-G | D281: ='ECHO-G'!B21 -> SRESA1B | E281: ='ECHO-G'!C21 -> Run 3 | F281: ='ECHO-G'!D21 -> 2001 | G281: ='ECHO-G'!E21 -> 1 | H281: ='ECHO-G'!F21 -> 2200 | I281: ='ECHO-G'!G21 -> 12 | J281: ='ECHO-G'!H21 -> 20C3M Run 3 | K281: ='ECHO-G'!I21 -> 2001 | L281: ='ECHO-G'!J21 -> - | M281: =H281-F281+1 -> 200 | N281: =12*(H281-F281)+I281-G281+1 -> 2400
A282: =FGOALS!F$2 -> LASG / Institute of Atmospheric Physics | B282: =FGOALS!F$3 -> China | C282: =FGOALS!F$1 -> FGOALS-g1.0 | D282: =FGOALS!B16 -> SRESA1B | E282: =FGOALS!C16 -> Run 1 | F282: =FGOALS!D16 -> 2000 | G282: =FGOALS!E16 -> 1 | H282: =FGOALS!F16 -> 2200 | I282: =FGOALS!G16 -> 12 | J282: =FGOALS!H16 -> 20C3M Run 1 | K282: =FGOALS!I16 -> 2000 | L282: =FGOALS!J16 -> - | M282: =H282-F282+1 -> 201 | N282: =12*(H282-F282)+I282-G282+1 -> 2412
A283: =FGOALS!F$2 -> LASG / Institute of Atmospheric Physics | B283: =FGOALS!F$3 -> China | C283: =FGOALS!F$1 -> FGOALS-g1.0 | D283: =FGOALS!B17 -> SRESA1B | E283: =FGOALS!C17 -> Run 2 | F283: =FGOALS!D17 -> 2000 | G283: =FGOALS!E17 -> 1 | H283: =FGOALS!F17 -> 2200 | I283: =FGOALS!G17 -> 12 | J283: =FGOALS!H17 -> 20C3M Run 2 | K283: =FGOALS!I17 -> 2000 | L283: =FGOALS!J17 -> - | M283: =H283-F283+1 -> 201 | N283: =12*(H283-F283)+I283-G283+1 -> 2412
A284: =FGOALS!F$2 -> LASG / Institute of Atmospheric Physics | B284: =FGOALS!F$3 -> China | C284: =FGOALS!F$1 -> FGOALS-g1.0 | D284: =FGOALS!B18 -> SRESA1B | E284: =FGOALS!C18 -> Run 3 | F284: =FGOALS!D18 -> 2000 | G284: =FGOALS!E18 -> 1 | H284: =FGOALS!F18 -> 2200 | I284: =FGOALS!G18 -> 12 | J284: =FGOALS!H18 -> 20C3M Run 3 | K284: =FGOALS!I18 -> 2000 | L284: =FGOALS!J18 -> - | M284: =H284-F284+1 -> 201 | N284: =12*(H284-F284)+I284-G284+1 -> 2412
A285: ='GFDL-2.0'!F$2 -> US Dept. of Commerce / NOAA / Geophysical Fluid Dynamics Laboratory | B285: ='GFDL-2.0'!F$3 -> USA | C285: ='GFDL-2.0'!F$1 -> GFDL-CM2.0 | D285: ='GFDL-2.0'!B13 -> SRESA1B | E285: ='GFDL-2.0'!C13 -> Run 1 | F285: ='GFDL-2.0'!D13 -> 2001 | G285: ='GFDL-2.0'!E13 -> 1 | H285: ='GFDL-2.0'!F13 -> 2300 | I285: ='GFDL-2.0'!G13 -> 12 | J285: ='GFDL-2.0'!H13 -> 20C3M Run 1 | K285: ='GFDL-2.0'!I13 -> 2001 | L285: ='GFDL-2.0'!J13 -> - | M285: =H285-F285+1 -> 300 | N285: =12*(H285-F285)+I285-G285+1 -> 3600
A286: ='GFDL-2.1'!F$2 -> US Dept. of Commerce / NOAA / Geophysical Fluid Dynamics Laboratory | B286: ='GFDL-2.1'!F$3 -> USA | C286: ='GFDL-2.1'!F$1 -> GFDL-CM2.1 | D286: ='GFDL-2.1'!B16 -> SRESA1B | E286: ='GFDL-2.1'!C16 -> Run 1 | F286: ='GFDL-2.1'!D16 -> 2001 | G286: ='GFDL-2.1'!E16 -> 1 | H286: ='GFDL-2.1'!F16 -> 2300 | I286: ='GFDL-2.1'!G16 -> 12 | J286: ='GFDL-2.1'!H16 -> 20C3M Run 2 | K286: ='GFDL-2.1'!I16 -> 2001 | L286: ='GFDL-2.1'!J16 -> - | M286: =H286-F286+1 -> 300 | N286: =12*(H286-F286)+I286-G286+1 -> 3600
A287: ='GISS-AOM'!F$2 -> NASA / Goddard Institute for Space Studies | B287: ='GISS-AOM'!F$3 -> USA | C287: ='GISS-AOM'!F$1 -> GISS-AOM | D287: ='GISS-AOM'!B10 -> SRESA1B | E287: ='GISS-AOM'!C10 -> Run 1 | F287: ='GISS-AOM'!D10 -> 2001 | G287: ='GISS-AOM'!E10 -> 1 | H287: ='GISS-AOM'!F10 -> 2100 | I287: ='GISS-AOM'!G10 -> 12 | J287: ='GISS-AOM'!H10 -> 20C3M Run 1 | K287: ='GISS-AOM'!I10 -> 2001 | L287: ='GISS-AOM'!J10 -> C085 | M287: =H287-F287+1 -> 100 | N287: =12*(H287-F287)+I287-G287+1 -> 1200
A288: ='GISS-AOM'!F$2 -> NASA / Goddard Institute for Space Studies | B288: ='GISS-AOM'!F$3 -> USA | C288: ='GISS-AOM'!F$1 -> GISS-AOM | D288: ='GISS-AOM'!B11 -> SRESA1B | E288: ='GISS-AOM'!C11 -> Run 2 | F288: ='GISS-AOM'!D11 -> 2001 | G288: ='GISS-AOM'!E11 -> 1 | H288: ='GISS-AOM'!F11 -> 2100 | I288: ='GISS-AOM'!G11 -> 12 | J288: ='GISS-AOM'!H11 -> 20C3M Run 2 | K288: ='GISS-AOM'!I11 -> 2001 | L288: ='GISS-AOM'!J11 -> C095 | M288: =H288-F288+1 -> 100 | N288: =12*(H288-F288)+I288-G288+1 -> 1200
A289: ='GISS-EH'!F$2 -> NASA / Goddard Institute for Space Studies | B289: ='GISS-EH'!F$3 -> USA | C289: ='GISS-EH'!F$1 -> GISS-EH | D289: ='GISS-EH'!B13 -> SRESA1B | E289: ='GISS-EH'!C13 -> Run 1 | F289: ='GISS-EH'!D13 -> 2000 | G289: ='GISS-EH'!E13 -> 1 | H289: ='GISS-EH'!F13 -> 2099 | I289: ='GISS-EH'!G13 -> 12 | J289: ='GISS-EH'!H13 -> 20C3M Run 1 | K289: ='GISS-EH'!I13 -> 2003 | L289: ='GISS-EH'!J13 -> Note that the first 3 years of this run are in fact a continuation of the 20C3M simulation; the scenario forcing actually begins in 2003. | M289: =H289-F289+1 -> 100 | N289: =12*(H289-F289)+I289-G289+1 -> 1200
A290: ='GISS-EH'!F$2 -> NASA / Goddard Institute for Space Studies | B290: ='GISS-EH'!F$3 -> USA | C290: ='GISS-EH'!F$1 -> GISS-EH | D290: ='GISS-EH'!B14 -> SRESA1B | E290: ='GISS-EH'!C14 -> Run 2 | F290: ='GISS-EH'!D14 -> 2000 | G290: ='GISS-EH'!E14 -> 1 | H290: ='GISS-EH'!F14 -> 2099 | I290: ='GISS-EH'!G14 -> 12 | J290: ='GISS-EH'!H14 -> 20C3M Run 2 | K290: ='GISS-EH'!I14 -> 2003 | L290: ='GISS-EH'!J14 -> Note that the first 3 years of this run are in fact a continuation of the 20C3M simulation; the scenario forcing actually begins in 2003. | M290: =H290-F290+1 -> 100 | N290: =12*(H290-F290)+I290-G290+1 -> 1200
A291: ='GISS-EH'!F$2 -> NASA / Goddard Institute for Space Studies | B291: ='GISS-EH'!F$3 -> USA | C291: ='GISS-EH'!F$1 -> GISS-EH | D291: ='GISS-EH'!B15 -> SRESA1B | E291: ='GISS-EH'!C15 -> Run 3 | F291: ='GISS-EH'!D15 -> 2000 | G291: ='GISS-EH'!E15 -> 1 | H291: ='GISS-EH'!F15 -> 2099 | I291: ='GISS-EH'!G15 -> 12 | J291: ='GISS-EH'!H15 -> 20C3M Run 3 | K291: ='GISS-EH'!I15 -> 2003 | L291: ='GISS-EH'!J15 -> Note that the first 3 years of this run are in fact a continuation of the 20C3M simulation; the scenario forcing actually begins in 2003. | M291: =H291-F291+1 -> 100 | N291: =12*(H291-F291)+I291-G291+1 -> 1200
A292: ='GISS-ER'!F$2 -> NASA / Goddard Institute for Space Studies | B292: ='GISS-ER'!F$3 -> USA | C292: ='GISS-ER'!F$1 -> GISS-ER | D292: ='GISS-ER'!B22 -> SRESA1B | E292: ='GISS-ER'!C22 -> Run 1 | F292: ='GISS-ER'!D22 -> 2004 | G292: ='GISS-ER'!E22 -> 1 | H292: ='GISS-ER'!F22 -> 2300 | I292: ='GISS-ER'!G22 -> 12 | J292: ='GISS-ER'!H22 -> 20C3M Run 3 | K292: ='GISS-ER'!I22 -> 2004 | L292: ='GISS-ER'!J22 -> - | M292: =H292-F292+1 -> 297 | N292: =12*(H292-F292)+I292-G292+1 -> 3564
A293: ='GISS-ER'!F$2 -> NASA / Goddard Institute for Space Studies | B293: ='GISS-ER'!F$3 -> USA | C293: ='GISS-ER'!F$1 -> GISS-ER | D293: ='GISS-ER'!B23 -> SRESA1B | E293: ='GISS-ER'!C23 -> Run 2 | F293: ='GISS-ER'!D23 -> 2004 | G293: ='GISS-ER'!E23 -> 1 | H293: ='GISS-ER'!F23 -> 2200 | I293: ='GISS-ER'!G23 -> 12 | J293: ='GISS-ER'!H23 -> 20C3M Run 6 | K293: ='GISS-ER'!I23 -> 200 | L293: ='GISS-ER'!J23 -> - | M293: =H293-F293+1 -> 197 | N293: =12*(H293-F293)+I293-G293+1 -> 2364
A294: ='GISS-ER'!F$2 -> NASA / Goddard Institute for Space Studies | B294: ='GISS-ER'!F$3 -> USA | C294: ='GISS-ER'!F$1 -> GISS-ER | D294: ='GISS-ER'!B24 -> SRESA1B | E294: ='GISS-ER'!C24 -> Run 3 | F294: ='GISS-ER'!D24 -> 2004 | G294: ='GISS-ER'!E24 -> 1 | H294: ='GISS-ER'!F24 -> 2200 | I294: ='GISS-ER'!G24 -> 12 | J294: ='GISS-ER'!H24 -> 20C3M Run 7 | K294: ='GISS-ER'!I24 -> 2004 | L294: ='GISS-ER'!J24 -> - | M294: =H294-F294+1 -> 197 | N294: =12*(H294-F294)+I294-G294+1 -> 2364
A295: ='GISS-ER'!F$2 -> NASA / Goddard Institute for Space Studies | B295: ='GISS-ER'!F$3 -> USA | C295: ='GISS-ER'!F$1 -> GISS-ER | D295: ='GISS-ER'!B25 -> SRESA1B | E295: ='GISS-ER'!C25 -> Run 4 | F295: ='GISS-ER'!D25 -> 2004 | G295: ='GISS-ER'!E25 -> 1 | H295: ='GISS-ER'!F25 -> 2200 | I295: ='GISS-ER'!G25 -> 12 | J295: ='GISS-ER'!H25 -> 20C3M Run 8 | K295: ='GISS-ER'!I25 -> 2004 | L295: ='GISS-ER'!J25 -> - | M295: =H295-F295+1 -> 197 | N295: =12*(H295-F295)+I295-G295+1 -> 2364
A296: ='GISS-ER'!F$2 -> NASA / Goddard Institute for Space Studies | B296: ='GISS-ER'!F$3 -> USA | C296: ='GISS-ER'!F$1 -> GISS-ER | D296: ='GISS-ER'!B26 -> SRESA1B | E296: ='GISS-ER'!C26 -> Run 5 | F296: ='GISS-ER'!D26 -> 2004 | G296: ='GISS-ER'!E26 -> 1 | H296: ='GISS-ER'!F26 -> 2200 | I296: ='GISS-ER'!G26 -> 12 | J296: ='GISS-ER'!H26 -> 20C3M Run 9 | K296: ='GISS-ER'!I26 -> 2004 | L296: ='GISS-ER'!J26 -> - | M296: =H296-F296+1 -> 197 | N296: =12*(H296-F296)+I296-G296+1 -> 2364
A297: =INM!F$2 -> Institute for Numerical Mathematics | B297: =INM!F$3 -> Russia | C297: =INM!F$1 -> INM-CM3.0 | D297: =INM!B14 -> SRESA1B | E297: =INM!C14 -> Run 1 | F297: =INM!D14 -> 2001 | G297: =INM!E14 -> 1 | H297: =INM!F14 -> 2200 | I297: =INM!G14 -> 12 | J297: =INM!H14 -> 20C3M | K297: =INM!I14 -> 2001 | L297: =INM!J14 -> - | M297: =H297-F297+1 -> 200 | N297: =12*(H297-F297)+I297-G297+1 -> 2400
A298: =IPSL!F$2 -> Institut Pierre Simon Laplace | B298: =IPSL!F$3 -> France | C298: =IPSL!F$1 -> IPSL-CM4 | D298: =IPSL!B12 -> SRESA1B | E298: =IPSL!C12 -> Run 1 | F298: =IPSL!D12 -> 2000 | G298: =IPSL!E12 -> 1 | H298: =IPSL!F12 -> 2230 | I298: =IPSL!G12 -> 12 | J298: =IPSL!H12 -> 20C3M Run 0 | K298: =IPSL!I12 -> 2000 | L298: =IPSL!J12 -> Run 0 (not sent to PCMDI) is exactly the same as RUN 1 until year 1970, then it differs because of a bug reading the file of sulfate from year 1970 to 1975. We verify that the climate of year 2000 of RUN 0 is very close to climate of year 2000 of run 1. | M298: =H298-F298+1 -> 231 | N298: =12*(H298-F298)+I298-G298+1 -> 2772
A299: ='MIROC(hires)'!F$2 -> Center for Climate System Research (The University of Tokyo), National Institute for Environmental Studies, and Frontier Research Center for Global Change (JAMSTEC) | B299: ='MIROC(hires)'!F$3 -> Japan | C299: ='MIROC(hires)'!F$1 -> MIROC3.2(hires) | D299: ='MIROC(hires)'!B12 -> SRESA1B | E299: ='MIROC(hires)'!C12 -> Run 1 | F299: ='MIROC(hires)'!D12 -> 2001 | G299: ='MIROC(hires)'!E12 -> 1 | H299: ='MIROC(hires)'!F12 -> 2100 | I299: ='MIROC(hires)'!G12 -> 12 | J299: ='MIROC(hires)'!H12 -> 20C3M Run 1 | K299: ='MIROC(hires)'!I12 -> 2001 | L299: ='MIROC(hires)'!J12 -> The initial condition is the end of the 20C3M run. | M299: =H299-F299+1 -> 100 | N299: =12*(H299-F299)+I299-G299+1 -> 1200
A300: ='MIROC(medres)'!F$2 -> Center for Climate System Research (The University of Tokyo), National Institute for Environmental Studies, and Frontier Research Center for Global Change (JAMSTEC) | B300: ='MIROC(medres)'!F$3 -> Japan | C300: ='MIROC(medres)'!F$1 -> MIROC3.2(medres) | D300: ='MIROC(medres)'!B22 -> SRESA1B | E300: ='MIROC(medres)'!C22 -> Run 1 | F300: ='MIROC(medres)'!D22 -> 2001 | G300: ='MIROC(medres)'!E22 -> 1 | H300: ='MIROC(medres)'!F22 -> 2300 | I300: ='MIROC(medres)'!G22 -> 12 | J300: ='MIROC(medres)'!H22 -> 20C3M Run 1 | K300: ='MIROC(medres)'!I22 -> 2001 | L300: ='MIROC(medres)'!J22 -> The initial condition is the end of the corresponding 20C3M run. | M300: =H300-F300+1 -> 300 | N300: =12*(H300-F300)+I300-G300+1 -> 3600
A301: ='MIROC(medres)'!F$2 -> Center for Climate System Research (The University of Tokyo), National Institute for Environmental Studies, and Frontier Research Center for Global Change (JAMSTEC) | B301: ='MIROC(medres)'!F$3 -> Japan | C301: ='MIROC(medres)'!F$1 -> MIROC3.2(medres) | D301: ='MIROC(medres)'!B23 -> SRESA1B | E301: ='MIROC(medres)'!C23 -> Run 2 | F301: ='MIROC(medres)'!D23 -> 2001 | G301: ='MIROC(medres)'!E23 -> 1 | H301: ='MIROC(medres)'!F23 -> 2100 | I301: ='MIROC(medres)'!G23 -> 12 | J301: ='MIROC(medres)'!H23 -> 20C3M Run 2 | K301: ='MIROC(medres)'!I23 -> 2001 | L301: ='MIROC(medres)'!J23 -> The initial condition is the end of the corresponding 20C3M run. | M301: =H301-F301+1 -> 100 | N301: =12*(H301-F301)+I301-G301+1 -> 1200
A302: ='MIROC(medres)'!F$2 -> Center for Climate System Research (The University of Tokyo), National Institute for Environmental Studies, and Frontier Research Center for Global Change (JAMSTEC) | B302: ='MIROC(medres)'!F$3 -> Japan | C302: ='MIROC(medres)'!F$1 -> MIROC3.2(medres) | D302: ='MIROC(medres)'!B24 -> SRESA1B | E302: ='MIROC(medres)'!C24 -> Run 3 | F302: ='MIROC(medres)'!D24 -> 2001 | G302: ='MIROC(medres)'!E24 -> 1 | H302: ='MIROC(medres)'!F24 -> 2100 | I302: ='MIROC(medres)'!G24 -> 12 | J302: ='MIROC(medres)'!H24 -> 20C3M Run 3 | K302: ='MIROC(medres)'!I24 -> 2001 | L302: ='MIROC(medres)'!J24 -> The initial condition is the end of the corresponding 20C3M run. | M302: =H302-F302+1 -> 100 | N302: =12*(H302-F302)+I302-G302+1 -> 1200
A303: =MRI!F$2 -> Meteorological Research Institute | B303: =MRI!F$3 -> Japan | C303: =MRI!F$1 -> MRI-CGCM2.3.2 | D303: =MRI!B19 -> SRESA1B | E303: =MRI!C19 -> Run 1 | F303: =MRI!D19 -> 1990 | G303: =MRI!E19 -> 1 | H303: =MRI!F19 -> 2300 | I303: =MRI!G19 -> 12 | J303: =MRI!H19 -> 20C3M Run 1 | K303: =MRI!I19 -> 1990 | L303: =MRI!J19 -> - | M303: =H303-F303+1 -> 311 | N303: =12*(H303-F303)+I303-G303+1 -> 3732
A304: =MRI!F$2 -> Meteorological Research Institute | B304: =MRI!F$3 -> Japan | C304: =MRI!F$1 -> MRI-CGCM2.3.2 | D304: =MRI!B20 -> SRESA1B | E304: =MRI!C20 -> Run 2 | F304: =MRI!D20 -> 1990 | G304: =MRI!E20 -> 1 | H304: =MRI!F20 -> 2100 | I304: =MRI!G20 -> 12 | J304: =MRI!H20 -> 20C3M Run 2 | K304: =MRI!I20 -> 1990 | L304: =MRI!J20 -> - | M304: =H304-F304+1 -> 111 | N304: =12*(H304-F304)+I304-G304+1 -> 1332
A305: =MRI!F$2 -> Meteorological Research Institute | B305: =MRI!F$3 -> Japan | C305: =MRI!F$1 -> MRI-CGCM2.3.2 | D305: =MRI!B21 -> SRESA1B | E305: =MRI!C21 -> Run 3 | F305: =MRI!D21 -> 1990 | G305: =MRI!E21 -> 1 | H305: =MRI!F21 -> 2100 | I305: =MRI!G21 -> 12 | J305: =MRI!H21 -> 20C3M Run 3 | K305: =MRI!I21 -> 1990 | L305: =MRI!J21 -> - | M305: =H305-F305+1 -> 111 | N305: =12*(H305-F305)+I305-G305+1 -> 1332
A306: =MRI!F$2 -> Meteorological Research Institute | B306: =MRI!F$3 -> Japan | C306: =MRI!F$1 -> MRI-CGCM2.3.2 | D306: =MRI!B22 -> SRESA1B | E306: =MRI!C22 -> Run 4 | F306: =MRI!D22 -> 1990 | G306: =MRI!E22 -> 1 | H306: =MRI!F22 -> 2100 | I306: =MRI!G22 -> 12 | J306: =MRI!H22 -> 20C3M Run 4 | K306: =MRI!I22 -> 1990 | L306: =MRI!J22 -> - | M306: =H306-F306+1 -> 111 | N306: =12*(H306-F306)+I306-G306+1 -> 1332
A307: =MRI!F$2 -> Meteorological Research Institute | B307: =MRI!F$3 -> Japan | C307: =MRI!F$1 -> MRI-CGCM2.3.2 | D307: =MRI!B23 -> SRESA1B | E307: =MRI!C23 -> Run 5 | F307: =MRI!D23 -> 1990 | G307: =MRI!E23 -> 1 | H307: =MRI!F23 -> 2100 | I307: =MRI!G23 -> 12 | J307: =MRI!H23 -> 20C3M Run 5 | K307: =MRI!I23 -> 1990 | L307: =MRI!J23 -> - | M307: =H307-F307+1 -> 111 | N307: =12*(H307-F307)+I307-G307+1 -> 1332
A308: =PCM!F$2 -> National Center for Atmospheric Research | B308: =PCM!F$3 -> USA | C308: =PCM!F$1 -> PCM | D308: =PCM!B25 -> SRESA1B | E308: =PCM!C25 -> Run 1 | F308: =PCM!D25 -> 2000 | G308: =PCM!E25 -> 1 | H308: =PCM!F25 -> 2199 | I308: =PCM!G25 -> 12 | J308: =PCM!H25 -> NA | K308: =PCM!I25 -> 2000 | L308: =PCM!J25 -> B07.08 (2000-2099) B07.76 (2100-2199); this run did not branch directly from the control run, but from January 1, 2000 of a ghg+sulfate+ozone run, which began in 1870 and branched from year 140 of the Picntrl Run 1. Thus, year 2000 of this run correponds to year 270 of the control run, but presumably has already strayed from the control run because of the 130 years under ghg+sulfate+ozone forcing. | M308: =H308-F308+1 -> 200 | N308: =12*(H308-F308)+I308-G308+1 -> 2400
A309: =PCM!F$2 -> National Center for Atmospheric Research | B309: =PCM!F$3 -> USA | C309: =PCM!F$1 -> PCM | D309: =PCM!B26 -> SRESA1B | E309: =PCM!C26 -> Run 2 | F309: =PCM!D26 -> 2000 | G309: =PCM!E26 -> 1 | H309: =PCM!F26 -> 2299 | I309: =PCM!G26 -> 12 | J309: =PCM!H26 -> NA | K309: =PCM!I26 -> 2000 | L309: =PCM!J26 -> B07.70a; this run did not branch directly from the control run, but from January 1, 2000 of a ghg+sulfate+ozone run, which began in 1870 and branched from year 100 of the Picntrl Run 1. Thus, year 2000 of this run correponds to year 230 of the control run, but presumably has already strayed from the control run because of the 130 years under ghg+sulfate+ozone forcing. | M309: =H309-F309+1 -> 300 | N309: =12*(H309-F309)+I309-G309+1 -> 3600
A310: =PCM!F$2 -> National Center for Atmospheric Research | B310: =PCM!F$3 -> USA | C310: =PCM!F$1 -> PCM | D310: =PCM!B27 -> SRESA1B | E310: =PCM!C27 -> Run 3 | F310: =PCM!D27 -> 2000 | G310: =PCM!E27 -> 1 | H310: =PCM!F27 -> 2199 | I310: =PCM!G27 -> 12 | J310: =PCM!H27 -> NA | K310: =PCM!I27 -> 2000 | L310: =PCM!J27 -> B07.70b; this run did not branch directly from the control run, but from January 1, 2000 of a ghg+sulfate+ozone run, which began in 1870 and branched from year 110 of the Picntrl Run 1. Thus, year 2000 of this run correponds to year 240 of the control run, but presumably has already strayed from the control run because of the 130 years under ghg+sulfate+ozone forcing. | M310: =H310-F310+1 -> 200 | N310: =12*(H310-F310)+I310-G310+1 -> 2400
A311: =PCM!F$2 -> National Center for Atmospheric Research | B311: =PCM!F$3 -> USA | C311: =PCM!F$1 -> PCM | D311: =PCM!B28 -> SRESA1B | E311: =PCM!C28 -> Run 4 | F311: =PCM!D28 -> 2000 | G311: =PCM!E28 -> 1 | H311: =PCM!F28 -> 2199 | I311: =PCM!G28 -> 12 | J311: =PCM!H28 -> NA | K311: =PCM!I28 -> 2000 | L311: =PCM!J28 -> B07.70c; this run did not branch directly from the control run, but from January 1, 2000 of a ghg+sulfate+ozone run, which began in 1870 and branched from year 170 of the Picntrl Run 1. Thus, year 2000 of this run correponds to year 300 of the control run, but presumably has already strayed from the control run because of the 130 years under ghg+sulfate+ozone forcing. | M311: =H311-F311+1 -> 200 | N311: =12*(H311-F311)+I311-G311+1 -> 2400
A312: =HadCM3!F$2 -> Hadley Centre for Climate Prediction and Research, Met Office | B312: =HadCM3!F$3 -> UK | C312: =HadCM3!F$1 -> UKMO-HadCM3 | D312: =HadCM3!B13 -> SRESA1B | E312: =HadCM3!C13 -> Run 1 | F312: =HadCM3!D13 -> 2000 | G312: =HadCM3!E13 -> 1 | H312: =HadCM3!F13 -> 2199 | I312: =HadCM3!G13 -> 12 | J312: =HadCM3!H13 -> 20C3M Run 2 | K312: =HadCM3!I13 -> 1999 | L312: =HadCM3!J13 -> - | M312: =H312-F312+1 -> 200 | N312: =12*(H312-F312)+I312-G312+1 -> 2400
A313: =HadGEM1!F$2 -> Hadley Centre for Climate Prediction and Research , Met Office | B313: =HadGEM1!F$3 -> UK | C313: =HadGEM1!F$1 -> UKMO-HadGEM1 | D313: =HadGEM1!B15 -> SRESA1B | E313: =HadGEM1!C15 -> Run 1 | F313: =HadGEM1!D15 -> 2000 | G313: =HadGEM1!E15 -> 1 | H313: =HadGEM1!F15 -> 2199 | I313: =HadGEM1!G15 -> 11 | J313: =HadGEM1!H15 -> 20C3M Run 1 | K313: =HadGEM1!I15 -> 1999 | L313: =HadGEM1!J15 -> - | M313: =H313-F313+1 -> 200 | N313: =12*(H313-F313)+I313-G313+1 -> 2399
A314: 0 | B314: 0 | C314: 0 | D314: SRESA2 | E314: 0 | F314: 0 | G314: 0 | H314: 0 | I314: 0 | J314: 0 | K314: 0 | L314: 0
A315: =BCC!F$2 -> Beijing Climate Center | B315: =BCC!F$3 -> China | C315: =BCC!F$1 -> BCC-CM1 | D315: =BCC!B17 -> SRESA2 | E315: =BCC!C17 -> Run 1 | F315: =BCC!D17 -> 1880 | G315: =BCC!E17 -> 1 | H315: =BCC!F17 -> 2100 | I315: =BCC!G17 -> 12 | J315: =BCC!H17 -> PDcntrl | K315: =BCC!I17 -> 1880 | L315: =BCC!J17 -> - | M315: =H315-F315+1 -> 221 | N315: =12*(H315-F315)+I315-G315+1 -> 2652
A316: =BCC!F$2 -> Beijing Climate Center | B316: =BCC!F$3 -> China | C316: =BCC!F$1 -> BCC-CM1 | D316: =BCC!B18 -> SRESA2 | E316: =BCC!C18 -> Run 2 | F316: =BCC!D18 -> 1880 | G316: =BCC!E18 -> 1 | H316: =BCC!F18 -> 2050 | I316: =BCC!G18 -> 12 | J316: =BCC!H18 -> PDcntrl | K316: =BCC!I18 -> 1880 | L316: =BCC!J18 -> - | M316: =H316-F316+1 -> 171 | N316: =12*(H316-F316)+I316-G316+1 -> 2052
A317: =CCSM3!F$2 -> National Center for Atmospheric Research | B317: =CCSM3!F$3 -> USA | C317: =CCSM3!F$1 -> CCSM3 | D317: =CCSM3!B39 -> SRESA2 | E317: =CCSM3!C39 -> Run 1 | F317: =CCSM3!D39 -> 2000 | G317: =CCSM3!E39 -> 1 | H317: =CCSM3!F39 -> 2099 | I317: =CCSM3!G39 -> 12 | J317: =CCSM3!H39 -> 20C3M run 1 | K317: =CCSM3!I39 -> 2000 | L317: =CCSM3!J39 -> b30.042a | M317: =H317-F317+1 -> 100 | N317: =12*(H317-F317)+I317-G317+1 -> 1200
A318: =CCSM3!F$2 -> National Center for Atmospheric Research | B318: =CCSM3!F$3 -> USA | C318: =CCSM3!F$1 -> CCSM3 | D318: =CCSM3!B40 -> SRESA2 | E318: =CCSM3!C40 -> Run 2 | F318: =CCSM3!D40 -> 2000 | G318: =CCSM3!E40 -> 1 | H318: =CCSM3!F40 -> 2099 | I318: =CCSM3!G40 -> 12 | J318: =CCSM3!H40 -> 20C3M run 2 | K318: =CCSM3!I40 -> 2000 | L318: =CCSM3!J40 -> b30.042b | M318: =H318-F318+1 -> 100 | N318: =12*(H318-F318)+I318-G318+1 -> 1200
A319: =CCSM3!F$2 -> National Center for Atmospheric Research | B319: =CCSM3!F$3 -> USA | C319: =CCSM3!F$1 -> CCSM3 | D319: =CCSM3!B41 -> SRESA2 | E319: =CCSM3!C41 -> Run 3 | F319: =CCSM3!D41 -> 2000 | G319: =CCSM3!E41 -> 1 | H319: =CCSM3!F41 -> 2099 | I319: =CCSM3!G41 -> 12 | J319: =CCSM3!H41 -> 20C3M run 3 | K319: =CCSM3!I41 -> 2000 | L319: =CCSM3!J41 -> b30.042c | M319: =H319-F319+1 -> 100 | N319: =12*(H319-F319)+I319-G319+1 -> 1200
A320: =CCSM3!F$2 -> National Center for Atmospheric Research | B320: =CCSM3!F$3 -> USA | C320: =CCSM3!F$1 -> CCSM3 | D320: =CCSM3!B42 -> SRESA2 | E320: =CCSM3!C42 -> Run 4 | F320: =CCSM3!D42 -> 2000 | G320: =CCSM3!E42 -> 1 | H320: =CCSM3!F42 -> 2099 | I320: =CCSM3!G42 -> 12 | J320: =CCSM3!H42 -> 20C3M run 4 | K320: =CCSM3!I42 -> 2000 | L320: =CCSM3!J42 -> b30.042d | M320: =H320-F320+1 -> 100 | N320: =12*(H320-F320)+I320-G320+1 -> 1200
A321: =CCSM3!F$2 -> National Center for Atmospheric Research | B321: =CCSM3!F$3 -> USA | C321: =CCSM3!F$1 -> CCSM3 | D321: =CCSM3!B43 -> SRESA2 | E321: =CCSM3!C43 -> Run 5 | F321: =CCSM3!D43 -> 2000 | G321: =CCSM3!E43 -> 1 | H321: =CCSM3!F43 -> 2099 | I321: =CCSM3!G43 -> 12 | J321: =CCSM3!H43 -> 20C3M run 5 | K321: =CCSM3!I43 -> 2000 | L321: =CCSM3!J43 -> b30.042e | M321: =H321-F321+1 -> 100 | N321: =12*(H321-F321)+I321-G321+1 -> 1200
A322: ='CGCM(T47)'!F$2 -> Canadian Centre for Climate Modeling & Analysis | B322: ='CGCM(T47)'!F$3 -> Canada | C322: ='CGCM(T47)'!F$1 -> CGCM3.1(T47) | D322: ='CGCM(T47)'!B26 -> SRESA2 | E322: ='CGCM(T47)'!C26 -> Run 1 | F322: ='CGCM(T47)'!D26 -> 2001 | G322: ='CGCM(T47)'!E26 -> 1 | H322: ='CGCM(T47)'!F26 -> 2100 | I322: ='CGCM(T47)'!G26 -> 12 | J322: ='CGCM(T47)'!H26 -> 20C3M Run 1 | K322: ='CGCM(T47)'!I26 -> 2001 | L322: ='CGCM(T47)'!J26 -> - | M322: =H322-F322+1 -> 100 | N322: =12*(H322-F322)+I322-G322+1 -> 1200
A323: ='CGCM(T47)'!F$2 -> Canadian Centre for Climate Modeling & Analysis | B323: ='CGCM(T47)'!F$3 -> Canada | C323: ='CGCM(T47)'!F$1 -> CGCM3.1(T47) | D323: ='CGCM(T47)'!B27 -> SRESA2 | E323: ='CGCM(T47)'!C27 -> Run 2 | F323: ='CGCM(T47)'!D27 -> 2001 | G323: ='CGCM(T47)'!E27 -> 1 | H323: ='CGCM(T47)'!F27 -> 2100 | I323: ='CGCM(T47)'!G27 -> 12 | J323: ='CGCM(T47)'!H27 -> 20C3M Run 2 | K323: ='CGCM(T47)'!I27 -> 2001 | L323: ='CGCM(T47)'!J27 -> - | M323: =H323-F323+1 -> 100 | N323: =12*(H323-F323)+I323-G323+1 -> 1200
A324: ='CGCM(T47)'!F$2 -> Canadian Centre for Climate Modeling & Analysis | B324: ='CGCM(T47)'!F$3 -> Canada | C324: ='CGCM(T47)'!F$1 -> CGCM3.1(T47) | D324: ='CGCM(T47)'!B28 -> SRESA2 | E324: ='CGCM(T47)'!C28 -> Run 3 | F324: ='CGCM(T47)'!D28 -> 2001 | G324: ='CGCM(T47)'!E28 -> 1 | H324: ='CGCM(T47)'!F28 -> 2100 | I324: ='CGCM(T47)'!G28 -> 12 | J324: ='CGCM(T47)'!H28 -> 20C3M Run 3 | K324: ='CGCM(T47)'!I28 -> 2001 | L324: ='CGCM(T47)'!J28 -> - | M324: =H324-F324+1 -> 100 | N324: =12*(H324-F324)+I324-G324+1 -> 1200
A325: ='CGCM(T47)'!F$2 -> Canadian Centre for Climate Modeling & Analysis | B325: ='CGCM(T47)'!F$3 -> Canada | C325: ='CGCM(T47)'!F$1 -> CGCM3.1(T47) | D325: ='CGCM(T47)'!B29 -> SRESA2 | E325: ='CGCM(T47)'!C29 -> Run 4 | F325: ='CGCM(T47)'!D29 -> 2001 | G325: ='CGCM(T47)'!E29 -> 1 | H325: ='CGCM(T47)'!F29 -> 2100 | I325: ='CGCM(T47)'!G29 -> 12 | J325: ='CGCM(T47)'!H29 -> 20C3M Run 4 | K325: ='CGCM(T47)'!I29 -> 2001 | L325: ='CGCM(T47)'!J29 -> - | M325: =H325-F325+1 -> 100 | N325: =12*(H325-F325)+I325-G325+1 -> 1200
A326: ='CGCM(T47)'!F$2 -> Canadian Centre for Climate Modeling & Analysis | B326: ='CGCM(T47)'!F$3 -> Canada | C326: ='CGCM(T47)'!F$1 -> CGCM3.1(T47) | D326: ='CGCM(T47)'!B30 -> SRESA2 | E326: ='CGCM(T47)'!C30 -> Run 5 | F326: ='CGCM(T47)'!D30 -> 2001 | G326: ='CGCM(T47)'!E30 -> 1 | H326: ='CGCM(T47)'!F30 -> 2100 | I326: ='CGCM(T47)'!G30 -> 12 | J326: ='CGCM(T47)'!H30 -> 20C3M Run 5 | K326: ='CGCM(T47)'!I30 -> 2001 | L326: ='CGCM(T47)'!J30 -> - | M326: =H326-F326+1 -> 100 | N326: =12*(H326-F326)+I326-G326+1 -> 1200
A327: =CNRM!F$2 -> Météo-France / Centre National de Recherches Météorologiques | B327: =CNRM!F$3 -> France | C327: =CNRM!F$1 -> CNRM-CM3 | D327: =CNRM!B15 -> SRESA2 | E327: =CNRM!C15 -> Run 1 | F327: =CNRM!D15 -> 2000 | G327: =CNRM!E15 -> 1 | H327: =CNRM!F15 -> 2100 | I327: =CNRM!G15 -> 12 | J327: =CNRM!H15 -> 20C3M Run 1 | K327: =CNRM!I15 -> 2000 | L327: =CNRM!J15 -> - | M327: =H327-F327+1 -> 101 | N327: =12*(H327-F327)+I327-G327+1 -> 1212
A328: ='CSIRO-3.0'!F$2 -> CSIRO Atmospheric Research | B328: ='CSIRO-3.0'!F$3 -> Australia | C328: ='CSIRO-3.0'!F$1 -> CSIRO-Mk3.0 | D328: ='CSIRO-3.0'!B16 -> SRESA2 | E328: ='CSIRO-3.0'!C16 -> Run 1 | F328: ='CSIRO-3.0'!D16 -> 2001 | G328: ='CSIRO-3.0'!E16 -> 1 | H328: ='CSIRO-3.0'!F16 -> 2100 | I328: ='CSIRO-3.0'!G16 -> 12 | J328: ='CSIRO-3.0'!H16 -> 20C3M Run 1 | K328: ='CSIRO-3.0'!I16 -> 2001 | L328: ='CSIRO-3.0'!J16 -> - | M328: =H328-F328+1 -> 100 | N328: =12*(H328-F328)+I328-G328+1 -> 1200
A329: ='CSIRO-3.5'!F$2 -> CSIRO Atmospheric Research | B329: ='CSIRO-3.5'!F$3 -> Australia | C329: ='CSIRO-3.5'!F$1 -> CSIRO-Mk3.5 | D329: ='CSIRO-3.5'!B14 -> SRESA2 | E329: ='CSIRO-3.5'!C14 -> Run1 | F329: ='CSIRO-3.5'!D14 -> 2001 | G329: ='CSIRO-3.5'!E14 -> 1 | H329: ='CSIRO-3.5'!F14 -> 2100 | I329: ='CSIRO-3.5'!G14 -> 12 | J329: ='CSIRO-3.5'!H14 -> 20C3M Run 1 | K329: ='CSIRO-3.5'!I14 -> 2001 | L329: ='CSIRO-3.5'!J14 -> initialised from end of model year 300 (beginning of 2001 of 20C3M Run1). | M329: =H329-F329+1 -> 100 | N329: =12*(H329-F329)+I329-G329+1 -> 1200
A330: =ECHAM5!F$2 -> Max Planck Institute for Meteorology | B330: =ECHAM5!F$3 -> Germany | C330: =ECHAM5!F$1 -> ECHAM5/MPI-OM | D330: =ECHAM5!B25 -> SRESA2 | E330: =ECHAM5!C25 -> Run 1 | F330: =ECHAM5!D25 -> 2001 | G330: =ECHAM5!E25 -> 1 | H330: =ECHAM5!F25 -> 2100 | I330: =ECHAM5!G25 -> 12 | J330: =ECHAM5!H25 -> 20C3M | K330: =ECHAM5!I25 -> 2001 | L330: =ECHAM5!J25 -> - | M330: =H330-F330+1 -> 100 | N330: =12*(H330-F330)+I330-G330+1 -> 1200
A331: =ECHAM5!F$2 -> Max Planck Institute for Meteorology | B331: =ECHAM5!F$3 -> Germany | C331: =ECHAM5!F$1 -> ECHAM5/MPI-OM | D331: =ECHAM5!B26 -> SRESA2 | E331: =ECHAM5!C26 -> Run 2 | F331: =ECHAM5!D26 -> 2001 | G331: =ECHAM5!E26 -> 1 | H331: =ECHAM5!F26 -> 2100 | I331: =ECHAM5!G26 -> 12 | J331: =ECHAM5!H26 -> 20C3M | K331: =ECHAM5!I26 -> 2001 | L331: =ECHAM5!J26 -> - | M331: =H331-F331+1 -> 100 | N331: =12*(H331-F331)+I331-G331+1 -> 1200
A332: =ECHAM5!F$2 -> Max Planck Institute for Meteorology | B332: =ECHAM5!F$3 -> Germany | C332: =ECHAM5!F$1 -> ECHAM5/MPI-OM | D332: =ECHAM5!B27 -> SRESA2 | E332: =ECHAM5!C27 -> Run 3 | F332: =ECHAM5!D27 -> 2001 | G332: =ECHAM5!E27 -> 1 | H332: =ECHAM5!F27 -> 2100 | I332: =ECHAM5!G27 -> 12 | J332: =ECHAM5!H27 -> 20C3M | K332: =ECHAM5!I27 -> 2001 | L332: =ECHAM5!J27 -> - | M332: =H332-F332+1 -> 100 | N332: =12*(H332-F332)+I332-G332+1 -> 1200
A333: ='ECHO-G'!F$2 -> Meteorological Institute of the University of Bonn (MIUB), Meteorological Research Institute of KMA (METRI), and Model and Data group (M&D) | B333: ='ECHO-G'!F$3 -> Germany & Korea | C333: ='ECHO-G'!F$1 -> ECHO-G | D333: ='ECHO-G'!B22 -> SRESA2 | E333: ='ECHO-G'!C22 -> Run 1 | F333: ='ECHO-G'!D22 -> 2001 | G333: ='ECHO-G'!E22 -> 1 | H333: ='ECHO-G'!F22 -> 2100 | I333: ='ECHO-G'!G22 -> 12 | J333: ='ECHO-G'!H22 -> 20C3M Run 1 | K333: ='ECHO-G'!I22 -> 2001 | L333: ='ECHO-G'!J22 -> - | M333: =H333-F333+1 -> 100 | N333: =12*(H333-F333)+I333-G333+1 -> 1200
A334: ='ECHO-G'!F$2 -> Meteorological Institute of the University of Bonn (MIUB), Meteorological Research Institute of KMA (METRI), and Model and Data group (M&D) | B334: ='ECHO-G'!F$3 -> Germany & Korea | C334: ='ECHO-G'!F$1 -> ECHO-G | D334: ='ECHO-G'!B23 -> SRESA2 | E334: ='ECHO-G'!C23 -> Run 2 | F334: ='ECHO-G'!D23 -> 2001 | G334: ='ECHO-G'!E23 -> 1 | H334: ='ECHO-G'!F23 -> 2100 | I334: ='ECHO-G'!G23 -> 12 | J334: ='ECHO-G'!H23 -> 20C3M Run 2 | K334: ='ECHO-G'!I23 -> 2001 | L334: ='ECHO-G'!J23 -> - | M334: =H334-F334+1 -> 100 | N334: =12*(H334-F334)+I334-G334+1 -> 1200
A335: ='ECHO-G'!F$2 -> Meteorological Institute of the University of Bonn (MIUB), Meteorological Research Institute of KMA (METRI), and Model and Data group (M&D) | B335: ='ECHO-G'!F$3 -> Germany & Korea | C335: ='ECHO-G'!F$1 -> ECHO-G | D335: ='ECHO-G'!B24 -> SRESA2 | E335: ='ECHO-G'!C24 -> Run 3 | F335: ='ECHO-G'!D24 -> 2001 | G335: ='ECHO-G'!E24 -> 1 | H335: ='ECHO-G'!F24 -> 2100 | I335: ='ECHO-G'!G24 -> 12 | J335: ='ECHO-G'!H24 -> 20C3M Run 3 | K335: ='ECHO-G'!I24 -> 2001 | L335: ='ECHO-G'!J24 -> - | M335: =H335-F335+1 -> 100 | N335: =12*(H335-F335)+I335-G335+1 -> 1200
A336: ='GFDL-2.0'!F$2 -> US Dept. of Commerce / NOAA / Geophysical Fluid Dynamics Laboratory | B336: ='GFDL-2.0'!F$3 -> USA | C336: ='GFDL-2.0'!F$1 -> GFDL-CM2.0 | D336: ='GFDL-2.0'!B14 -> SRESA2 | E336: ='GFDL-2.0'!C14 -> Run 1 | F336: ='GFDL-2.0'!D14 -> 2001 | G336: ='GFDL-2.0'!E14 -> 1 | H336: ='GFDL-2.0'!F14 -> 2100 | I336: ='GFDL-2.0'!G14 -> 12 | J336: ='GFDL-2.0'!H14 -> 20C3M Run 1 | K336: ='GFDL-2.0'!I14 -> 2001 | L336: ='GFDL-2.0'!J14 -> - | M336: =H336-F336+1 -> 100 | N336: =12*(H336-F336)+I336-G336+1 -> 1200
A337: ='GFDL-2.1'!F$2 -> US Dept. of Commerce / NOAA / Geophysical Fluid Dynamics Laboratory | B337: ='GFDL-2.1'!F$3 -> USA | C337: ='GFDL-2.1'!F$1 -> GFDL-CM2.1 | D337: ='GFDL-2.1'!B17 -> SRESA2 | E337: ='GFDL-2.1'!C17 -> Run 1 | F337: ='GFDL-2.1'!D17 -> 2001 | G337: ='GFDL-2.1'!E17 -> 1 | H337: ='GFDL-2.1'!F17 -> 2100 | I337: ='GFDL-2.1'!G17 -> 12 | J337: ='GFDL-2.1'!H17 -> 20C3M Run 2 | K337: ='GFDL-2.1'!I17 -> 2001 | L337: ='GFDL-2.1'!J17 -> - | M337: =H337-F337+1 -> 100 | N337: =12*(H337-F337)+I337-G337+1 -> 1200
A338: ='GISS-ER'!F$2 -> NASA / Goddard Institute for Space Studies | B338: ='GISS-ER'!F$3 -> USA | C338: ='GISS-ER'!F$1 -> GISS-ER | D338: ='GISS-ER'!B27 -> SRESA2 | E338: ='GISS-ER'!C27 -> Run 1 | F338: ='GISS-ER'!D27 -> 2004 | G338: ='GISS-ER'!E27 -> 1 | H338: ='GISS-ER'!F27 -> 2100 | I338: ='GISS-ER'!G27 -> 12 | J338: ='GISS-ER'!H27 -> 20C3M Run 3 | K338: ='GISS-ER'!I27 -> 2004 | L338: ='GISS-ER'!J27 -> - | M338: =H338-F338+1 -> 97 | N338: =12*(H338-F338)+I338-G338+1 -> 1164
A339: =INM!F$2 -> Institute for Numerical Mathematics | B339: =INM!F$3 -> Russia | C339: =INM!F$1 -> INM-CM3.0 | D339: =INM!B15 -> SRESA2 | E339: =INM!C15 -> Run 1 | F339: =INM!D15 -> 2001 | G339: =INM!E15 -> 1 | H339: =INM!F15 -> 2200 | I339: =INM!G15 -> 12 | J339: =INM!H15 -> 20C3M | K339: =INM!I15 -> 2001 | L339: =INM!J15 -> - | M339: =H339-F339+1 -> 200 | N339: =12*(H339-F339)+I339-G339+1 -> 2400
A340: =IPSL!F$2 -> Institut Pierre Simon Laplace | B340: =IPSL!F$3 -> France | C340: =IPSL!F$1 -> IPSL-CM4 | D340: =IPSL!B13 -> SRESA2 | E340: =IPSL!C13 -> Run 1 | F340: =IPSL!D13 -> 2000 | G340: =IPSL!E13 -> 1 | H340: =IPSL!F13 -> 2100 | I340: =IPSL!G13 -> 12 | J340: =IPSL!H13 -> 20C3M Run 0 | K340: =IPSL!I13 -> 2000 | L340: =IPSL!J13 -> Run 0 (not sent to PCMDI) is exactly the same as RUN 1 until year 1970, then it differs because of a bug reading the file of sulfate from year 1970 to 1975. We verify that the climate of year 2000 of RUN 0 is very close to climate of year 2000 of run 1. | M340: =H340-F340+1 -> 101 | N340: =12*(H340-F340)+I340-G340+1 -> 1212
A341: ='MIROC(medres)'!F$2 -> Center for Climate System Research (The University of Tokyo), National Institute for Environmental Studies, and Frontier Research Center for Global Change (JAMSTEC) | B341: ='MIROC(medres)'!F$3 -> Japan | C341: ='MIROC(medres)'!F$1 -> MIROC3.2(medres) | D341: ='MIROC(medres)'!B25 -> SRESA2 | E341: ='MIROC(medres)'!C25 -> Run 1 | F341: ='MIROC(medres)'!D25 -> 2001 | G341: ='MIROC(medres)'!E25 -> 1 | H341: ='MIROC(medres)'!F25 -> 2100 | I341: ='MIROC(medres)'!G25 -> 12 | J341: ='MIROC(medres)'!H25 -> 20C3M Run 1 | K341: ='MIROC(medres)'!I25 -> 2001 | L341: ='MIROC(medres)'!J25 -> The initial condition is the end of the corresponding 20C3M run. | M341: =H341-F341+1 -> 100 | N341: =12*(H341-F341)+I341-G341+1 -> 1200
A342: ='MIROC(medres)'!F$2 -> Center for Climate System Research (The University of Tokyo), National Institute for Environmental Studies, and Frontier Research Center for Global Change (JAMSTEC) | B342: ='MIROC(medres)'!F$3 -> Japan | C342: ='MIROC(medres)'!F$1 -> MIROC3.2(medres) | D342: ='MIROC(medres)'!B26 -> SRESA2 | E342: ='MIROC(medres)'!C26 -> Run 2 | F342: ='MIROC(medres)'!D26 -> 2001 | G342: ='MIROC(medres)'!E26 -> 1 | H342: ='MIROC(medres)'!F26 -> 2100 | I342: ='MIROC(medres)'!G26 -> 12 | J342: ='MIROC(medres)'!H26 -> 20C3M Run 2 | K342: ='MIROC(medres)'!I26 -> 2001 | L342: ='MIROC(medres)'!J26 -> The initial condition is the end of the corresponding 20C3M run. | M342: =H342-F342+1 -> 100 | N342: =12*(H342-F342)+I342-G342+1 -> 1200
A343: ='MIROC(medres)'!F$2 -> Center for Climate System Research (The University of Tokyo), National Institute for Environmental Studies, and Frontier Research Center for Global Change (JAMSTEC) | B343: ='MIROC(medres)'!F$3 -> Japan | C343: ='MIROC(medres)'!F$1 -> MIROC3.2(medres) | D343: ='MIROC(medres)'!B27 -> SRESA2 | E343: ='MIROC(medres)'!C27 -> Run 3 | F343: ='MIROC(medres)'!D27 -> 2001 | G343: ='MIROC(medres)'!E27 -> 1 | H343: ='MIROC(medres)'!F27 -> 2100 | I343: ='MIROC(medres)'!G27 -> 12 | J343: ='MIROC(medres)'!H27 -> 20C3M Run 3 | K343: ='MIROC(medres)'!I27 -> 2001 | L343: ='MIROC(medres)'!J27 -> The initial condition is the end of the corresponding 20C3M run. | M343: =H343-F343+1 -> 100 | N343: =12*(H343-F343)+I343-G343+1 -> 1200
A344: =MRI!F$2 -> Meteorological Research Institute | B344: =MRI!F$3 -> Japan | C344: =MRI!F$1 -> MRI-CGCM2.3.2 | D344: =MRI!B24 -> SRESA2 | E344: =MRI!C24 -> Run 1 | F344: =MRI!D24 -> 1990 | G344: =MRI!E24 -> 1 | H344: =MRI!F24 -> 2100 | I344: =MRI!G24 -> 12 | J344: =MRI!H24 -> 20C3M Run 1 | K344: =MRI!I24 -> 1990 | L344: =MRI!J24 -> - | M344: =H344-F344+1 -> 111 | N344: =12*(H344-F344)+I344-G344+1 -> 1332
A345: =MRI!F$2 -> Meteorological Research Institute | B345: =MRI!F$3 -> Japan | C345: =MRI!F$1 -> MRI-CGCM2.3.2 | D345: =MRI!B25 -> SRESA2 | E345: =MRI!C25 -> Run 2 | F345: =MRI!D25 -> 1990 | G345: =MRI!E25 -> 1 | H345: =MRI!F25 -> 2100 | I345: =MRI!G25 -> 12 | J345: =MRI!H25 -> 20C3M Run 2 | K345: =MRI!I25 -> 1990 | L345: =MRI!J25 -> - | M345: =H345-F345+1 -> 111 | N345: =12*(H345-F345)+I345-G345+1 -> 1332
A346: =MRI!F$2 -> Meteorological Research Institute | B346: =MRI!F$3 -> Japan | C346: =MRI!F$1 -> MRI-CGCM2.3.2 | D346: =MRI!B26 -> SRESA2 | E346: =MRI!C26 -> Run 3 | F346: =MRI!D26 -> 1990 | G346: =MRI!E26 -> 1 | H346: =MRI!F26 -> 2100 | I346: =MRI!G26 -> 12 | J346: =MRI!H26 -> 20C3M Run 3 | K346: =MRI!I26 -> 1990 | L346: =MRI!J26 -> - | M346: =H346-F346+1 -> 111 | N346: =12*(H346-F346)+I346-G346+1 -> 1332
A347: =MRI!F$2 -> Meteorological Research Institute | B347: =MRI!F$3 -> Japan | C347: =MRI!F$1 -> MRI-CGCM2.3.2 | D347: =MRI!B27 -> SRESA2 | E347: =MRI!C27 -> Run 4 | F347: =MRI!D27 -> 1990 | G347: =MRI!E27 -> 1 | H347: =MRI!F27 -> 2100 | I347: =MRI!G27 -> 12 | J347: =MRI!H27 -> 20C3M Run 4 | K347: =MRI!I27 -> 1990 | L347: =MRI!J27 -> - | M347: =H347-F347+1 -> 111 | N347: =12*(H347-F347)+I347-G347+1 -> 1332
A348: =MRI!F$2 -> Meteorological Research Institute | B348: =MRI!F$3 -> Japan | C348: =MRI!F$1 -> MRI-CGCM2.3.2 | D348: =MRI!B28 -> SRESA2 | E348: =MRI!C28 -> Run 5 | F348: =MRI!D28 -> 1990 | G348: =MRI!E28 -> 1 | H348: =MRI!F28 -> 2100 | I348: =MRI!G28 -> 12 | J348: =MRI!H28 -> 20C3M Run 5 | K348: =MRI!I28 -> 1990 | L348: =MRI!J28 -> - | M348: =H348-F348+1 -> 111 | N348: =12*(H348-F348)+I348-G348+1 -> 1332
A349: =PCM!F$2 -> National Center for Atmospheric Research | B349: =PCM!F$3 -> USA | C349: =PCM!F$1 -> PCM | D349: =PCM!B29 -> SRESA2 | E349: =PCM!C29 -> Run 1 | F349: =PCM!D29 -> 2000 | G349: =PCM!E29 -> 1 | H349: =PCM!F29 -> 2099 | I349: =PCM!G29 -> 12 | J349: =PCM!H29 -> NA | K349: =PCM!I29 -> 2000 | L349: =PCM!J29 -> B06.20; this run did not branch directly from the control run, but from January 1, 2000 of a ghg+sulfate+ozone run, which began in 1870 and branched from year 140 of the Picntrl Run 1. Thus, year 2000 of this run correponds to year 270 of the control run, but presumably has already strayed from the control run because of the 130 years under ghg+sulfate+ozone forcing. | M349: =H349-F349+1 -> 100 | N349: =12*(H349-F349)+I349-G349+1 -> 1200
A350: =PCM!F$2 -> National Center for Atmospheric Research | B350: =PCM!F$3 -> USA | C350: =PCM!F$1 -> PCM | D350: =PCM!B30 -> SRESA2 | E350: =PCM!C30 -> Run 2 | F350: =PCM!D30 -> 2000 | G350: =PCM!E30 -> 1 | H350: =PCM!F30 -> 2099 | I350: =PCM!G30 -> 12 | J350: =PCM!H30 -> NA | K350: =PCM!I30 -> 2000 | L350: =PCM!J30 -> B07.72a; this run did not branch directly from the control run, but from January 1, 2000 of a ghg+sulfate+ozone run, which began in 1870 and branched from year 100 of the Picntrl Run 1. Thus, year 2000 of this run correponds to year 230 of the control run, but presumably has already strayed from the control run because of the 130 years under ghg+sulfate+ozone forcing. | M350: =H350-F350+1 -> 100 | N350: =12*(H350-F350)+I350-G350+1 -> 1200
A351: =PCM!F$2 -> National Center for Atmospheric Research | B351: =PCM!F$3 -> USA | C351: =PCM!F$1 -> PCM | D351: =PCM!B31 -> SRESA2 | E351: =PCM!C31 -> Run 3 | F351: =PCM!D31 -> 2000 | G351: =PCM!E31 -> 1 | H351: =PCM!F31 -> 2099 | I351: =PCM!G31 -> 12 | J351: =PCM!H31 -> NA | K351: =PCM!I31 -> 2000 | L351: =PCM!J31 -> B07.72b; this run did not branch directly from the control run, but from January 1, 2000 of a ghg+sulfate+ozone run, which began in 1870 and branched from year 110 of the Picntrl Run 1. Thus, year 2000 of this run correponds to year 240 of the control run, but presumably has already strayed from the control run because of the 130 years under ghg+sulfate+ozone forcing. | M351: =H351-F351+1 -> 100 | N351: =12*(H351-F351)+I351-G351+1 -> 1200
A352: =PCM!F$2 -> National Center for Atmospheric Research | B352: =PCM!F$3 -> USA | C352: =PCM!F$1 -> PCM | D352: =PCM!B32 -> SRESA2 | E352: =PCM!C32 -> Run 4 | F352: =PCM!D32 -> 2000 | G352: =PCM!E32 -> 1 | H352: =PCM!F32 -> 2099 | I352: =PCM!G32 -> 12 | J352: =PCM!H32 -> NA | K352: =PCM!I32 -> 2000 | L352: =PCM!J32 -> B07.72c; this run did not branch directly from the control run, but from January 1, 2000 of a ghg+sulfate+ozone run, which began in 1870 and branched from year 170 of the Picntrl Run 1. Thus, year 2000 of this run correponds to year 300 of the control run, but presumably has already strayed from the control run because of the 130 years under ghg+sulfate+ozone forcing. | M352: =H352-F352+1 -> 100 | N352: =12*(H352-F352)+I352-G352+1 -> 1200
A353: =HadCM3!F$2 -> Hadley Centre for Climate Prediction and Research, Met Office | B353: =HadCM3!F$3 -> UK | C353: =HadCM3!F$1 -> UKMO-HadCM3 | D353: =HadCM3!B14 -> SRESA2 | E353: =HadCM3!C14 -> Run 1 | F353: =HadCM3!D14 -> 2000 | G353: =HadCM3!E14 -> 1 | H353: =HadCM3!F14 -> 2099 | I353: =HadCM3!G14 -> 12 | J353: =HadCM3!H14 -> 20C3M Run 1 | K353: =HadCM3!I14 -> 1999 | L353: =HadCM3!J14 -> - | M353: =H353-F353+1 -> 100 | N353: =12*(H353-F353)+I353-G353+1 -> 1200
A354: =HadGEM1!F$2 -> Hadley Centre for Climate Prediction and Research , Met Office | B354: =HadGEM1!F$3 -> UK | C354: =HadGEM1!F$1 -> UKMO-HadGEM1 | D354: =HadGEM1!B16 -> SRESA2 | E354: =HadGEM1!C16 -> Run 1 | F354: =HadGEM1!D16 -> 2000 | G354: =HadGEM1!E16 -> 1 | H354: =HadGEM1!F16 -> 2099 | I354: =HadGEM1!G16 -> 11 | J354: =HadGEM1!H16 -> 20C3M Run 1 | K354: =HadGEM1!I16 -> 1999 | L354: =HadGEM1!J16 -> - | M354: =H354-F354+1 -> 100 | N354: =12*(H354-F354)+I354-G354+1 -> 1199
A355: 0 | B355: 0 | C355: 0 | D355: SRESB1 | E355: 0 | F355: 0 | G355: 0 | H355: 0 | I355: 0 | J355: 0 | K355: 0 | L355: 0
A356: =BCC!F$2 -> Beijing Climate Center | B356: =BCC!F$3 -> China | C356: =BCC!F$1 -> BCC-CM1 | D356: =BCC!B19 -> SRESB1 | E356: =BCC!C19 -> Run 1 | F356: =BCC!D19 -> 1880 | G356: =BCC!E19 -> 1 | H356: =BCC!F19 -> 2100 | I356: =BCC!G19 -> 12 | J356: =BCC!H19 -> PDcntrl | K356: =BCC!I19 -> 1880 | L356: =BCC!J19 -> - | M356: =H356-F356+1 -> 221 | N356: =12*(H356-F356)+I356-G356+1 -> 2652
A357: =BCC!F$2 -> Beijing Climate Center | B357: =BCC!F$3 -> China | C357: =BCC!F$1 -> BCC-CM1 | D357: =BCC!B20 -> SRESB1 | E357: =BCC!C20 -> Run 2 | F357: =BCC!D20 -> 1880 | G357: =BCC!E20 -> 1 | H357: =BCC!F20 -> 2050 | I357: =BCC!G20 -> 12 | J357: =BCC!H20 -> PDcntrl | K357: =BCC!I20 -> 1880 | L357: =BCC!J20 -> - | M357: =H357-F357+1 -> 171 | N357: =12*(H357-F357)+I357-G357+1 -> 2052
A358: =CCSM3!F$2 -> National Center for Atmospheric Research | B358: =CCSM3!F$3 -> USA | C358: =CCSM3!F$1 -> CCSM3 | D358: =CCSM3!B44 -> SRESB1 | E358: =CCSM3!C44 -> Run 1 | F358: =CCSM3!D44 -> 2000 | G358: =CCSM3!E44 -> 1 | H358: =CCSM3!F44 -> 2199 | I358: =CCSM3!G44 -> 12 | J358: =CCSM3!H44 -> 20C3M run 1 | K358: =CCSM3!I44 -> 2000 | L358: =CCSM3!J44 -> b30.041a (2000-2099) b30.045a (2100-2199) | M358: =H358-F358+1 -> 200 | N358: =12*(H358-F358)+I358-G358+1 -> 2400
A359: =CCSM3!F$2 -> National Center for Atmospheric Research | B359: =CCSM3!F$3 -> USA | C359: =CCSM3!F$1 -> CCSM3 | D359: =CCSM3!B45 -> SRESB1 | E359: =CCSM3!C45 -> Run 2 | F359: =CCSM3!D45 -> 2000 | G359: =CCSM3!E45 -> 1 | H359: =CCSM3!F45 -> 2199 | I359: =CCSM3!G45 -> 12 | J359: =CCSM3!H45 -> 20C3M run 2 | K359: =CCSM3!I45 -> 2000 | L359: =CCSM3!J45 -> b30.041b (2000-2099) b30.045b (2100-2199) | M359: =H359-F359+1 -> 200 | N359: =12*(H359-F359)+I359-G359+1 -> 2400
A360: =CCSM3!F$2 -> National Center for Atmospheric Research | B360: =CCSM3!F$3 -> USA | C360: =CCSM3!F$1 -> CCSM3 | D360: =CCSM3!B46 -> SRESB1 | E360: =CCSM3!C46 -> Run 3 | F360: =CCSM3!D46 -> 2000 | G360: =CCSM3!E46 -> 1 | H360: =CCSM3!F46 -> 2199 | I360: =CCSM3!G46 -> 12 | J360: =CCSM3!H46 -> 20C3M run 3 | K360: =CCSM3!I46 -> 2000 | L360: =CCSM3!J46 -> b30.041c (2000-2099) b30.045c (2100-2199) | M360: =H360-F360+1 -> 200 | N360: =12*(H360-F360)+I360-G360+1 -> 2400
A361: =CCSM3!F$2 -> National Center for Atmospheric Research | B361: =CCSM3!F$3 -> USA | C361: =CCSM3!F$1 -> CCSM3 | D361: =CCSM3!B47 -> SRESB1 | E361: =CCSM3!C47 -> Run 4 | F361: =CCSM3!D47 -> 2000 | G361: =CCSM3!E47 -> 1 | H361: =CCSM3!F47 -> 2099 | I361: =CCSM3!G47 -> 12 | J361: =CCSM3!H47 -> 20C3M run 4 | K361: =CCSM3!I47 -> 2000 | L361: =CCSM3!J47 -> b30.041d (2000-2099) b30.045d (2100-2199) | M361: =H361-F361+1 -> 100 | N361: =12*(H361-F361)+I361-G361+1 -> 1200
A362: =CCSM3!F$2 -> National Center for Atmospheric Research | B362: =CCSM3!F$3 -> USA | C362: =CCSM3!F$1 -> CCSM3 | D362: =CCSM3!B48 -> SRESB1 | E362: =CCSM3!C48 -> Run 5 | F362: =CCSM3!D48 -> 2000 | G362: =CCSM3!E48 -> 1 | H362: =CCSM3!F48 -> 2099 | I362: =CCSM3!G48 -> 12 | J362: =CCSM3!H48 -> 20C3M run 5 | K362: =CCSM3!I48 -> 2000 | L362: =CCSM3!J48 -> b30.041e (2000-2099) b30.045e (2100-2199) | M362: =H362-F362+1 -> 100 | N362: =12*(H362-F362)+I362-G362+1 -> 1200
A363: =CCSM3!F$2 -> National Center for Atmospheric Research | B363: =CCSM3!F$3 -> USA | C363: =CCSM3!F$1 -> CCSM3 | D363: =CCSM3!B49 -> SRESB1 | E363: =CCSM3!C49 -> Run 6 | F363: =CCSM3!D49 -> 2000 | G363: =CCSM3!E49 -> 1 | H363: =CCSM3!F49 -> 2449 | I363: =CCSM3!G49 -> 12 | J363: =CCSM3!H49 -> 20C3M run 6 | K363: =CCSM3!I49 -> 2000 | L363: =CCSM3!J49 -> b30.041b.ES01 (2000-2099) b30.045b.ES01 (2100-2449) | M363: =H363-F363+1 -> 450 | N363: =12*(H363-F363)+I363-G363+1 -> 5400
A364: =CCSM3!F$2 -> National Center for Atmospheric Research | B364: =CCSM3!F$3 -> USA | C364: =CCSM3!F$1 -> CCSM3 | D364: =CCSM3!B50 -> SRESB1 | E364: =CCSM3!C50 -> Run 7 | F364: =CCSM3!D50 -> 2000 | G364: =CCSM3!E50 -> 1 | H364: =CCSM3!F50 -> 2349 | I364: =CCSM3!G50 -> 12 | J364: =CCSM3!H50 -> 20C3M run 7 | K364: =CCSM3!I50 -> 2000 | L364: =CCSM3!J50 -> b30.041f.ES01 (2000-2099) b30.045f.ES01 (2100-2349) | M364: =H364-F364+1 -> 350 | N364: =12*(H364-F364)+I364-G364+1 -> 4200
A365: =CCSM3!F$2 -> National Center for Atmospheric Research | B365: =CCSM3!F$3 -> USA | C365: =CCSM3!F$1 -> CCSM3 | D365: =CCSM3!B51 -> SRESB1 | E365: =CCSM3!C51 -> Run 8 | F365: =CCSM3!D51 -> 2000 | G365: =CCSM3!E51 -> 1 | H365: =CCSM3!F51 -> 2349 | I365: =CCSM3!G51 -> 12 | J365: =CCSM3!H51 -> 20C3M run 8 | K365: =CCSM3!I51 -> 2000 | L365: =CCSM3!J51 -> b30.041g.ES01 (2000-2099) b30.045g.ES01 (2100-2349) | M365: =H365-F365+1 -> 350 | N365: =12*(H365-F365)+I365-G365+1 -> 4200
A366: ='CGCM(T47)'!F$2 -> Canadian Centre for Climate Modeling & Analysis | B366: ='CGCM(T47)'!F$3 -> Canada | C366: ='CGCM(T47)'!F$1 -> CGCM3.1(T47) | D366: ='CGCM(T47)'!B31 -> SRESB1 | E366: ='CGCM(T47)'!C31 -> Run 1 | F366: ='CGCM(T47)'!D31 -> 2001 | G366: ='CGCM(T47)'!E31 -> 1 | H366: ='CGCM(T47)'!F31 -> 2300 | I366: ='CGCM(T47)'!G31 -> 12 | J366: ='CGCM(T47)'!H31 -> 20C3M Run 1 | K366: ='CGCM(T47)'!I31 -> 2001 | L366: ='CGCM(T47)'!J31 -> - | M366: =H366-F366+1 -> 300 | N366: =12*(H366-F366)+I366-G366+1 -> 3600
A367: ='CGCM(T47)'!F$2 -> Canadian Centre for Climate Modeling & Analysis | B367: ='CGCM(T47)'!F$3 -> Canada | C367: ='CGCM(T47)'!F$1 -> CGCM3.1(T47) | D367: ='CGCM(T47)'!B32 -> SRESB1 | E367: ='CGCM(T47)'!C32 -> Run 2 | F367: ='CGCM(T47)'!D32 -> 2001 | G367: ='CGCM(T47)'!E32 -> 1 | H367: ='CGCM(T47)'!F32 -> 2200 | I367: ='CGCM(T47)'!G32 -> 12 | J367: ='CGCM(T47)'!H32 -> 20C3M Run 2 | K367: ='CGCM(T47)'!I32 -> 2001 | L367: ='CGCM(T47)'!J32 -> - | M367: =H367-F367+1 -> 200 | N367: =12*(H367-F367)+I367-G367+1 -> 2400
A368: ='CGCM(T47)'!F$2 -> Canadian Centre for Climate Modeling & Analysis | B368: ='CGCM(T47)'!F$3 -> Canada | C368: ='CGCM(T47)'!F$1 -> CGCM3.1(T47) | D368: ='CGCM(T47)'!B33 -> SRESB1 | E368: ='CGCM(T47)'!C33 -> Run 3 | F368: ='CGCM(T47)'!D33 -> 2001 | G368: ='CGCM(T47)'!E33 -> 1 | H368: ='CGCM(T47)'!F33 -> 2200 | I368: ='CGCM(T47)'!G33 -> 12 | J368: ='CGCM(T47)'!H33 -> 20C3M Run 3 | K368: ='CGCM(T47)'!I33 -> 2001 | L368: ='CGCM(T47)'!J33 -> - | M368: =H368-F368+1 -> 200 | N368: =12*(H368-F368)+I368-G368+1 -> 2400
A369: ='CGCM(T47)'!F$2 -> Canadian Centre for Climate Modeling & Analysis | B369: ='CGCM(T47)'!F$3 -> Canada | C369: ='CGCM(T47)'!F$1 -> CGCM3.1(T47) | D369: ='CGCM(T47)'!B34 -> SRESB1 | E369: ='CGCM(T47)'!C34 -> Run 4 | F369: ='CGCM(T47)'!D34 -> 2001 | G369: ='CGCM(T47)'!E34 -> 1 | H369: ='CGCM(T47)'!F34 -> 2200 | I369: ='CGCM(T47)'!G34 -> 12 | J369: ='CGCM(T47)'!H34 -> 20C3M Run 4 | K369: ='CGCM(T47)'!I34 -> 2001 | L369: ='CGCM(T47)'!J34 -> - | M369: =H369-F369+1 -> 200 | N369: =12*(H369-F369)+I369-G369+1 -> 2400
A370: ='CGCM(T47)'!F$2 -> Canadian Centre for Climate Modeling & Analysis | B370: ='CGCM(T47)'!F$3 -> Canada | C370: ='CGCM(T47)'!F$1 -> CGCM3.1(T47) | D370: ='CGCM(T47)'!B35 -> SRESB1 | E370: ='CGCM(T47)'!C35 -> Run 5 | F370: ='CGCM(T47)'!D35 -> 2001 | G370: ='CGCM(T47)'!E35 -> 1 | H370: ='CGCM(T47)'!F35 -> 2100 | I370: ='CGCM(T47)'!G35 -> 12 | J370: ='CGCM(T47)'!H35 -> 20C3M Run 5 | K370: ='CGCM(T47)'!I35 -> 2001 | L370: ='CGCM(T47)'!J35 -> - | M370: =H370-F370+1 -> 100 | N370: =12*(H370-F370)+I370-G370+1 -> 1200
A371: ='CGCM(T63)'!F$2 -> Canadian Centre for Climate Modeling & Analysis | B371: ='CGCM(T63)'!F$3 -> Canada | C371: ='CGCM(T63)'!F$1 -> CGCM3.1(T63) | D371: ='CGCM(T63)'!B13 -> SRESB1 | E371: ='CGCM(T63)'!C13 -> Run 1 | F371: ='CGCM(T63)'!D13 -> 2001 | G371: ='CGCM(T63)'!E13 -> 1 | H371: ='CGCM(T63)'!F13 -> 2260 | I371: ='CGCM(T63)'!G13 -> 12 | J371: ='CGCM(T63)'!H13 -> 20C3M Run 1 | K371: ='CGCM(T63)'!I13 -> 2001 | L371: ='CGCM(T63)'!J13 -> - | M371: =H371-F371+1 -> 260 | N371: =12*(H371-F371)+I371-G371+1 -> 3120
A372: =CNRM!F$2 -> Météo-France / Centre National de Recherches Météorologiques | B372: =CNRM!F$3 -> France | C372: =CNRM!F$1 -> CNRM-CM3 | D372: =CNRM!B16 -> SRESB1 | E372: =CNRM!C16 -> Run 1 | F372: =CNRM!D16 -> 2000 | G372: =CNRM!E16 -> 1 | H372: =CNRM!F16 -> 2300 | I372: =CNRM!G16 -> 12 | J372: =CNRM!H16 -> 20C3M Run 1 | K372: =CNRM!I16 -> 2000 | L372: =CNRM!J16 -> - | M372: =H372-F372+1 -> 301 | N372: =12*(H372-F372)+I372-G372+1 -> 3612
A373: ='CSIRO-3.0'!F$2 -> CSIRO Atmospheric Research | B373: ='CSIRO-3.0'!F$3 -> Australia | C373: ='CSIRO-3.0'!F$1 -> CSIRO-Mk3.0 | D373: ='CSIRO-3.0'!B17 -> SRESB1 | E373: ='CSIRO-3.0'!C17 -> Run 1 | F373: ='CSIRO-3.0'!D17 -> 2001 | G373: ='CSIRO-3.0'!E17 -> 1 | H373: ='CSIRO-3.0'!F17 -> 2300 | I373: ='CSIRO-3.0'!G17 -> 12 | J373: ='CSIRO-3.0'!H17 -> 20C3M Run 1 | K373: ='CSIRO-3.0'!I17 -> 1940* | L373: ='CSIRO-3.0'!J17 -> *Portion of run from 1940 through 2000 is not included in submitted set | M373: =H373-F373+1 -> 300 | N373: =12*(H373-F373)+I373-G373+1 -> 3600
A374: ='CSIRO-3.5'!F$2 -> CSIRO Atmospheric Research | B374: ='CSIRO-3.5'!F$3 -> Australia | C374: ='CSIRO-3.5'!F$1 -> CSIRO-Mk3.5 | D374: ='CSIRO-3.5'!B13 -> SRESB1 | E374: ='CSIRO-3.5'!C13 -> Run1 | F374: ='CSIRO-3.5'!D13 -> 2001 | G374: ='CSIRO-3.5'!E13 -> 1 | H374: ='CSIRO-3.5'!F13 -> 2300 | I374: ='CSIRO-3.5'!G13 -> 12 | J374: ='CSIRO-3.5'!H13 -> 20C3M Run 1 | K374: ='CSIRO-3.5'!I13 -> 2001 | L374: ='CSIRO-3.5'!J13 -> initialised from end of model year 300 (beginning of 2001 of 20C3M Run1). | M374: =H374-F374+1 -> 300 | N374: =12*(H374-F374)+I374-G374+1 -> 3600
A375: =ECHAM5!F$2 -> Max Planck Institute for Meteorology | B375: =ECHAM5!F$3 -> Germany | C375: =ECHAM5!F$1 -> ECHAM5/MPI-OM | D375: =ECHAM5!B28 -> SRESB1 | E375: =ECHAM5!C28 -> Run 1 | F375: =ECHAM5!D28 -> 2001 | G375: =ECHAM5!E28 -> 1 | H375: =ECHAM5!F28 -> 2200 | I375: =ECHAM5!G28 -> 12 | J375: =ECHAM5!H28 -> 20C3M | K375: =ECHAM5!I28 -> 2001 | L375: =ECHAM5!J28 -> - | M375: =H375-F375+1 -> 200 | N375: =12*(H375-F375)+I375-G375+1 -> 2400
A376: =ECHAM5!F$2 -> Max Planck Institute for Meteorology | B376: =ECHAM5!F$3 -> Germany | C376: =ECHAM5!F$1 -> ECHAM5/MPI-OM | D376: =ECHAM5!B29 -> SRESB1 | E376: =ECHAM5!C29 -> Run 2 | F376: =ECHAM5!D29 -> 2001 | G376: =ECHAM5!E29 -> 1 | H376: =ECHAM5!F29 -> 2200 | I376: =ECHAM5!G29 -> 12 | J376: =ECHAM5!H29 -> 20C3M | K376: =ECHAM5!I29 -> 2001 | L376: =ECHAM5!J29 -> - | M376: =H376-F376+1 -> 200 | N376: =12*(H376-F376)+I376-G376+1 -> 2400
A377: =ECHAM5!F$2 -> Max Planck Institute for Meteorology | B377: =ECHAM5!F$3 -> Germany | C377: =ECHAM5!F$1 -> ECHAM5/MPI-OM | D377: =ECHAM5!B30 -> SRESB1 | E377: =ECHAM5!C30 -> Run 3 | F377: =ECHAM5!D30 -> 2001 | G377: =ECHAM5!E30 -> 1 | H377: =ECHAM5!F30 -> 2200 | I377: =ECHAM5!G30 -> 12 | J377: =ECHAM5!H30 -> 20C3M | K377: =ECHAM5!I30 -> 2001 | L377: =ECHAM5!J30 -> - | M377: =H377-F377+1 -> 200 | N377: =12*(H377-F377)+I377-G377+1 -> 2400
A378: ='ECHO-G'!F$2 -> Meteorological Institute of the University of Bonn (MIUB), Meteorological Research Institute of KMA (METRI), and Model and Data group (M&D) | B378: ='ECHO-G'!F$3 -> Germany & Korea | C378: ='ECHO-G'!F$1 -> ECHO-G | D378: ='ECHO-G'!B25 -> SRESB1 | E378: ='ECHO-G'!C25 -> Run 1 | F378: ='ECHO-G'!D25 -> 2001 | G378: ='ECHO-G'!E25 -> 1 | H378: ='ECHO-G'!F25 -> 2200 | I378: ='ECHO-G'!G25 -> 12 | J378: ='ECHO-G'!H25 -> 20C3M Run 1 | K378: ='ECHO-G'!I25 -> 2001 | L378: ='ECHO-G'!J25 -> - | M378: =H378-F378+1 -> 200 | N378: =12*(H378-F378)+I378-G378+1 -> 2400
A379: ='ECHO-G'!F$2 -> Meteorological Institute of the University of Bonn (MIUB), Meteorological Research Institute of KMA (METRI), and Model and Data group (M&D) | B379: ='ECHO-G'!F$3 -> Germany & Korea | C379: ='ECHO-G'!F$1 -> ECHO-G | D379: ='ECHO-G'!B26 -> SRESB1 | E379: ='ECHO-G'!C26 -> Run 2 | F379: ='ECHO-G'!D26 -> 2001 | G379: ='ECHO-G'!E26 -> 1 | H379: ='ECHO-G'!F26 -> 2200 | I379: ='ECHO-G'!G26 -> 12 | J379: ='ECHO-G'!H26 -> 20C3M Run 2 | K379: ='ECHO-G'!I26 -> 2001 | L379: ='ECHO-G'!J26 -> - | M379: =H379-F379+1 -> 200 | N379: =12*(H379-F379)+I379-G379+1 -> 2400
A380: ='ECHO-G'!F$2 -> Meteorological Institute of the University of Bonn (MIUB), Meteorological Research Institute of KMA (METRI), and Model and Data group (M&D) | B380: ='ECHO-G'!F$3 -> Germany & Korea | C380: ='ECHO-G'!F$1 -> ECHO-G | D380: ='ECHO-G'!B27 -> SRESB1 | E380: ='ECHO-G'!C27 -> Run 3 | F380: ='ECHO-G'!D27 -> 2001 | G380: ='ECHO-G'!E27 -> 1 | H380: ='ECHO-G'!F27 -> 2200 | I380: ='ECHO-G'!G27 -> 12 | J380: ='ECHO-G'!H27 -> 20C3M Run 3 | K380: ='ECHO-G'!I27 -> 2001 | L380: ='ECHO-G'!J27 -> - | M380: =H380-F380+1 -> 200 | N380: =12*(H380-F380)+I380-G380+1 -> 2400
A381: =FGOALS!F$2 -> LASG / Institute of Atmospheric Physics | B381: =FGOALS!F$3 -> China | C381: =FGOALS!F$1 -> FGOALS-g1.0 | D381: =FGOALS!B19 -> SRESB1 | E381: =FGOALS!C19 -> Run 1 | F381: =FGOALS!D19 -> 2000 | G381: =FGOALS!E19 -> 1 | H381: =FGOALS!F19 -> 2200 | I381: =FGOALS!G19 -> 12 | J381: =FGOALS!H19 -> 20C3M Run 1 | K381: =FGOALS!I19 -> 2000 | L381: =FGOALS!J19 -> - | M381: =H381-F381+1 -> 201 | N381: =12*(H381-F381)+I381-G381+1 -> 2412
A382: =FGOALS!F$2 -> LASG / Institute of Atmospheric Physics | B382: =FGOALS!F$3 -> China | C382: =FGOALS!F$1 -> FGOALS-g1.0 | D382: =FGOALS!B20 -> SRESB1 | E382: =FGOALS!C20 -> Run 2 | F382: =FGOALS!D20 -> 2000 | G382: =FGOALS!E20 -> 1 | H382: =FGOALS!F20 -> 2200 | I382: =FGOALS!G20 -> 12 | J382: =FGOALS!H20 -> 20C3M Run 2 | K382: =FGOALS!I20 -> 2000 | L382: =FGOALS!J20 -> - | M382: =H382-F382+1 -> 201 | N382: =12*(H382-F382)+I382-G382+1 -> 2412
A383: =FGOALS!F$2 -> LASG / Institute of Atmospheric Physics | B383: =FGOALS!F$3 -> China | C383: =FGOALS!F$1 -> FGOALS-g1.0 | D383: =FGOALS!B21 -> SRESB1 | E383: =FGOALS!C21 -> Run 3 | F383: =FGOALS!D21 -> 2000 | G383: =FGOALS!E21 -> 1 | H383: =FGOALS!F21 -> 2200 | I383: =FGOALS!G21 -> 12 | J383: =FGOALS!H21 -> 20C3M Run 3 | K383: =FGOALS!I21 -> 2000 | L383: =FGOALS!J21 -> - | M383: =H383-F383+1 -> 201 | N383: =12*(H383-F383)+I383-G383+1 -> 2412
A384: ='GFDL-2.0'!F$2 -> US Dept. of Commerce / NOAA / Geophysical Fluid Dynamics Laboratory | B384: ='GFDL-2.0'!F$3 -> USA | C384: ='GFDL-2.0'!F$1 -> GFDL-CM2.0 | D384: ='GFDL-2.0'!B15 -> SRESB1 | E384: ='GFDL-2.0'!C15 -> Run 1 | F384: ='GFDL-2.0'!D15 -> 2001 | G384: ='GFDL-2.0'!E15 -> 1 | H384: ='GFDL-2.0'!F15 -> 2300 | I384: ='GFDL-2.0'!G15 -> 12 | J384: ='GFDL-2.0'!H15 -> 20C3M Run 1 | K384: ='GFDL-2.0'!I15 -> 2001 | L384: ='GFDL-2.0'!J15 -> - | M384: =H384-F384+1 -> 300 | N384: =12*(H384-F384)+I384-G384+1 -> 3600
A385: ='GFDL-2.1'!F$2 -> US Dept. of Commerce / NOAA / Geophysical Fluid Dynamics Laboratory | B385: ='GFDL-2.1'!F$3 -> USA | C385: ='GFDL-2.1'!F$1 -> GFDL-CM2.1 | D385: ='GFDL-2.1'!B18 -> SRESB1 | E385: ='GFDL-2.1'!C18 -> Run 1 | F385: ='GFDL-2.1'!D18 -> 2001 | G385: ='GFDL-2.1'!E18 -> 1 | H385: ='GFDL-2.1'!F18 -> 2300 | I385: ='GFDL-2.1'!G18 -> 12 | J385: ='GFDL-2.1'!H18 -> 20C3M Run 2 | K385: ='GFDL-2.1'!I18 -> 2001 | L385: ='GFDL-2.1'!J18 -> - | M385: =H385-F385+1 -> 300 | N385: =12*(H385-F385)+I385-G385+1 -> 3600
A386: ='GISS-AOM'!F$2 -> NASA / Goddard Institute for Space Studies | B386: ='GISS-AOM'!F$3 -> USA | C386: ='GISS-AOM'!F$1 -> GISS-AOM | D386: ='GISS-AOM'!B12 -> SRESB1 | E386: ='GISS-AOM'!C12 -> Run 1 | F386: ='GISS-AOM'!D12 -> 2001 | G386: ='GISS-AOM'!E12 -> 1 | H386: ='GISS-AOM'!F12 -> 2100 | I386: ='GISS-AOM'!G12 -> 12 | J386: ='GISS-AOM'!H12 -> 20C3M Run 1 | K386: ='GISS-AOM'!I12 -> 2001 | L386: ='GISS-AOM'!J12 -> C084 | M386: =H386-F386+1 -> 100 | N386: =12*(H386-F386)+I386-G386+1 -> 1200
A387: ='GISS-AOM'!F$2 -> NASA / Goddard Institute for Space Studies | B387: ='GISS-AOM'!F$3 -> USA | C387: ='GISS-AOM'!F$1 -> GISS-AOM | D387: ='GISS-AOM'!B13 -> SRESB1 | E387: ='GISS-AOM'!C13 -> Run 2 | F387: ='GISS-AOM'!D13 -> 2001 | G387: ='GISS-AOM'!E13 -> 1 | H387: ='GISS-AOM'!F13 -> 2100 | I387: ='GISS-AOM'!G13 -> 12 | J387: ='GISS-AOM'!H13 -> 20C3M Run 2 | K387: ='GISS-AOM'!I13 -> 2001 | L387: ='GISS-AOM'!J13 -> C094 | M387: =H387-F387+1 -> 100 | N387: =12*(H387-F387)+I387-G387+1 -> 1200
A388: ='GISS-ER'!F$2 -> NASA / Goddard Institute for Space Studies | B388: ='GISS-ER'!F$3 -> USA | C388: ='GISS-ER'!F$1 -> GISS-ER | D388: ='GISS-ER'!B28 -> SRESB1 | E388: ='GISS-ER'!C28 -> Run 1 | F388: ='GISS-ER'!D28 -> 2004 | G388: ='GISS-ER'!E28 -> 1 | H388: ='GISS-ER'!F28 -> 2300 | I388: ='GISS-ER'!G28 -> 12 | J388: ='GISS-ER'!H28 -> 20C3M Run 3 | K388: ='GISS-ER'!I28 -> 2004 | L388: ='GISS-ER'!J28 -> - | M388: =H388-F388+1 -> 297 | N388: =12*(H388-F388)+I388-G388+1 -> 3564
A389: =INM!F$2 -> Institute for Numerical Mathematics | B389: =INM!F$3 -> Russia | C389: =INM!F$1 -> INM-CM3.0 | D389: =INM!B16 -> SRESB1 | E389: =INM!C16 -> Run 1 | F389: =INM!D16 -> 2001 | G389: =INM!E16 -> 1 | H389: =INM!F16 -> 2200 | I389: =INM!G16 -> 12 | J389: =INM!H16 -> 20C3M | K389: =INM!I16 -> 2001 | L389: =INM!J16 -> - | M389: =H389-F389+1 -> 200 | N389: =12*(H389-F389)+I389-G389+1 -> 2400
A390: =IPSL!F$2 -> Institut Pierre Simon Laplace | B390: =IPSL!F$3 -> France | C390: =IPSL!F$1 -> IPSL-CM4 | D390: =IPSL!B14 -> SRESB1 | E390: =IPSL!C14 -> Run 1 | F390: =IPSL!D14 -> 2000 | G390: =IPSL!E14 -> 1 | H390: =IPSL!F14 -> 2230 | I390: =IPSL!G14 -> 12 | J390: =IPSL!H14 -> 20C3M Run 0 | K390: =IPSL!I14 -> 2000 | L390: =IPSL!J14 -> Run 0 (not sent to PCMDI) is exactly the same as RUN 1 until year 1970, then it differs because of a bug reading the file of sulfate from year 1970 to 1975. We verify that the climate of year 2000 of RUN 0 is very close to climate of year 2000 of run 1. | M390: =H390-F390+1 -> 231 | N390: =12*(H390-F390)+I390-G390+1 -> 2772
A391: ='MIROC(hires)'!F$2 -> Center for Climate System Research (The University of Tokyo), National Institute for Environmental Studies, and Frontier Research Center for Global Change (JAMSTEC) | B391: ='MIROC(hires)'!F$3 -> Japan | C391: ='MIROC(hires)'!F$1 -> MIROC3.2(hires) | D391: ='MIROC(hires)'!B13 -> SRESB1 | E391: ='MIROC(hires)'!C13 -> Run 1 | F391: ='MIROC(hires)'!D13 -> 2001 | G391: ='MIROC(hires)'!E13 -> 1 | H391: ='MIROC(hires)'!F13 -> 2100 | I391: ='MIROC(hires)'!G13 -> 12 | J391: ='MIROC(hires)'!H13 -> 20C3M Run 1 | K391: ='MIROC(hires)'!I13 -> 2001 | L391: ='MIROC(hires)'!J13 -> The initial condition is the end of the 20C3M run. | M391: =H391-F391+1 -> 100 | N391: =12*(H391-F391)+I391-G391+1 -> 1200
A392: ='MIROC(medres)'!F$2 -> Center for Climate System Research (The University of Tokyo), National Institute for Environmental Studies, and Frontier Research Center for Global Change (JAMSTEC) | B392: ='MIROC(medres)'!F$3 -> Japan | C392: ='MIROC(medres)'!F$1 -> MIROC3.2(medres) | D392: ='MIROC(medres)'!B28 -> SRESB1 | E392: ='MIROC(medres)'!C28 -> Run 1 | F392: ='MIROC(medres)'!D28 -> 2001 | G392: ='MIROC(medres)'!E28 -> 1 | H392: ='MIROC(medres)'!F28 -> 2300 | I392: ='MIROC(medres)'!G28 -> 12 | J392: ='MIROC(medres)'!H28 -> 20C3M Run 1 | K392: ='MIROC(medres)'!I28 -> 2001 | L392: ='MIROC(medres)'!J28 -> The initial condition is the end of the corresponding 20C3M run. | M392: =H392-F392+1 -> 300 | N392: =12*(H392-F392)+I392-G392+1 -> 3600
A393: ='MIROC(medres)'!F$2 -> Center for Climate System Research (The University of Tokyo), National Institute for Environmental Studies, and Frontier Research Center for Global Change (JAMSTEC) | B393: ='MIROC(medres)'!F$3 -> Japan | C393: ='MIROC(medres)'!F$1 -> MIROC3.2(medres) | D393: ='MIROC(medres)'!B29 -> SRESB1 | E393: ='MIROC(medres)'!C29 -> Run 2 | F393: ='MIROC(medres)'!D29 -> 2001 | G393: ='MIROC(medres)'!E29 -> 1 | H393: ='MIROC(medres)'!F29 -> 2100 | I393: ='MIROC(medres)'!G29 -> 12 | J393: ='MIROC(medres)'!H29 -> 20C3M Run 2 | K393: ='MIROC(medres)'!I29 -> 2001 | L393: ='MIROC(medres)'!J29 -> The initial condition is the end of the corresponding 20C3M run. | M393: =H393-F393+1 -> 100 | N393: =12*(H393-F393)+I393-G393+1 -> 1200
A394: ='MIROC(medres)'!F$2 -> Center for Climate System Research (The University of Tokyo), National Institute for Environmental Studies, and Frontier Research Center for Global Change (JAMSTEC) | B394: ='MIROC(medres)'!F$3 -> Japan | C394: ='MIROC(medres)'!F$1 -> MIROC3.2(medres) | D394: ='MIROC(medres)'!B30 -> SRESB1 | E394: ='MIROC(medres)'!C30 -> Run 3 | F394: ='MIROC(medres)'!D30 -> 2001 | G394: ='MIROC(medres)'!E30 -> 1 | H394: ='MIROC(medres)'!F30 -> 2100 | I394: ='MIROC(medres)'!G30 -> 12 | J394: ='MIROC(medres)'!H30 -> 20C3M Run 3 | K394: ='MIROC(medres)'!I30 -> 2001 | L394: ='MIROC(medres)'!J30 -> The initial condition is the end of the corresponding 20C3M run. | M394: =H394-F394+1 -> 100 | N394: =12*(H394-F394)+I394-G394+1 -> 1200
A395: =MRI!F$2 -> Meteorological Research Institute | B395: =MRI!F$3 -> Japan | C395: =MRI!F$1 -> MRI-CGCM2.3.2 | D395: =MRI!B29 -> SRESB1 | E395: =MRI!C29 -> Run 1 | F395: =MRI!D29 -> 1990 | G395: =MRI!E29 -> 1 | H395: =MRI!F29 -> 2300 | I395: =MRI!G29 -> 12 | J395: =MRI!H29 -> 20C3M Run 1 | K395: =MRI!I29 -> 1990 | L395: =MRI!J29 -> - | M395: =H395-F395+1 -> 311 | N395: =12*(H395-F395)+I395-G395+1 -> 3732
A396: =MRI!F$2 -> Meteorological Research Institute | B396: =MRI!F$3 -> Japan | C396: =MRI!F$1 -> MRI-CGCM2.3.2 | D396: =MRI!B30 -> SRESB1 | E396: =MRI!C30 -> Run 2 | F396: =MRI!D30 -> 1990 | G396: =MRI!E30 -> 1 | H396: =MRI!F30 -> 2100 | I396: =MRI!G30 -> 12 | J396: =MRI!H30 -> 20C3M Run 2 | K396: =MRI!I30 -> 1990 | L396: =MRI!J30 -> - | M396: =H396-F396+1 -> 111 | N396: =12*(H396-F396)+I396-G396+1 -> 1332
A397: =MRI!F$2 -> Meteorological Research Institute | B397: =MRI!F$3 -> Japan | C397: =MRI!F$1 -> MRI-CGCM2.3.2 | D397: =MRI!B31 -> SRESB1 | E397: =MRI!C31 -> Run 3 | F397: =MRI!D31 -> 1990 | G397: =MRI!E31 -> 1 | H397: =MRI!F31 -> 2100 | I397: =MRI!G31 -> 12 | J397: =MRI!H31 -> 20C3M Run 3 | K397: =MRI!I31 -> 1990 | L397: =MRI!J31 -> - | M397: =H397-F397+1 -> 111 | N397: =12*(H397-F397)+I397-G397+1 -> 1332
A398: =MRI!F$2 -> Meteorological Research Institute | B398: =MRI!F$3 -> Japan | C398: =MRI!F$1 -> MRI-CGCM2.3.2 | D398: =MRI!B32 -> SRESB1 | E398: =MRI!C32 -> Run 4 | F398: =MRI!D32 -> 1990 | G398: =MRI!E32 -> 1 | H398: =MRI!F32 -> 2100 | I398: =MRI!G32 -> 12 | J398: =MRI!H32 -> 20C3M Run 4 | K398: =MRI!I32 -> 1990 | L398: =MRI!J32 -> - | M398: =H398-F398+1 -> 111 | N398: =12*(H398-F398)+I398-G398+1 -> 1332
A399: =MRI!F$2 -> Meteorological Research Institute | B399: =MRI!F$3 -> Japan | C399: =MRI!F$1 -> MRI-CGCM2.3.2 | D399: =MRI!B33 -> SRESB1 | E399: =MRI!C33 -> Run 5 | F399: =MRI!D33 -> 1990 | G399: =MRI!E33 -> 1 | H399: =MRI!F33 -> 2100 | I399: =MRI!G33 -> 12 | J399: =MRI!H33 -> 20C3M Run 5 | K399: =MRI!I33 -> 1990 | L399: =MRI!J33 -> - | M399: =H399-F399+1 -> 111 | N399: =12*(H399-F399)+I399-G399+1 -> 1332
A400: =PCM!F$2 -> National Center for Atmospheric Research | B400: =PCM!F$3 -> USA | C400: =PCM!F$1 -> PCM | D400: =PCM!B33 -> SRESB1 | E400: =PCM!C33 -> Run 1 | F400: =PCM!D33 -> 2000 | G400: =PCM!E33 -> 1 | H400: =PCM!F33 -> 2299 | I400: =PCM!G33 -> 12 | J400: =PCM!H33 -> NA | K400: =PCM!I33 -> 2000 | L400: =PCM!J33 -> B07.57a; this run did not branch directly from the control run, but from January 1, 2000 of a ghg+sulfate+ozone run, which began in 1870 and branched from year 100 of the Picntrl Run 1. Thus, year 2000 of this run correponds to year 230 of the control run, but presumably has already strayed from the control run because of the 130 years under ghg+sulfate+ozone forcing. | M400: =H400-F400+1 -> 300 | N400: =12*(H400-F400)+I400-G400+1 -> 3600
A401: =PCM!F$2 -> National Center for Atmospheric Research | B401: =PCM!F$3 -> USA | C401: =PCM!F$1 -> PCM | D401: =PCM!B34 -> SRESB1 | E401: =PCM!C34 -> Run 2 | F401: =PCM!D34 -> 2000 | G401: =PCM!E34 -> 1 | H401: =PCM!F34 -> 2099 | I401: =PCM!G34 -> 12 | J401: =PCM!H34 -> NA | K401: =PCM!I34 -> 2000 | L401: =PCM!J34 -> B07.71b; this run did not branch directly from the control run, but from January 1, 2000 of a ghg+sulfate+ozone run, which began in 1870 and branched from year 110 of the Picntrl Run 1. Thus, year 2000 of this run correponds to year 240 of the control run, but presumably has already strayed from the control run because of the 130 years under ghg+sulfate+ozone forcing. | M401: =H401-F401+1 -> 100 | N401: =12*(H401-F401)+I401-G401+1 -> 1200
A402: =PCM!F$2 -> National Center for Atmospheric Research | B402: =PCM!F$3 -> USA | C402: =PCM!F$1 -> PCM | D402: =PCM!B35 -> SRESB1 | E402: =PCM!C35 -> Run 3 | F402: =PCM!D35 -> 2000 | G402: =PCM!E35 -> 1 | H402: =PCM!F35 -> 2199 | I402: =PCM!G35 -> 12 | J402: =PCM!H35 -> NA | K402: =PCM!I35 -> 2000 | L402: =PCM!J35 -> B07.71c; this run did not branch directly from the control run, but from January 1, 2000 of a ghg+sulfate+ozone run, which began in 1870 and branched from year 170 of the Picntrl Run 1. Thus, year 2000 of this run correponds to year 300 of the control run, but presumably has already strayed from the control run because of the 130 years under ghg+sulfate+ozone forcing. | M402: =H402-F402+1 -> 200 | N402: =12*(H402-F402)+I402-G402+1 -> 2400
A403: =PCM!F$2 -> National Center for Atmospheric Research | B403: =PCM!F$3 -> USA | C403: =PCM!F$1 -> PCM | D403: =PCM!B36 -> SRESB1 | E403: =PCM!C36 -> Run 4 | F403: =PCM!D36 -> 2000 | G403: =PCM!E36 -> 1 | H403: =PCM!F36 -> 2199 | I403: =PCM!G36 -> 12 | J403: =PCM!H36 -> NA | K403: =PCM!I36 -> 2000 | L403: =PCM!J36 -> B07.57d (2000-2099) B07.77 (2100-2199); this run did not branch directly from the control run, but from January 1, 2000 of a ghg+sulfate+ozone run, which began in 1870 and branched from year 140 of the Picntrl Run 1. Thus, year 2000 of this run correponds to year 270 of the control run, but presumably has already strayed from the control run because of the 130 years under ghg+sulfate+ozone forcing. | M403: =H403-F403+1 -> 200 | N403: =12*(H403-F403)+I403-G403+1 -> 2400
A404: =HadCM3!F$2 -> Hadley Centre for Climate Prediction and Research, Met Office | B404: =HadCM3!F$3 -> UK | C404: =HadCM3!F$1 -> UKMO-HadCM3 | D404: =HadCM3!B15 -> SRESB1 | E404: =HadCM3!C15 -> Run 1 | F404: =HadCM3!D15 -> 2000 | G404: =HadCM3!E15 -> 1 | H404: =HadCM3!F15 -> 2199 | I404: =HadCM3!G15 -> 12 | J404: =HadCM3!H15 -> 20C3M Run 2 | K404: =HadCM3!I15 -> 1999 | L404: =HadCM3!J15 -> - | M404: =H404-F404+1 -> 200 | N404: =12*(H404-F404)+I404-G404+1 -> 2400
A405: =TODAY() -> 39289 | C405: NOTE: The PDF version of this table differs from the original xls (Excel spread sheet) version in that the "modeling group" and the "country" of model origin are omitted. If you get the Excel version, you will also be able to reorder the rows using the "sort" command. You could then, for example easily group together all runs by model. | M405: =SUM(M2:M404) -> 65126 | N405: =SUM(N2:N404) -> 781326